Subject,Body,label,data_source,text
"Activate your ""Le Monde"" account before it is deleted","Dear Reader, You recently requested to receive the following newsletters: Le Monde in English - Americas. Unless we are mistaken, you have not confirmed your registration. If you do not confirm, you will not be able to receive your newsletters. To start enjoying your newsletters, confirm your registration by clicking on the button below: Confirm your registration Button doesn't work? Copy and paste this link into your browser: https://secure.lemonde.fr/sfuser/onboarding/e12ab59b481edab65ed0c3ac7b908934e905f437?from=newsletters#xtor=EPR-33281075-[relance_inscription_nl]-20230519-[onboarding] Thank you for choosing us. Yours sincerely, Le Monde Customer Service Benefits of your account Access to the registered edition • all free articles • managing your newsletters Access to le Monde shop • promotions • exclusive offers • special rates You are receiving this email because you have created an account with Le Monde. By subscribing to our newsletter, you agree that your email address may be used by Société Éditrice du Monde, which is responsible for processing your data, in order to have the newsletters of your choice delivered to you. In accordance with the amended ""Data Protection Act""of 06/01/1978 and the GDPR of 27 April 2016, you have the right to access, modify, port, delete and oppose the processing of your data. To exercise these rights, contact Le Monde ’s Data Protection Officer. © Le Monde. All rights reserved. Société Éditrice du Monde SA with a capital of 124 610 348.70 euros. Head office: 67/69 Avenue Pierre Mendès France, 75013 Paris, France. Registered with the Paris Trade and Companies Register under the number 433 891 850.",1,fuzzer-LLM,"Activate your ""Le Monde"" account before it is deleted

Dear Reader, You recently requested to receive the following newsletters: Le Monde in English - Americas. Unless we are mistaken, you have not confirmed your registration. If you do not confirm, you will not be able to receive your newsletters. To start enjoying your newsletters, confirm your registration by clicking on the button below: Confirm your registration Button doesn't work? Copy and paste this link into your browser: https://secure.lemonde.fr/sfuser/onboarding/e12ab59b481edab65ed0c3ac7b908934e905f437?from=newsletters#xtor=EPR-33281075-[relance_inscription_nl]-20230519-[onboarding] Thank you for choosing us. Yours sincerely, Le Monde Customer Service Benefits of your account Access to the registered edition • all free articles • managing your newsletters Access to le Monde shop • promotions • exclusive offers • special rates You are receiving this email because you have created an account with Le Monde. By subscribing to our newsletter, you agree that your email address may be used by Société Éditrice du Monde, which is responsible for processing your data, in order to have the newsletters of your choice delivered to you. In accordance with the amended ""Data Protection Act""of 06/01/1978 and the GDPR of 27 April 2016, you have the right to access, modify, port, delete and oppose the processing of your data. To exercise these rights, contact Le Monde ’s Data Protection Officer. © Le Monde. All rights reserved. Société Éditrice du Monde SA with a capital of 124 610 348.70 euros. Head office: 67/69 Avenue Pierre Mendès France, 75013 Paris, France. Registered with the Paris Trade and Companies Register under the number 433 891 850."
[ILUG] Re: Sun Solaris,Al white wrote: >erm... it runs Solaris x86 as standard... It runs Solaris 8 x86 as standard. (I was joking Al) M. -- Irish Linux Users' Group: ilug@linux.ie http://www.linux.ie/mailman/listinfo/ilug for (un)subscription information. List maintainer: listmaster@linux.ie,0,fuzzer-LLM,"[ILUG] Re: Sun Solaris

Al white wrote: >erm... it runs Solaris x86 as standard... It runs Solaris 8 x86 as standard. (I was joking Al) M. -- Irish Linux Users' Group: ilug@linux.ie http://www.linux.ie/mailman/listinfo/ilug for (un)subscription information. List maintainer: listmaster@linux.ie"
FNC Alert,"DOW CLOSES UP MORE THAN 300 POINTS IN BROAD RALLY **Watch FOX News Channel or go to http://foxnews.com for more ================================================= This e-mail is never sent unsolicited. You have received this FOX News Alert because you subscribed to it or someone forwarded it to you. To unsubscribe from FOX News Alerts, or to add/remove a new e-mail address, log on to: http://www.foxnews.com/alerts/unsubscribe.html Copyright 2008 FOX News Network, LLC. 1211 Avenue of the Americas. New York. NY. All Rights Reserved. =================================================",0,fuzzer-LLM,"FNC Alert

DOW CLOSES UP MORE THAN 300 POINTS IN BROAD RALLY **Watch FOX News Channel or go to http://foxnews.com for more ================================================= This e-mail is never sent unsolicited. You have received this FOX News Alert because you subscribed to it or someone forwarded it to you. To unsubscribe from FOX News Alerts, or to add/remove a new e-mail address, log on to: http://www.foxnews.com/alerts/unsubscribe.html Copyright 2008 FOX News Network, LLC. 1211 Avenue of the Americas. New York. NY. All Rights Reserved. ================================================="
There’s a new Vinay Menon column online now,"New from Vinay Menon Just published: The QAnon Shaman is free, but his remorse for the Jan. 6 riot may still be behind bars ‌ ‌ ‌ ‌ ‌ ‌ ‌ ‌ ‌ ‌ ‌ ‌ ‌ ‌ ‌ ‌ ‌ ‌ ‌ ‌ ‌ ‌ ‌ ‌ ‌ ‌ ‌ ‌ ‌ ‌ ‌ ‌ ‌ ‌ ‌ ‌ ‌ ‌ ‌ ‌ ‌ ‌ ‌ ‌ ‌ ‌ ‌ ‌ ‌ ‌ ‌ ‌ ‌ ‌ ‌ ‌ ‌ ‌ ‌ ‌ ‌ ‌ ‌ ‌ ‌ ‌ ‌ ‌ ‌ ‌ ‌ ‌ ‌ ‌ ‌ ‌ ‌ ‌ ‌ ‌ ‌ ‌ ‌ ‌ ‌ ‌ ‌ ‌ ‌ ‌ ‌ ‌ ‌ ‌ ‌ ‌ ‌ ‌ ‌ ‌ ‌ ‌ ‌ ‌ ‌ ‌ ‌ ‌ ‌ ‌ ‌ ‌ ‌ ‌ ‌ ‌ ‌ ‌ ‌ ‌ ‌ ‌ ‌ ‌ ‌ ‌ ‌ ‌ ‌ ‌ ‌ ‌ ‌ ‌ ‌ ‌ ‌ ‌ ‌ ‌ ‌ ‌ ‌ New from Vinay Menon OPINION The QAnon Shaman is free, but his remorse for the Jan. 6 riot may still be behind bars Read more » Looking for more from Vinay Menon? Here are more of his latest columns on thestar.com. Get unlimited access to the Star Last chance: Only $1/week for 52 weeks Get This Offer If you're not enjoying these emails, please tell us how we can make them better by emailing storyalertfeedback@thestar.ca. Or, if you'd prefer, you can unsubscribe from this story alert by clicking the first link below. Unsubscribe From This Story Alert Sign Up for More Newsletters and Email Alerts View in Browser Toronto Star Newspapers Limited. 8 Spadina Avenue, 10th Floor, Toronto, ON M5V 0S8. 416-367-2000 PRIVACY POLICY - - - - - - - - - - - - - - - - - - - - - - - - - - - - - - - - -",1,fuzzer-LLM,"There’s a new Vinay Menon column online now

New from Vinay Menon Just published: The QAnon Shaman is free, but his remorse for the Jan. 6 riot may still be behind bars ‌ ‌ ‌ ‌ ‌ ‌ ‌ ‌ ‌ ‌ ‌ ‌ ‌ ‌ ‌ ‌ ‌ ‌ ‌ ‌ ‌ ‌ ‌ ‌ ‌ ‌ ‌ ‌ ‌ ‌ ‌ ‌ ‌ ‌ ‌ ‌ ‌ ‌ ‌ ‌ ‌ ‌ ‌ ‌ ‌ ‌ ‌ ‌ ‌ ‌ ‌ ‌ ‌ ‌ ‌ ‌ ‌ ‌ ‌ ‌ ‌ ‌ ‌ ‌ ‌ ‌ ‌ ‌ ‌ ‌ ‌ ‌ ‌ ‌ ‌ ‌ ‌ ‌ ‌ ‌ ‌ ‌ ‌ ‌ ‌ ‌ ‌ ‌ ‌ ‌ ‌ ‌ ‌ ‌ ‌ ‌ ‌ ‌ ‌ ‌ ‌ ‌ ‌ ‌ ‌ ‌ ‌ ‌ ‌ ‌ ‌ ‌ ‌ ‌ ‌ ‌ ‌ ‌ ‌ ‌ ‌ ‌ ‌ ‌ ‌ ‌ ‌ ‌ ‌ ‌ ‌ ‌ ‌ ‌ ‌ ‌ ‌ ‌ ‌ ‌ ‌ ‌ ‌ New from Vinay Menon OPINION The QAnon Shaman is free, but his remorse for the Jan. 6 riot may still be behind bars Read more » Looking for more from Vinay Menon? Here are more of his latest columns on thestar.com. Get unlimited access to the Star Last chance: Only $1/week for 52 weeks Get This Offer If you're not enjoying these emails, please tell us how we can make them better by emailing storyalertfeedback@thestar.ca. Or, if you'd prefer, you can unsubscribe from this story alert by clicking the first link below. Unsubscribe From This Story Alert Sign Up for More Newsletters and Email Alerts View in Browser Toronto Star Newspapers Limited. 8 Spadina Avenue, 10th Floor, Toronto, ON M5V 0S8. 416-367-2000 PRIVACY POLICY - - - - - - - - - - - - - - - - - - - - - - - - - - - - - - - - -"
USAA REQUEST YOUR APPROVAL FOR AN INCOMING ACCOUNT DEPOSIT,"To ensure delivery to your inbox, please add USAA.Web.Services@customermail.usaa.com to your address book. Payment Approval Notification View Accounts | Privacy Promise | Contact Us USAA SECURITY ZONE USAA # ending in: - XXXX Dear Customer, A payment was transffered to your account from another US bank account using the Authomated Clearing House (ACH). For security reasons, We have temporarily hold the payment until necessary verification is done. You are to sign on and verify your account as a means to accept the payment. Payment will be posted within 2-3 business working days after your verification. Approve Your Payment Thank you, USAA P.S. Texting and driving ... it can wait. Take the pledge to never text and drive. Please do not reply to this e-mail. To send a secure message to USAA, please contact us. Privacy Promise USAA, 9800 Fredericksburg Road, San Antonio, Texas 78288 USAA means United Services Automobile Association and its insurance, banking, investment and other companies. Banks Member FDIC. Investments provided by USAA Investment Management Company and USAA Financial Advisors Inc., both registered broker dealers. 66676-0514 To ensure delivery to your inbox, please add USAA.Web.Services@customermail.usaa.com to your address book. Payment Approval Notification View Accounts | Privacy Promise | Contact Us USAA SECURITY ZONEÂ USAA # ending in: - XXXX Â Dear Customer,A payment was transffered to your account from another US bank account using the Authomated Clearing House (ACH). For security reasons, We have temporarily hold the payment until necessary verification is done. You are to sign on and verify your account as a means to accept the payment. Payment will be posted within 2-3 business working days after your verification. Approve Your Payment Thank you,USAA P.S. Texting and driving ... it can wait. Take the pledge to never text and drive. Â Â Â Â Please do not reply to this e-mail. To send a secure message to USAA, please contact us.Privacy PromiseUSAA, 9800 Fredericksburg Road, San Antonio, Texas 78288 USAA means United Services Automobile Association and its insurance, banking, investment and other companies. Banks Member FDIC. Investments provided by USAA Investment Management Company and USAA Financial Advisors Inc., both registered broker dealers. 66676-0514",1,fuzzer-LLM,"USAA REQUEST YOUR APPROVAL FOR AN INCOMING ACCOUNT DEPOSIT

To ensure delivery to your inbox, please add USAA.Web.Services@customermail.usaa.com to your address book. Payment Approval Notification View Accounts | Privacy Promise | Contact Us USAA SECURITY ZONE USAA # ending in: - XXXX Dear Customer, A payment was transffered to your account from another US bank account using the Authomated Clearing House (ACH). For security reasons, We have temporarily hold the payment until necessary verification is done. You are to sign on and verify your account as a means to accept the payment. Payment will be posted within 2-3 business working days after your verification. Approve Your Payment Thank you, USAA P.S. Texting and driving ... it can wait. Take the pledge to never text and drive. Please do not reply to this e-mail. To send a secure message to USAA, please contact us. Privacy Promise USAA, 9800 Fredericksburg Road, San Antonio, Texas 78288 USAA means United Services Automobile Association and its insurance, banking, investment and other companies. Banks Member FDIC. Investments provided by USAA Investment Management Company and USAA Financial Advisors Inc., both registered broker dealers. 66676-0514 To ensure delivery to your inbox, please add USAA.Web.Services@customermail.usaa.com to your address book. Payment Approval Notification View Accounts | Privacy Promise | Contact Us USAA SECURITY ZONEÂ USAA # ending in: - XXXX Â Dear Customer,A payment was transffered to your account from another US bank account using the Authomated Clearing House (ACH). For security reasons, We have temporarily hold the payment until necessary verification is done. You are to sign on and verify your account as a means to accept the payment. Payment will be posted within 2-3 business working days after your verification. Approve Your Payment Thank you,USAA P.S. Texting and driving ... it can wait. Take the pledge to never text and drive. Â Â Â Â Please do not reply to this e-mail. To send a secure message to USAA, please contact us.Privacy PromiseUSAA, 9800 Fredericksburg Road, San Antonio, Texas 78288 USAA means United Services Automobile Association and its insurance, banking, investment and other companies. Banks Member FDIC. Investments provided by USAA Investment Management Company and USAA Financial Advisors Inc., both registered broker dealers. 66676-0514"
