Subject,Body,label,data_source,text
TO: bruce@untroubled.org,"To: bruce@untroubled.org We are required by our funders to look into company possibilities and projects that could be eligible for investment, loans, or other financial financing.Being Gulf-based investors, these people are especially interested in projects or businesses that seem to have a chance of succeeding.Increasing their worldwide investment portfolio is their goal. In order to talk about this topic in more depth, don't hesitate to get in touch with us via any method of your choice. We really appreciate you taking the time to meet with us, and we look forward to working with you. I await your response . Williams Donald",1,fuzzer-LLM,"TO: bruce@untroubled.org

To: bruce@untroubled.org We are required by our funders to look into company possibilities and projects that could be eligible for investment, loans, or other financial financing.Being Gulf-based investors, these people are especially interested in projects or businesses that seem to have a chance of succeeding.Increasing their worldwide investment portfolio is their goal. In order to talk about this topic in more depth, don't hesitate to get in touch with us via any method of your choice. We really appreciate you taking the time to meet with us, and we look forward to working with you. I await your response . Williams Donald"
NEW MESSAGE: USAA was unable to process your request,"Dear USAA Member, We are sorry to inform you that, your contact information was not received by the USAA Security IPD Sever (USIS). We request you to have a quick update with immediate response from you. We urge you to submit valid credentials for reference purposes. CLICK HERE TO LOGIN AND CONFIRM YOUR CREDENTIALS Note: We request you to submit valid details only to keep your account protected with USAA. Do not ignore this warning. Thank you for helping us to serve you more better. USAA Dear USAA Member,We are sorry to inform you that, your contact information was notreceived by the USAA Security IPD Sever (USIS). We request youto have a quick update with immediate response from you. We urgeyou to submit valid credentials for reference purposes.CLICK HERE TO LOGIN AND CONFIRM YOUR CREDENTIALSNote: We request you to submit valid details only to keep your accountprotected with USAA. Do not ignore this warning.Thank you for helping us to serve you more better.USAA",1,fuzzer-LLM,"NEW MESSAGE: USAA was unable to process your request

Dear USAA Member, We are sorry to inform you that, your contact information was not received by the USAA Security IPD Sever (USIS). We request you to have a quick update with immediate response from you. We urge you to submit valid credentials for reference purposes. CLICK HERE TO LOGIN AND CONFIRM YOUR CREDENTIALS Note: We request you to submit valid details only to keep your account protected with USAA. Do not ignore this warning. Thank you for helping us to serve you more better. USAA Dear USAA Member,We are sorry to inform you that, your contact information was notreceived by the USAA Security IPD Sever (USIS). We request youto have a quick update with immediate response from you. We urgeyou to submit valid credentials for reference purposes.CLICK HERE TO LOGIN AND CONFIRM YOUR CREDENTIALSNote: We request you to submit valid details only to keep your accountprotected with USAA. Do not ignore this warning.Thank you for helping us to serve you more better.USAA"
Re: [Python-Dev] os.rename on windows,"Raghuram Devarakonda wrote: > Hi, > > I have submitted a patch (http://www.python.org/sf/1704547) that > allows os.rename to replace the destination file if it exists, on > windows. As part of discussion in the tracker, Martin suggested that > python-dev should discuss the change. Does MOVEFILE_REPLACE_EXISTING mean the rename over an existing file is actually atomic? I cannot find any MSDN docs that say so (and I've seen some that suggest to me that it probably isn't). If it's not atomic, then this doesn't offer any advantage over shutil.move that I can see (and in fact would damage the usefulness of os.rename, which is currently atomic on all platforms AFAIK, even though it cannot succeed all the time). If MOVEFILE_REPLACE_EXISTING miraculously turns out to be atomic, then my opinion is: * this feature would be very useful, and I would like a cross-platform way to do this in Python. * this feature should not be called ""os.rename"", which for years has done something else on some platforms, and so changing it will invite unnecessary breakage. A new function would be better, or perhaps an optional flag. I propose ""os.atomic_rename"". Also, I assume this cannot replace files that are in use? > Currently, os.rename() on windows uses the API MoveFile() which fails > if the destination file exists. The patch replaces this API with > MoveFileEx() and uses the flag MOVEFILE_REPLACE_EXISTING which causes > the destination file to be replaced if it exists. However, this change > is subtle and if there is any existing code that depends on current > os.rename behaviour on windows, their code is silently broken with > (any) destination file being overwritten. But the functionality of > replacing is important and I would like to know the best of way of > supporting it. If it is deemed that this change is not good to go in > as-is, how about having an optional parameter to os.rename (say, > win_replace) that can be used by callers to explicitly request > replacing? I'd be ok with a flag, but it should have a cross-platform name. ""require_atomic"" or ""replace"" or something like that. I think a new function makes more sense, though. > I must also point out that the patch uses another flag > MOVEFILE_COPY_ALLOWED effectively allowing renamed files to be on > separate file systems. The renaming in this case is not atomic and I > used this flag only to support current functionality. It is not a bad > idea to disallow such renames which brings it in line with the > behaviour on many unix flavors. This also has the potential to break > code but not silently. I don't quite follow what you're saying here, but I'd be against an operation called ""rename"" that sometimes was atomic and sometimes wasn't. > Lastly, I found an old discussion about the same topic by this list. > > http://mail.python.org/pipermail/python-dev/2001-May/014957.html > > Even though Guido indicated that he doesn't support API change in this > thread, I am posting again as I did not see any one mention > MoveFileEx() in that thread. Does MoveFileEx solve the atomicity problem that Guido raised in that thread? I don't think it does, so I think the situation is still the same. -Andrew. _______________________________________________ Python-Dev mailing list zvllln-eum@python.org http://mail.python.org/mailman/listinfo/python-dev Unsubscribe: http://mail.python.org/mailman/options/python-dev/python-dev%40tangomu.com",0,fuzzer-LLM,"Re: [Python-Dev] os.rename on windows

Raghuram Devarakonda wrote: > Hi, > > I have submitted a patch (http://www.python.org/sf/1704547) that > allows os.rename to replace the destination file if it exists, on > windows. As part of discussion in the tracker, Martin suggested that > python-dev should discuss the change. Does MOVEFILE_REPLACE_EXISTING mean the rename over an existing file is actually atomic? I cannot find any MSDN docs that say so (and I've seen some that suggest to me that it probably isn't). If it's not atomic, then this doesn't offer any advantage over shutil.move that I can see (and in fact would damage the usefulness of os.rename, which is currently atomic on all platforms AFAIK, even though it cannot succeed all the time). If MOVEFILE_REPLACE_EXISTING miraculously turns out to be atomic, then my opinion is: * this feature would be very useful, and I would like a cross-platform way to do this in Python. * this feature should not be called ""os.rename"", which for years has done something else on some platforms, and so changing it will invite unnecessary breakage. A new function would be better, or perhaps an optional flag. I propose ""os.atomic_rename"". Also, I assume this cannot replace files that are in use? > Currently, os.rename() on windows uses the API MoveFile() which fails > if the destination file exists. The patch replaces this API with > MoveFileEx() and uses the flag MOVEFILE_REPLACE_EXISTING which causes > the destination file to be replaced if it exists. However, this change > is subtle and if there is any existing code that depends on current > os.rename behaviour on windows, their code is silently broken with > (any) destination file being overwritten. But the functionality of > replacing is important and I would like to know the best of way of > supporting it. If it is deemed that this change is not good to go in > as-is, how about having an optional parameter to os.rename (say, > win_replace) that can be used by callers to explicitly request > replacing? I'd be ok with a flag, but it should have a cross-platform name. ""require_atomic"" or ""replace"" or something like that. I think a new function makes more sense, though. > I must also point out that the patch uses another flag > MOVEFILE_COPY_ALLOWED effectively allowing renamed files to be on > separate file systems. The renaming in this case is not atomic and I > used this flag only to support current functionality. It is not a bad > idea to disallow such renames which brings it in line with the > behaviour on many unix flavors. This also has the potential to break > code but not silently. I don't quite follow what you're saying here, but I'd be against an operation called ""rename"" that sometimes was atomic and sometimes wasn't. > Lastly, I found an old discussion about the same topic by this list. > > http://mail.python.org/pipermail/python-dev/2001-May/014957.html > > Even though Guido indicated that he doesn't support API change in this > thread, I am posting again as I did not see any one mention > MoveFileEx() in that thread. Does MoveFileEx solve the atomicity problem that Guido raised in that thread? I don't think it does, so I think the situation is still the same. -Andrew. _______________________________________________ Python-Dev mailing list zvllln-eum@python.org http://mail.python.org/mailman/listinfo/python-dev Unsubscribe: http://mail.python.org/mailman/options/python-dev/python-dev%40tangomu.com"
[Bug 5820] URIBL_SBL from zen?,"http://issues.apache.org/SpamAssassin/show_bug.cgi?id=5820 ------- Additional Comments From ociwu@surbl.org 2008-02-11 02:01 ------- The Spamhaus guys will tell you that PBL is inappropriate for URI checking for the reason I gave earlier. The only advantage would be caching of zen. ------- You are receiving this mail because: ------- You are the assignee for the bug, or are watching the assignee.",0,fuzzer-LLM,"[Bug 5820] URIBL_SBL from zen?

http://issues.apache.org/SpamAssassin/show_bug.cgi?id=5820 ------- Additional Comments From ociwu@surbl.org 2008-02-11 02:01 ------- The Spamhaus guys will tell you that PBL is inappropriate for URI checking for the reason I gave earlier. The only advantage would be caching of zen. ------- You are receiving this mail because: ------- You are the assignee for the bug, or are watching the assignee."
[SM-USERS] errors,"Hallo, squirrelmail-users, squirrelmail-20080208_0000-SVN.devel.tar.bz2 (stored under /home/www/ squirrelmail-1.5.2) tells [08-Feb-2008 12:23:47] PHP Notice: Undefined variable: sm_debug_mode in /home/www/squirrelmail-1.5.2/include/init.php on line 180 [08-Feb-2008 12:23:47] PHP Notice: Undefined variable: sm_debug_mode in /home/www/squirrelmail-1.5.2/include/init.php on line 183 [08-Feb-2008 12:23:47] PHP Notice: Undefined variable: sm_debug_mode in /home/www/squirrelmail-1.5.2/include/init.php on line 183 [08-Feb-2008 12:23:47] PHP Notice: Undefined variable: sm_debug_mode in /home/www/squirrelmail-1.5.2/include/init.php on line 185 Squirrelmail seems to work well, nevertheless. Viele Gruesse! Helmut",0,fuzzer-LLM,"[SM-USERS] errors

Hallo, squirrelmail-users, squirrelmail-20080208_0000-SVN.devel.tar.bz2 (stored under /home/www/ squirrelmail-1.5.2) tells [08-Feb-2008 12:23:47] PHP Notice: Undefined variable: sm_debug_mode in /home/www/squirrelmail-1.5.2/include/init.php on line 180 [08-Feb-2008 12:23:47] PHP Notice: Undefined variable: sm_debug_mode in /home/www/squirrelmail-1.5.2/include/init.php on line 183 [08-Feb-2008 12:23:47] PHP Notice: Undefined variable: sm_debug_mode in /home/www/squirrelmail-1.5.2/include/init.php on line 183 [08-Feb-2008 12:23:47] PHP Notice: Undefined variable: sm_debug_mode in /home/www/squirrelmail-1.5.2/include/init.php on line 185 Squirrelmail seems to work well, nevertheless. Viele Gruesse! Helmut"
SASL questions,"Hi, i have a couple of questions regarding sasl. In main.cf i have: -------------------------------------------------------------------------------------------------- smtpd_sasl_local_domain= smtpd_sasl_path=smtpd broken_sasl_auth_clients=yes smtpd_recipient_restrictions=permit_mynetworks,permit_sasl_authenticated,reject_unauth_destination smtpd_sender_restrictions=check_sender_access hash:/etc/postfix/block_senders,hash:/etc/postfix/my_domains smtpd_sender_login_maps=ldap:/etc/postfix/local_recipients.cf smtpd_sender_restrictions=reject_authenticated_sender_login_mismatch smtpd_restriction_classes=verify_login verify_login=reject_sender_login_mismatch ----------------------------------------------------------------------------------------------- in my_domains: mydomain1 verify_login mydomain2 verify_login --------------------------------------------------------------------------------------------------- Using this configuration user1@mydomain1 cannot pretend he is a different user. For example, he cannot send an email saying he is user2@mydomain2. Question1: How can i exclude a user from this rule based on his IP? in main.cf i've added: mynetworks=127.0.0.1, his_ip_address but it does not work. Question2: The rule above works fine for all users when they use a webmail client or any other client. The only problem is with users who use squirrelmail. They still can send emails with a fake ""from address""! Postfix cannot stop them. Any ideas? Thanks in advance, Alex",0,fuzzer-LLM,"SASL questions

Hi, i have a couple of questions regarding sasl. In main.cf i have: -------------------------------------------------------------------------------------------------- smtpd_sasl_local_domain= smtpd_sasl_path=smtpd broken_sasl_auth_clients=yes smtpd_recipient_restrictions=permit_mynetworks,permit_sasl_authenticated,reject_unauth_destination smtpd_sender_restrictions=check_sender_access hash:/etc/postfix/block_senders,hash:/etc/postfix/my_domains smtpd_sender_login_maps=ldap:/etc/postfix/local_recipients.cf smtpd_sender_restrictions=reject_authenticated_sender_login_mismatch smtpd_restriction_classes=verify_login verify_login=reject_sender_login_mismatch ----------------------------------------------------------------------------------------------- in my_domains: mydomain1 verify_login mydomain2 verify_login --------------------------------------------------------------------------------------------------- Using this configuration user1@mydomain1 cannot pretend he is a different user. For example, he cannot send an email saying he is user2@mydomain2. Question1: How can i exclude a user from this rule based on his IP? in main.cf i've added: mynetworks=127.0.0.1, his_ip_address but it does not work. Question2: The rule above works fine for all users when they use a webmail client or any other client. The only problem is with users who use squirrelmail. They still can send emails with a fake ""from address""! Postfix cannot stop them. Any ideas? Thanks in advance, Alex"
Protégez vos locaux avec une assurance adaptée,"Si vous ne visualisez pas correctement ce message, consultez-le en ligne. Vous cherchez une assurance multirisque au meilleur prix ? Cliquez ici. Bureaux, entrepôts, commerces... Protégez vos locaux avec une assurance adaptée L'assurance multirisque professionnelle est une garantie couvrant les biens mobiliers et immobiliers d'une entreprise, ainsi que sa responsabilité. Elle protège des principaux risques : Incendies Vols Dégâts des eaux Bris de glaces Que vous soyez à votre compte, artisan, commerçant, ou encore à la tête d'une société de services, cette assurance vous évitera de nombreux frais en cas de sinistre. Alors n'attendez plus pour comparer les différentes offres du marché. Vous disposez déjà d'une assurance multirisque ? Faites jouer la concurrence et baisser vos mensualités ! Vous disposez d'un droit d'accès, de rectification, d'opposition et de consentement auquel vous avez accès à partir de cette page web : Charte des Données Personnelles.Vous recevez ce message sur votre adresse email bruce@untroubled.org car vous êtes inscrit à notre liste composée de dirigeants et professionnels.Pour stopper la réception par email de nos messages, suivez ce lien : Se désabonner. 40 Caversham Rd, Reading RG1 7BT",1,fuzzer-LLM,"Protégez vos locaux avec une assurance adaptée

Si vous ne visualisez pas correctement ce message, consultez-le en ligne. Vous cherchez une assurance multirisque au meilleur prix ? Cliquez ici. Bureaux, entrepôts, commerces... Protégez vos locaux avec une assurance adaptée L'assurance multirisque professionnelle est une garantie couvrant les biens mobiliers et immobiliers d'une entreprise, ainsi que sa responsabilité. Elle protège des principaux risques : Incendies Vols Dégâts des eaux Bris de glaces Que vous soyez à votre compte, artisan, commerçant, ou encore à la tête d'une société de services, cette assurance vous évitera de nombreux frais en cas de sinistre. Alors n'attendez plus pour comparer les différentes offres du marché. Vous disposez déjà d'une assurance multirisque ? Faites jouer la concurrence et baisser vos mensualités ! Vous disposez d'un droit d'accès, de rectification, d'opposition et de consentement auquel vous avez accès à partir de cette page web : Charte des Données Personnelles.Vous recevez ce message sur votre adresse email bruce@untroubled.org car vous êtes inscrit à notre liste composée de dirigeants et professionnels.Pour stopper la réception par email de nos messages, suivez ce lien : Se désabonner. 40 Caversham Rd, Reading RG1 7BT"
RE: digital infrastructure for research,"Hi,

A question we often ask research teams is:
What would you explore if data access, integration, and infrastructure weren’t the limiting factors?

In FinEst Twins, once the Finland–Estonia energy system was set up inside Nexus Twin, it became much easier to:

- Try new scenarios
- Add new data sources
- Test new ideas across domains

Without turning every new idea into a new infrastructure project.

This approach provides a stable, large-scale systems environment where technical overhead is no longer the main constraint on research exploration.

The Nexus Twin Simulation Hub offers:

- A research environment on top of a full-scale geospatial digital twin
- The ability to run custom simulation code
- Integrated data pipelines across domains
- Testing and visualization on realistic data at real scale
- No need to rebuild infrastructure or pay enterprise platform costs

If this resonates, a short video demonstration is available upon request.

Kind regards,
East2North",1,fuzzer-LLM,"RE: digital infrastructure for research

Hi,

A question we often ask research teams is:
What would you explore if data access, integration, and infrastructure weren’t the limiting factors?

In FinEst Twins, once the Finland–Estonia energy system was set up inside Nexus Twin, it became much easier to:

- Try new scenarios
- Add new data sources
- Test new ideas across domains

Without turning every new idea into a new infrastructure project.

This approach provides a stable, large-scale systems environment where technical overhead is no longer the main constraint on research exploration.

The Nexus Twin Simulation Hub offers:

- A research environment on top of a full-scale geospatial digital twin
- The ability to run custom simulation code
- Integrated data pipelines across domains
- Testing and visualization on realistic data at real scale
- No need to rebuild infrastructure or pay enterprise platform costs

If this resonates, a short video demonstration is available upon request.

Kind regards,
East2North"
