Subject,Body,label,data_source,text
You've received a new file.,"You have received a file via linkedln .pdf Views File size 2.6MB } Expires 20/01/2020. Preview / Download Â© 2019 LinkedIn Ireland Unlimited Company. LinkedIn, the LinkedIn logo, and InMail are registered trademarks of LinkedIn Corporation in the United States and/or other countries. All rights reserved. You are receiving Professional Identity Digest emails. Unsubscribe This email was intended for Lia Sloof RPP (Bestuurslid VNSa at Vereniging van Nederlandse Salarisadministrateurs (VNSa)). Learn why we included this. If you need assistance or have questions, please contact LinkedIn Customer Service. LinkedIn is a registered business name of LinkedIn Ireland Unlimited Company. Registered in Ireland as a private unlimited company, Company Number 477441 Registered Office: Wilton Plaza, Wilton Place, Dublin 2, Ireland Virus-free. www.avast.com You have received a file via linkedln Â Â .pdf Views File size 2.6MB } Expires 20/01/2020. PreviewÂ / Download Â© 2019 LinkedIn Ireland Unlimited Company. LinkedIn, the LinkedIn logo, and InMail are registered trademarks of LinkedIn Corporation in the United States and/or other countries. All rights reserved. You are receiving Professional Identity Digest emails.Â Unsubscribe This email was intended for Lia Sloof RPP (Bestuurslid VNSa at Vereniging van Nederlandse Salarisadministrateurs (VNSa)).Â Learn why we included this. If you need assistance or have questions, please contactÂ LinkedIn Customer Service. LinkedIn is a registered business name of LinkedIn Ireland Unlimited Company. Registered in Ireland as a private unlimited company, Company Number 477441 Registered Office: Wilton Plaza, Wilton Place, Dublin 2, Ireland Virus-free. www.avast.com",1,fuzzer-LLM,"You've received a new file.

You have received a file via linkedln .pdf Views File size 2.6MB } Expires 20/01/2020. Preview / Download Â© 2019 LinkedIn Ireland Unlimited Company. LinkedIn, the LinkedIn logo, and InMail are registered trademarks of LinkedIn Corporation in the United States and/or other countries. All rights reserved. You are receiving Professional Identity Digest emails. Unsubscribe This email was intended for Lia Sloof RPP (Bestuurslid VNSa at Vereniging van Nederlandse Salarisadministrateurs (VNSa)). Learn why we included this. If you need assistance or have questions, please contact LinkedIn Customer Service. LinkedIn is a registered business name of LinkedIn Ireland Unlimited Company. Registered in Ireland as a private unlimited company, Company Number 477441 Registered Office: Wilton Plaza, Wilton Place, Dublin 2, Ireland Virus-free. www.avast.com You have received a file via linkedln Â Â .pdf Views File size 2.6MB } Expires 20/01/2020. PreviewÂ / Download Â© 2019 LinkedIn Ireland Unlimited Company. LinkedIn, the LinkedIn logo, and InMail are registered trademarks of LinkedIn Corporation in the United States and/or other countries. All rights reserved. You are receiving Professional Identity Digest emails.Â Unsubscribe This email was intended for Lia Sloof RPP (Bestuurslid VNSa at Vereniging van Nederlandse Salarisadministrateurs (VNSa)).Â Learn why we included this. If you need assistance or have questions, please contactÂ LinkedIn Customer Service. LinkedIn is a registered business name of LinkedIn Ireland Unlimited Company. Registered in Ireland as a private unlimited company, Company Number 477441 Registered Office: Wilton Plaza, Wilton Place, Dublin 2, Ireland Virus-free. www.avast.com"
"Dear Email User,","Dear Email User, Your mailbox has exceeded one or more size limits set by your administrator. Your mailbox size is 164899 KB. You are to receive this warning when your mailbox reaches 160000 KB mailbox size limits: Account Would be disabled only if account owner refuses to re validate account within 48 hours of receiving this warning. To reset and re validate kindly CLICK HERE: Activate Here: http://amuhelp.jimdo.com/ Thank you? Dear Email User, Your mailbox has exceeded one or more size limits set by your administrator. Your mailbox size is 164899 KB. You are to receive this warning when your mailbox reaches 160000 KB mailbox size limits: Account Would be disabled only if account owner refuses to re validate account within 48 hours of receiving this warning. To reset and re validate kindly CLICK HERE: Activate Here: Â http://amuhelp.jimdo.com/ Thank youâ€‹",1,fuzzer-LLM,"Dear Email User,

Dear Email User, Your mailbox has exceeded one or more size limits set by your administrator. Your mailbox size is 164899 KB. You are to receive this warning when your mailbox reaches 160000 KB mailbox size limits: Account Would be disabled only if account owner refuses to re validate account within 48 hours of receiving this warning. To reset and re validate kindly CLICK HERE: Activate Here: http://amuhelp.jimdo.com/ Thank you? Dear Email User, Your mailbox has exceeded one or more size limits set by your administrator. Your mailbox size is 164899 KB. You are to receive this warning when your mailbox reaches 160000 KB mailbox size limits: Account Would be disabled only if account owner refuses to re validate account within 48 hours of receiving this warning. To reset and re validate kindly CLICK HERE: Activate Here: Â http://amuhelp.jimdo.com/ Thank youâ€‹"
[ spambayes-Bugs-1722848 ] sb_imapfilter.py failure,"Bugs item #1722848, was opened at 2007-05-21 11:41 Message generated for change (Settings changed) made by david_abrahams You can respond by visiting: https://sourceforge.net/tracker/?func=detail&atid=498103&aid=1722848&group_id=61702 Please note that this message will contain a full copy of the comment thread, including the initial issue submission, for this request, not just the latest update. Category: None Group: None Status: Open Resolution: None Priority: 5 Private: No Submitted By: David Abrahams (david_abrahams) >Assigned to: Tony Meyer (anadelonbrin) Summary: sb_imapfilter.py failure Initial Comment: There's a problem with the use of ""recent."" Please see enclosed log. ---------------------------------------------------------------------- You can respond by visiting: https://sourceforge.net/tracker/?func=detail&atid=498103&aid=1722848&group_id=61702",0,fuzzer-LLM,"[ spambayes-Bugs-1722848 ] sb_imapfilter.py failure

Bugs item #1722848, was opened at 2007-05-21 11:41 Message generated for change (Settings changed) made by david_abrahams You can respond by visiting: https://sourceforge.net/tracker/?func=detail&atid=498103&aid=1722848&group_id=61702 Please note that this message will contain a full copy of the comment thread, including the initial issue submission, for this request, not just the latest update. Category: None Group: None Status: Open Resolution: None Priority: 5 Private: No Submitted By: David Abrahams (david_abrahams) >Assigned to: Tony Meyer (anadelonbrin) Summary: sb_imapfilter.py failure Initial Comment: There's a problem with the use of ""recent."" Please see enclosed log. ---------------------------------------------------------------------- You can respond by visiting: https://sourceforge.net/tracker/?func=detail&atid=498103&aid=1722848&group_id=61702"
[Bug 5764] [review] DCC test fails on Solaris 10,"http://issues.apache.org/SpamAssassin/show_bug.cgi?id=5764 user7@gvc.ceas-challenge.cc changed: What |Removed |Added ---------------------------------------------------------------------------- Status|NEW |RESOLVED Resolution| |FIXED ------- Additional Comments From user7@gvc.ceas-challenge.cc 2008-02-10 15:38 ------- thanks... : jm 397...; svn commit -m ""bug 5764: fix test failure in t/dcc.t on Solaris 10"" t/data/spam/gtubedcc.eml Sending t/data/spam/gtubedcc.eml Transmitting file data . Committed revision 620358. ------- You are receiving this mail because: ------- You are the assignee for the bug, or are watching the assignee.",0,fuzzer-LLM,"[Bug 5764] [review] DCC test fails on Solaris 10

http://issues.apache.org/SpamAssassin/show_bug.cgi?id=5764 user7@gvc.ceas-challenge.cc changed: What |Removed |Added ---------------------------------------------------------------------------- Status|NEW |RESOLVED Resolution| |FIXED ------- Additional Comments From user7@gvc.ceas-challenge.cc 2008-02-10 15:38 ------- thanks... : jm 397...; svn commit -m ""bug 5764: fix test failure in t/dcc.t on Solaris 10"" t/data/spam/gtubedcc.eml Sending t/data/spam/gtubedcc.eml Transmitting file data . Committed revision 620358. ------- You are receiving this mail because: ------- You are the assignee for the bug, or are watching the assignee."
our top designers are up to 50% OFF!,"shop the designer sale with up to 50% off | Update Your Email Preferences New Dresses Best Sellers Sale My Favorites Beauty The Andamane Georgiana Oversized Shirt Aya Muse Mirus Pants Dundas Lucy Dress Alexis Valley Skort retrofete Vivy Skirt Bronx and Banco Selma Mini Dress RTA Tiago Top SER.O.YA Julia Set GET REVOLVE ON THE GO! Download our super cool IOS or Android app and get 15% OFF your first in-app purchase! Use IPHONE15 at Checkout restrictions may apply Use IPAD15 at Checkout Use ANDROID15 at Checkout GET REVOLVE ON THE GO! Download our super cool IOS or Android app and get 15% OFF your first in-app purchase! Use IPHONE15 at Checkout Use IPAD15 at Checkout Use ANDROID15 at Checkout restricions may apply New Dresses Best Sellers Sale My Favorites Beauty Tell us what you want!UPDATE YOUR PREFERENCES Have email content suggestions?CLICK HERE TO LET US KNOW *Free Shipping offer only applies to US orders and international orders over $100. Other restrictions may apply. More information You are subscribed as REDACTED+songofstyle@gmail.com Manage your Email Preferences Unsubscribe Contact Us Privacy Policy © Eminent, Inc. All Rights Reserved • 12889 Moore Street, Cerritos, CA 90703 USA",1,fuzzer-LLM,"our top designers are up to 50% OFF!

shop the designer sale with up to 50% off | Update Your Email Preferences New Dresses Best Sellers Sale My Favorites Beauty The Andamane Georgiana Oversized Shirt Aya Muse Mirus Pants Dundas Lucy Dress Alexis Valley Skort retrofete Vivy Skirt Bronx and Banco Selma Mini Dress RTA Tiago Top SER.O.YA Julia Set GET REVOLVE ON THE GO! Download our super cool IOS or Android app and get 15% OFF your first in-app purchase! Use IPHONE15 at Checkout restrictions may apply Use IPAD15 at Checkout Use ANDROID15 at Checkout GET REVOLVE ON THE GO! Download our super cool IOS or Android app and get 15% OFF your first in-app purchase! Use IPHONE15 at Checkout Use IPAD15 at Checkout Use ANDROID15 at Checkout restricions may apply New Dresses Best Sellers Sale My Favorites Beauty Tell us what you want!UPDATE YOUR PREFERENCES Have email content suggestions?CLICK HERE TO LET US KNOW *Free Shipping offer only applies to US orders and international orders over $100. Other restrictions may apply. More information You are subscribed as REDACTED+songofstyle@gmail.com Manage your Email Preferences Unsubscribe Contact Us Privacy Policy © Eminent, Inc. All Rights Reserved • 12889 Moore Street, Cerritos, CA 90703 USA"
Re; Barclay Bank Reference attached.,"Barclay Bank Plc London have approve your payment, kindly view attached Reference Letter for more details. Best regards Jes Staley Group Chief Executive Officer Barclays Bank Plc, London.",1,fuzzer-LLM,"Re; Barclay Bank Reference attached.

Barclay Bank Plc London have approve your payment, kindly view attached Reference Letter for more details. Best regards Jes Staley Group Chief Executive Officer Barclays Bank Plc, London."
Register now - CorporateGPT,"Dear all, OpenAI's CorporateGPT is a conversational AI model designed to meet the needs of the workplace. CorporateGPT can support anything from administrative to creative work. Our organization is enthusiastic about the wide range of possibilities afforded by CorporateGPT, and glad to offer corporate access to all employees. For a seamless registration experience, simply enter your company email and password. Once you are signed in, follow the instructions to get started and learn about the real-life applications of CorporateGPT. As you explore this new tool, try using prompts like: • Review my meeting notes and propose 5 agenda items for next time. • What are the key themes emerging from this user feedback? • When is the best time to schedule a daily meeting with my team? • Find two flights arriving in Austin, TX at the same time, out of Denver, CO and New York, NY next Monday. REGISTER TODAY Register today to supercharge your work! All the best, Management",1,fuzzer-LLM,"Register now - CorporateGPT

Dear all, OpenAI's CorporateGPT is a conversational AI model designed to meet the needs of the workplace. CorporateGPT can support anything from administrative to creative work. Our organization is enthusiastic about the wide range of possibilities afforded by CorporateGPT, and glad to offer corporate access to all employees. For a seamless registration experience, simply enter your company email and password. Once you are signed in, follow the instructions to get started and learn about the real-life applications of CorporateGPT. As you explore this new tool, try using prompts like: • Review my meeting notes and propose 5 agenda items for next time. • What are the key themes emerging from this user feedback? • When is the best time to schedule a daily meeting with my team? • Find two flights arriving in Austin, TX at the same time, out of Denver, CO and New York, NY next Monday. REGISTER TODAY Register today to supercharge your work! All the best, Management"
excess secondary CD/DVD image downloading,"Hi, A noticable number of people appear to be hoarding our CD/DVD images. More importantly, my mirror server logs show that many people keep downloading files past the first image. For example last month I've had 257 distinct IPs fetching first image files, and yet 95 were also fetching second or later image files. 27% of people are supposed to have an actual need for other images, even though they have such a quality Internet access that they can download CD/DVD image files in the first place? That's really unlikely. This might be attributable to the fact that our warnings against over-downloading appear at the end of the intro section on our web pages, and some people will always skip over that, sadly. Maybe we need HEADER.html files in all relevant debian-cd/ directories, so that all mirror web servers can display the same warning? Or even better - move the non-first images to a subdirectory everywhere. That way, people would see more clearly that additional images are secondary. (Please Cc: responses to -mirrors, I'm not subscribed to -cd.) -- 2. That which causes joy or happiness. -- To UNSUBSCRIBE, email to debian-mirrors-REQUEST@lists.debian.org with a subject of ""unsubscribe"". Trouble? Contact listmaster@lists.debian.org",0,fuzzer-LLM,"excess secondary CD/DVD image downloading

Hi, A noticable number of people appear to be hoarding our CD/DVD images. More importantly, my mirror server logs show that many people keep downloading files past the first image. For example last month I've had 257 distinct IPs fetching first image files, and yet 95 were also fetching second or later image files. 27% of people are supposed to have an actual need for other images, even though they have such a quality Internet access that they can download CD/DVD image files in the first place? That's really unlikely. This might be attributable to the fact that our warnings against over-downloading appear at the end of the intro section on our web pages, and some people will always skip over that, sadly. Maybe we need HEADER.html files in all relevant debian-cd/ directories, so that all mirror web servers can display the same warning? Or even better - move the non-first images to a subdirectory everywhere. That way, people would see more clearly that additional images are secondary. (Please Cc: responses to -mirrors, I'm not subscribed to -cd.) -- 2. That which causes joy or happiness. -- To UNSUBSCRIBE, email to debian-mirrors-REQUEST@lists.debian.org with a subject of ""unsubscribe"". Trouble? Contact listmaster@lists.debian.org"
Re: [opensuse] openSUSE and faxes,"On Sunday 10 February 2008 03:53:29 Carlos E. R. wrote: > The Saturday 2008-02-09 at 21:48 +0200, Stan Goodman wrote: > > I would like to be able to send and receive faxes using my openSUSE > > v10.3 system. A bit of looking around showed that there are not many > > applications to do this -- actually only one, HylaFax, which I > > thought likely to be more capable than the combination of > > sendfax+mgetty, I have downloaded and installed HylaFax. > > > > Surprisingly, HylaFax does not sport a GUI, as far as I have been > > able to discover. I find it difficult to believe that many people, > > having acquired a sophisticated operating system like SuSE, will be > > content with command-line operation, so I have to wonder if I have > > overlooked another available application. What do people do for fax > > service in SuSE? Or do only few people use this OS for faxing? > > Hylafax is a fax server (a very good one), and as such, it doesn't need > a GUI - same as most or all services in Linux don't. However, there are De gustibus.... > many clients that can connect to hylafax and some of them are GUIs; > there are java clients, for example, that work in windows. Just have a > look at the hylafax website and choose one you like. Another reply has mentioned jHylaFax, which sounds very interesting. > > > The HylaFax webpage speaks of the need for Ghostscript. What is this > > for? Since faxes arrive in raster form, not as either ASCII codes or > > Postscript formatting information, what does Ghostscript have to > > contribute to the fax function? > > Because faxes are sent to the server as postscript, and because it > usually sends them to the user as postscript, too (or tiff or pdf, if > so configured). You don't see the raster. That answers the question. Thanks. > For example, you can configure your system as a mail server that > converts mails to faxes and sends them, and viceversa. Or you can print > to a samba printer that faxes the pages. There are many possibilities. Yes. I have found a reference to a webpage describing how to send faxes through CUPS (www.jennings.homelinux/fax_cups.html), which sounds interesting. Unfortunately, the site no longer exists, although the URL still brings up the server. > -- > Cheers, > Carlos E. R. -- Stan Goodman Qiryat Tiv'on Israel",0,fuzzer-LLM,"Re: [opensuse] openSUSE and faxes

On Sunday 10 February 2008 03:53:29 Carlos E. R. wrote: > The Saturday 2008-02-09 at 21:48 +0200, Stan Goodman wrote: > > I would like to be able to send and receive faxes using my openSUSE > > v10.3 system. A bit of looking around showed that there are not many > > applications to do this -- actually only one, HylaFax, which I > > thought likely to be more capable than the combination of > > sendfax+mgetty, I have downloaded and installed HylaFax. > > > > Surprisingly, HylaFax does not sport a GUI, as far as I have been > > able to discover. I find it difficult to believe that many people, > > having acquired a sophisticated operating system like SuSE, will be > > content with command-line operation, so I have to wonder if I have > > overlooked another available application. What do people do for fax > > service in SuSE? Or do only few people use this OS for faxing? > > Hylafax is a fax server (a very good one), and as such, it doesn't need > a GUI - same as most or all services in Linux don't. However, there are De gustibus.... > many clients that can connect to hylafax and some of them are GUIs; > there are java clients, for example, that work in windows. Just have a > look at the hylafax website and choose one you like. Another reply has mentioned jHylaFax, which sounds very interesting. > > > The HylaFax webpage speaks of the need for Ghostscript. What is this > > for? Since faxes arrive in raster form, not as either ASCII codes or > > Postscript formatting information, what does Ghostscript have to > > contribute to the fax function? > > Because faxes are sent to the server as postscript, and because it > usually sends them to the user as postscript, too (or tiff or pdf, if > so configured). You don't see the raster. That answers the question. Thanks. > For example, you can configure your system as a mail server that > converts mails to faxes and sends them, and viceversa. Or you can print > to a samba printer that faxes the pages. There are many possibilities. Yes. I have found a reference to a webpage describing how to send faxes through CUPS (www.jennings.homelinux/fax_cups.html), which sounds interesting. Unfortunately, the site no longer exists, although the URL still brings up the server. > -- > Cheers, > Carlos E. R. -- Stan Goodman Qiryat Tiv'on Israel"
PhD 6-monthly reports...,Hi All Sorry I've not got your copies of these to you yet. I'll follow this up tomorrow. Thank you Freda :-) Freda Mickisch Administrator Room IIMS 2.05 Institute of Information & Mathematical Sciences Te Kura Putaiao o Mohiohio me Pangarau Massey University (Albany) Private Bag 102904 North Shore Mail Centre Internal Mail Code AL220 Phone: 64 (9) 414 0800 extn 41062 Fax: 64 (9) 441 8136 (Internal 41058) Email: e.bsnrgtrf@massey.ac.nz,0,fuzzer-LLM,"PhD 6-monthly reports...

Hi All Sorry I've not got your copies of these to you yet. I'll follow this up tomorrow. Thank you Freda :-) Freda Mickisch Administrator Room IIMS 2.05 Institute of Information & Mathematical Sciences Te Kura Putaiao o Mohiohio me Pangarau Massey University (Albany) Private Bag 102904 North Shore Mail Centre Internal Mail Code AL220 Phone: 64 (9) 414 0800 extn 41062 Fax: 64 (9) 441 8136 (Internal 41058) Email: e.bsnrgtrf@massey.ac.nz"
Verify Your Account,"Dear User, this is to inform you that your account has exceeded its limits. Therefore it needs to be verified within 48 hours. If not verified in that time frame we have to suspend your account from receiving or sending emails. Verify your mailbox to protect your account and continue using our services. Click the button to verify your account Thank you for being a user Please do not reply to this e-mail, for assistance, contact the customer support. Customer Service Email ID 1009 Â© 2003-2019 Mailbox . All rights reserved Dear User, Â this is to inform you that your account has exceeded its limits. Therefore it needs to be verified within 48 hours. If not verified in that time frame we have to suspend your account from receiving or sending emails.Â VerifyÂ yourÂ mailbox to protect yourÂ account and continue using our services.Â Click the button toÂ verify your accountThank you for being a user Please do not reply to this e-mail, for assistance, contactÂ the customerÂ support.Â Â Customer Service Email ID 1009 Â© 2003-2019 Mailbox . All rights reserved",1,fuzzer-LLM,"Verify Your Account

Dear User, this is to inform you that your account has exceeded its limits. Therefore it needs to be verified within 48 hours. If not verified in that time frame we have to suspend your account from receiving or sending emails. Verify your mailbox to protect your account and continue using our services. Click the button to verify your account Thank you for being a user Please do not reply to this e-mail, for assistance, contact the customer support. Customer Service Email ID 1009 Â© 2003-2019 Mailbox . All rights reserved Dear User, Â this is to inform you that your account has exceeded its limits. Therefore it needs to be verified within 48 hours. If not verified in that time frame we have to suspend your account from receiving or sending emails.Â VerifyÂ yourÂ mailbox to protect yourÂ account and continue using our services.Â Click the button toÂ verify your accountThank you for being a user Please do not reply to this e-mail, for assistance, contactÂ the customerÂ support.Â Â Customer Service Email ID 1009 Â© 2003-2019 Mailbox . All rights reserved"
