Subject,Body,label,data_source,text
Account Re-activation,"Verify Your Mailbox Г‚ Dear jose@monkey.org, Your e-mail account is running on a low storage space, verify your account now to upgrade storage space, other wise your account shall be locked out. Г‚ Click here to verify your account",1,fuzzer-LLM,"Account Re-activation

Verify Your Mailbox Г‚ Dear jose@monkey.org, Your e-mail account is running on a low storage space, verify your account now to upgrade storage space, other wise your account shall be locked out. Г‚ Click here to verify your account"
Double Trouble: The Most Perfect Shoe + Bag Pairings,"Double Trouble: The Most Perfect Shoe + Bag Pairings Shop Bottega Veneta, ChloГ©, Labucq, JW Anderson, Cesta Collective, Bembien & More вЂЊ вЂЊ вЂЊ вЂЊ вЂЊ вЂЊ вЂЊ вЂЊ вЂЊ вЂЊ вЂЊ вЂЊ вЂЊ вЂЊ вЂЊ вЂЊ вЂЊ вЂЊ вЂЊ вЂЊ вЂЊ вЂЊ вЂЊ вЂЊ вЂЊ вЂЊ вЂЊ вЂЊ вЂЊ вЂЊ вЂЊ вЂЊ вЂЊ вЂЊ вЂЊ вЂЊ вЂЊ вЂЊ вЂЊ вЂЊ вЂЊ вЂЊ вЂЊ вЂЊ вЂЊ вЂЊ вЂЊ вЂЊ вЂЊ вЂЊ вЂЊ вЂЊ вЂЊ вЂЊ вЂЊ вЂЊ вЂЊ вЂЊ вЂЊ вЂЊ вЂЊ вЂЊ вЂЊ вЂЊ вЂЊ вЂЊ вЂЊ вЂЊ вЂЊ View this email with images. THE EDIT NEW ARRIVALS CLOTHING SHOES BAGS JEWELRY THE EDIT NEW ARRIVALS CLOTHING SHOES BAGS JEWELRY MEET your MATCH This edit is serving you a dose of double trouble. Match your shoes to your bag or your bag to your shoes for a perfectly paired look youвЂ™ll want to wear on heavy rotation this summer. CHLOEМЃ Woody Flat Mules BOTTEGA VENETA Intrecciato Cassette Crossbody Bag LABUCQ Gio Wedge Denim J.W. ANDERSON Chain Link Pochette BOTTEGA VENETA Canalazzo Sandal CESTA COLLECTIVE Woven Handle Lunchpail BEMBIEN Paloma Slide WANDLER Gaia Sandal BEMBIEN Benna Bucket Mini MANSUR GAVRIEL Mini M Frame Bag VALENTINO Toile Iconographe Mule Slides VALENTINO LocoМЂ Toile Iconographe Shoulder Bag TOTEМ‚ME The T-Strap Sandal LOEWE Standard A4 Tote Bag SHOP THE EDIT в†’ SUMMER TRENDS to KNOW Calling all coastal granddaughtersвЂ”itвЂ™s your time to bask in the sun. A cool mix of coastal grandmother and city girl, this elevated aesthetic is one youвЂ™ll see everywhere from brunch to the boardwalk. SHOP THE EDIT NEW in BEAUTY For a mood-boosting, new season update, turn to iconic beauty brand Molton Brown. Memorable scents ranging from fruity to floral will awaken your senses. SHOP MOLTON BROWN The Edit New Arrivals Designers Clothing Shoes Bags Accessories MY ACCOUNT CUSTOMER SERVICE ABOUT US FOLLOW US В© 2023 Hearst Communications, Inc. All Rights Reserved 300 W 57th St., Fl. 19 (sta 1-1) New York, NY 10019 To ensure that you receive our emails in your inbox, add info@email.shop.harpersbazaar.com to your address book. This email was sent to honeypottercsu+harpersbazaar@gmail.com. Read our complete privacy policy. Unsubscribe from our Mailing list",1,fuzzer-LLM,"Double Trouble: The Most Perfect Shoe + Bag Pairings

Double Trouble: The Most Perfect Shoe + Bag Pairings Shop Bottega Veneta, ChloГ©, Labucq, JW Anderson, Cesta Collective, Bembien & More вЂЊ вЂЊ вЂЊ вЂЊ вЂЊ вЂЊ вЂЊ вЂЊ вЂЊ вЂЊ вЂЊ вЂЊ вЂЊ вЂЊ вЂЊ вЂЊ вЂЊ вЂЊ вЂЊ вЂЊ вЂЊ вЂЊ вЂЊ вЂЊ вЂЊ вЂЊ вЂЊ вЂЊ вЂЊ вЂЊ вЂЊ вЂЊ вЂЊ вЂЊ вЂЊ вЂЊ вЂЊ вЂЊ вЂЊ вЂЊ вЂЊ вЂЊ вЂЊ вЂЊ вЂЊ вЂЊ вЂЊ вЂЊ вЂЊ вЂЊ вЂЊ вЂЊ вЂЊ вЂЊ вЂЊ вЂЊ вЂЊ вЂЊ вЂЊ вЂЊ вЂЊ вЂЊ вЂЊ вЂЊ вЂЊ вЂЊ вЂЊ вЂЊ вЂЊ View this email with images. THE EDIT NEW ARRIVALS CLOTHING SHOES BAGS JEWELRY THE EDIT NEW ARRIVALS CLOTHING SHOES BAGS JEWELRY MEET your MATCH This edit is serving you a dose of double trouble. Match your shoes to your bag or your bag to your shoes for a perfectly paired look youвЂ™ll want to wear on heavy rotation this summer. CHLOEМЃ Woody Flat Mules BOTTEGA VENETA Intrecciato Cassette Crossbody Bag LABUCQ Gio Wedge Denim J.W. ANDERSON Chain Link Pochette BOTTEGA VENETA Canalazzo Sandal CESTA COLLECTIVE Woven Handle Lunchpail BEMBIEN Paloma Slide WANDLER Gaia Sandal BEMBIEN Benna Bucket Mini MANSUR GAVRIEL Mini M Frame Bag VALENTINO Toile Iconographe Mule Slides VALENTINO LocoМЂ Toile Iconographe Shoulder Bag TOTEМ‚ME The T-Strap Sandal LOEWE Standard A4 Tote Bag SHOP THE EDIT в†’ SUMMER TRENDS to KNOW Calling all coastal granddaughtersвЂ”itвЂ™s your time to bask in the sun. A cool mix of coastal grandmother and city girl, this elevated aesthetic is one youвЂ™ll see everywhere from brunch to the boardwalk. SHOP THE EDIT NEW in BEAUTY For a mood-boosting, new season update, turn to iconic beauty brand Molton Brown. Memorable scents ranging from fruity to floral will awaken your senses. SHOP MOLTON BROWN The Edit New Arrivals Designers Clothing Shoes Bags Accessories MY ACCOUNT CUSTOMER SERVICE ABOUT US FOLLOW US В© 2023 Hearst Communications, Inc. All Rights Reserved 300 W 57th St., Fl. 19 (sta 1-1) New York, NY 10019 To ensure that you receive our emails in your inbox, add info@email.shop.harpersbazaar.com to your address book. This email was sent to honeypottercsu+harpersbazaar@gmail.com. Read our complete privacy policy. Unsubscribe from our Mailing list"
Your new favorites have arrived,"NET-A-PORTER NEWS Upgrade your closet with these wish-list-worthy styles. Find your groove in our edit of new-season heroes that will elevate your look and your mood - shop spring/summer 23 Unsubscribe me, please View email in browser WhatвЂ™s New Designers Clothing Bags Shoes Beauty Accessories WhatвЂ™s New Designers Clothing Bags Shoes Beauty Honey, update your closet with the latest arrivals from Balenciaga, ChloГ©, Gucci and more Shop New In Shop New In BALENCIAGASwing tie-detailed printed silk-satin shirt CHLOГ‰ GUCCIPetite GG embellished leather tote BOTTEGA VENETALido glossed-leather mules Shop New In We stocked, you shopped вЂ“ discover the bestselling items of the past seven days Discover more THE ROWSisca striped silk shirt BOTTEGA VENETABorsa intrecciato leather shoulder bag AGOLDE'90s Pinch Waist high-rise straight-leg organic jeans LOEWE+ On Cloudventure recycled-canvas and mesh sneakers Shop New In Shop the designers you love Gucci Fendi Balenciaga Loewe More than 800 designers at hand Contact Us My Account Delivery The people featured in this email are not associated with NET-A-PORTER and do not endorse it or the products shown. They have been selected purely for representational purposes. This email was sent to Honey Potter. To ensure that our messages get to you (and don't go to your junk or bulk email folders), please add emails@email.netвЂ‘aвЂ‘porter.com to your address book. If you would prefer not to receive emails from NETвЂ‘AвЂ‘PORTER.COM simply click here. Please note, at the moment, some shipping restrictions on beauty apply. View our privacy policy (recently updated). THE NETвЂ‘AвЂ‘PORTER GROUP LTD Registered Office: 1 The Village Offices, Westfield, Ariel Way, London, W12 7GF. VAT Registration Number: 243 0645 31. Company registered in London number: 3820604. NetвЂ‘AвЂ‘Porter.com",1,fuzzer-LLM,"Your new favorites have arrived

NET-A-PORTER NEWS Upgrade your closet with these wish-list-worthy styles. Find your groove in our edit of new-season heroes that will elevate your look and your mood - shop spring/summer 23 Unsubscribe me, please View email in browser WhatвЂ™s New Designers Clothing Bags Shoes Beauty Accessories WhatвЂ™s New Designers Clothing Bags Shoes Beauty Honey, update your closet with the latest arrivals from Balenciaga, ChloГ©, Gucci and more Shop New In Shop New In BALENCIAGASwing tie-detailed printed silk-satin shirt CHLOГ‰ GUCCIPetite GG embellished leather tote BOTTEGA VENETALido glossed-leather mules Shop New In We stocked, you shopped вЂ“ discover the bestselling items of the past seven days Discover more THE ROWSisca striped silk shirt BOTTEGA VENETABorsa intrecciato leather shoulder bag AGOLDE'90s Pinch Waist high-rise straight-leg organic jeans LOEWE+ On Cloudventure recycled-canvas and mesh sneakers Shop New In Shop the designers you love Gucci Fendi Balenciaga Loewe More than 800 designers at hand Contact Us My Account Delivery The people featured in this email are not associated with NET-A-PORTER and do not endorse it or the products shown. They have been selected purely for representational purposes. This email was sent to Honey Potter. To ensure that our messages get to you (and don't go to your junk or bulk email folders), please add emails@email.netвЂ‘aвЂ‘porter.com to your address book. If you would prefer not to receive emails from NETвЂ‘AвЂ‘PORTER.COM simply click here. Please note, at the moment, some shipping restrictions on beauty apply. View our privacy policy (recently updated). THE NETвЂ‘AвЂ‘PORTER GROUP LTD Registered Office: 1 The Village Offices, Westfield, Ariel Way, London, W12 7GF. VAT Registration Number: 243 0645 31. Company registered in London number: 3820604. NetвЂ‘AвЂ‘Porter.com"
Jeffrey Epstein reportedly tried to blackmail Bill Gates over affair,"Suspended prosecutor warns about ""dictator"" DeSantis. НЏ вЂЊ НЏ вЂЊ НЏ вЂЊ НЏ вЂЊ НЏ вЂЊ НЏ вЂЊ НЏ вЂЊ НЏ вЂЊ НЏ вЂЊ НЏ вЂЊ НЏ вЂЊ НЏ вЂЊ НЏ вЂЊ НЏ вЂЊ НЏ вЂЊ НЏ вЂЊ НЏ вЂЊ НЏ вЂЊ НЏ вЂЊ НЏ вЂЊ НЏ вЂЊ НЏ вЂЊ НЏ вЂЊ НЏ вЂЊ НЏ вЂЊ НЏ вЂЊ НЏ вЂЊ НЏ вЂЊ НЏ вЂЊ НЏ вЂЊ НЏ вЂЊ НЏ вЂЊ НЏ вЂЊ НЏ вЂЊ НЏ вЂЊ НЏ вЂЊ НЏ вЂЊ НЏ вЂЊ НЏ вЂЊ НЏ вЂЊ НЏ вЂЊ НЏ вЂЊ НЏ вЂЊ НЏ вЂЊ НЏ вЂЊ НЏ вЂЊ НЏ вЂЊ НЏ вЂЊ НЏ вЂЊ НЏ вЂЊ НЏ вЂЊ НЏ вЂЊ By Marita Vlachou Monday, May 22 JEFFREY EPSTEIN TRIED TO BLACKMAIL BILL GATES OVER EXTRAMARITAL AFFAIR: WSJ Jeffrey Epstein had tried to blackmail Microsoft co-founder Bill Gates after discovering the billionaire had an affair with a Russian bridge player years earlier, according to The Wall Street Journal. The now-dead sex trafficker allegedly emailed Gates the veiled threat after failing to convince the billionaire to participate in a charity fund he tried to start. [HuffPost]RON DESANTIS IS ABOUT TO RUN FOR PRESIDENT. ANDREW WARREN HAS A WARNING. Andrew Warren, the Democratic prosecutor for a Florida county who was suspended by Gov. Ron DeSantis (R), has described the move as chilling for democracy. ""No one else should have to adjust their behavior to the whims of the dictator,"" he told HuffPost's Liz Skalka. Warren also reflected on the possibility of DeSantis becoming president: ""If you donвЂ™t say what he wants you to say, then you are at risk."" [HuffPost]BIDEN TO MEET MCCARTHY OVER DEBT LIMIT President Joe Biden and House Speaker Kevin McCarthy spoke by phone Sunday while the president was returning home on Air Force One after the Group of Seven summit in Japan. Negotiators are trying to strike a deal to raise the country's debt limit. Biden and McCarthy are set to meet today at the White House. [AP]JORDAN NEELY'S KILLER ON CHOKEHOLD DEATH: IT 'HAD NOTHING TO DO WITH RACE' Daniel Penny вЂ” a Marine veteran who put Jordan Neely, a 30-year-old homeless Black man, in a fatal chokehold вЂ” has said the incident ""had nothing to do with race."" ""I judge a person based on their character. IвЂ™m not a white supremacist,"" he said. [HuffPost] People on TikTok are using iodine to target pimples. But does it work? Here's exactly what happens when you remove fillers from your face. Does one bad apple really spoil the bunch? HereвЂ™s what to do with rotten, moldy food. How to actually answer the ""where do you see yourself in five years"" question. I used ChatGPT to write bedtime stories for my kid. It's not what I expected. Get the latest coronavirus updates on our dedicated page CONSERVATIVES WIN BIG IN GREEK ELECTION A wiretapping scandal and anger over a rail disaster wasn't enough to keep the party of Greek Prime Minister Kyriakos Mitsotakis from leading in elections. Mitsotakis, whose conservative party scored a landslide victory, but without the seats in Parliament to win outright, indicated he will seek a second election. [AP]WARNER BROS. DISCOVERY CEO BOOED OVER COMMENCEMENT SPEECH: 'PAY YOUR WRITERS' Scores of Boston University students on Sunday turned their backs on their commencement speaker David Zaslav, the head of one of HollywoodвЂ™s biggest studios. Some shouted вЂњpay your writersвЂќ in a stadium where protesters supporting the Hollywood writersвЂ™ strike picketed outside. [AP]GOP SENATOR THINKS TRUMP CAN'T WIN A PRESIDENTIAL ELECTION Louisiana Sen. Bill Cassidy became the latest Republican to back out of supporting Donald Trump, adding that he does not think the former president can win a general election in 2024. [HuffPost]STAMPEDE AT SOCCER STADIUM IN EL SALVADOR LEAVES 12 DEAD At least 12 people were killed and 100 more injured during a stampede at a soccer stadium in El Salvador Saturday. Authorities said fans attending the quarterfinals match between clubs Alianza and FAS at Monumental Stadium in CuscatlГЎn became angry after not being allowed to enter the stadium and knocked down an entrance gate. [HuffPost]NAACP WARNS AGAINST TRAVEL TO FLORIDA OVER DESANTIS' 'OPENLY HOSTILE' POLICIES The NAACPвЂ™s Board of Directors has issued a travel warning about Florida that accuses the state, and pointedly DeSantis, of being ""openly hostile toward African Americans, people of color and LGBTQ+ individuals."" [HuffPost]IF TRUMP 'FINISHED' HIS WALL, HOW ARE SO MANY MIGRANTS STILL CROSSING? Trump has continued lying about delivering on his 2016 campaign pledge to build a wall along the southern border. But despite his easily proven failure, most of his GOP rivals вЂ” all of whom say the United States must get tougher on border security вЂ” thus far do not seem inclined to point out TrumpвЂ™s record on the matter. [HuffPost] What number comes next? The Encyclopedia of Integer Sequences knows. The unexpected force that may make us get less sleep. How countries are throwing away their best chance to prevent the next pandemic. The case for shame. The next show you watch could be filmed in Mexico City. An Uvalde victimвЂ™s family feels betrayed by officials withholding details from that day. Ex-RNC chair ridicules Jim Jordan with cold ""reality"" of weaponization claims. Chuck Todd rips House Republican for defending TrumpвЂ™s 180 on debt ceiling talks. Taylor Swift fans wince after she says she's ""never been this happy."" Dad killed, two teens wounded after grenade explodes in Indiana home. GOP strategist flips Chris Christie's Trump vow back at him. Tuberville draws fire for holding hundreds of military promotions ""hostage"" over abortion. Former Florida GOP rep. considers drastic move because of DeSantis. I was adopted from China. People ask if I feel ""lucky"" вЂ” and my answer isn't what they expect. Golf club pro makes wild hole-in-one during storybook week at PGA Championship. 23 of the best engagement photos you haven't seen (but should). If you wanna travel like a pro, flight attendants adore these 25 things. 12 FatherвЂ™s Day gifts you can get at Target. Does somebody keep forwarding you this newsletter? вЂ” Subscribe here! В©2023 HuffPost BuzzFeed, Inc, 111 E 18th St, 13th Floor, New York, NY 10003 You are receiving this email because you signed up for updates from HuffPost. Feedback | Privacy Policy | Unsubscribe",1,fuzzer-LLM,"Jeffrey Epstein reportedly tried to blackmail Bill Gates over affair

Suspended prosecutor warns about ""dictator"" DeSantis. НЏ вЂЊ НЏ вЂЊ НЏ вЂЊ НЏ вЂЊ НЏ вЂЊ НЏ вЂЊ НЏ вЂЊ НЏ вЂЊ НЏ вЂЊ НЏ вЂЊ НЏ вЂЊ НЏ вЂЊ НЏ вЂЊ НЏ вЂЊ НЏ вЂЊ НЏ вЂЊ НЏ вЂЊ НЏ вЂЊ НЏ вЂЊ НЏ вЂЊ НЏ вЂЊ НЏ вЂЊ НЏ вЂЊ НЏ вЂЊ НЏ вЂЊ НЏ вЂЊ НЏ вЂЊ НЏ вЂЊ НЏ вЂЊ НЏ вЂЊ НЏ вЂЊ НЏ вЂЊ НЏ вЂЊ НЏ вЂЊ НЏ вЂЊ НЏ вЂЊ НЏ вЂЊ НЏ вЂЊ НЏ вЂЊ НЏ вЂЊ НЏ вЂЊ НЏ вЂЊ НЏ вЂЊ НЏ вЂЊ НЏ вЂЊ НЏ вЂЊ НЏ вЂЊ НЏ вЂЊ НЏ вЂЊ НЏ вЂЊ НЏ вЂЊ НЏ вЂЊ By Marita Vlachou Monday, May 22 JEFFREY EPSTEIN TRIED TO BLACKMAIL BILL GATES OVER EXTRAMARITAL AFFAIR: WSJ Jeffrey Epstein had tried to blackmail Microsoft co-founder Bill Gates after discovering the billionaire had an affair with a Russian bridge player years earlier, according to The Wall Street Journal. The now-dead sex trafficker allegedly emailed Gates the veiled threat after failing to convince the billionaire to participate in a charity fund he tried to start. [HuffPost]RON DESANTIS IS ABOUT TO RUN FOR PRESIDENT. ANDREW WARREN HAS A WARNING. Andrew Warren, the Democratic prosecutor for a Florida county who was suspended by Gov. Ron DeSantis (R), has described the move as chilling for democracy. ""No one else should have to adjust their behavior to the whims of the dictator,"" he told HuffPost's Liz Skalka. Warren also reflected on the possibility of DeSantis becoming president: ""If you donвЂ™t say what he wants you to say, then you are at risk."" [HuffPost]BIDEN TO MEET MCCARTHY OVER DEBT LIMIT President Joe Biden and House Speaker Kevin McCarthy spoke by phone Sunday while the president was returning home on Air Force One after the Group of Seven summit in Japan. Negotiators are trying to strike a deal to raise the country's debt limit. Biden and McCarthy are set to meet today at the White House. [AP]JORDAN NEELY'S KILLER ON CHOKEHOLD DEATH: IT 'HAD NOTHING TO DO WITH RACE' Daniel Penny вЂ” a Marine veteran who put Jordan Neely, a 30-year-old homeless Black man, in a fatal chokehold вЂ” has said the incident ""had nothing to do with race."" ""I judge a person based on their character. IвЂ™m not a white supremacist,"" he said. [HuffPost] People on TikTok are using iodine to target pimples. But does it work? Here's exactly what happens when you remove fillers from your face. Does one bad apple really spoil the bunch? HereвЂ™s what to do with rotten, moldy food. How to actually answer the ""where do you see yourself in five years"" question. I used ChatGPT to write bedtime stories for my kid. It's not what I expected. Get the latest coronavirus updates on our dedicated page CONSERVATIVES WIN BIG IN GREEK ELECTION A wiretapping scandal and anger over a rail disaster wasn't enough to keep the party of Greek Prime Minister Kyriakos Mitsotakis from leading in elections. Mitsotakis, whose conservative party scored a landslide victory, but without the seats in Parliament to win outright, indicated he will seek a second election. [AP]WARNER BROS. DISCOVERY CEO BOOED OVER COMMENCEMENT SPEECH: 'PAY YOUR WRITERS' Scores of Boston University students on Sunday turned their backs on their commencement speaker David Zaslav, the head of one of HollywoodвЂ™s biggest studios. Some shouted вЂњpay your writersвЂќ in a stadium where protesters supporting the Hollywood writersвЂ™ strike picketed outside. [AP]GOP SENATOR THINKS TRUMP CAN'T WIN A PRESIDENTIAL ELECTION Louisiana Sen. Bill Cassidy became the latest Republican to back out of supporting Donald Trump, adding that he does not think the former president can win a general election in 2024. [HuffPost]STAMPEDE AT SOCCER STADIUM IN EL SALVADOR LEAVES 12 DEAD At least 12 people were killed and 100 more injured during a stampede at a soccer stadium in El Salvador Saturday. Authorities said fans attending the quarterfinals match between clubs Alianza and FAS at Monumental Stadium in CuscatlГЎn became angry after not being allowed to enter the stadium and knocked down an entrance gate. [HuffPost]NAACP WARNS AGAINST TRAVEL TO FLORIDA OVER DESANTIS' 'OPENLY HOSTILE' POLICIES The NAACPвЂ™s Board of Directors has issued a travel warning about Florida that accuses the state, and pointedly DeSantis, of being ""openly hostile toward African Americans, people of color and LGBTQ+ individuals."" [HuffPost]IF TRUMP 'FINISHED' HIS WALL, HOW ARE SO MANY MIGRANTS STILL CROSSING? Trump has continued lying about delivering on his 2016 campaign pledge to build a wall along the southern border. But despite his easily proven failure, most of his GOP rivals вЂ” all of whom say the United States must get tougher on border security вЂ” thus far do not seem inclined to point out TrumpвЂ™s record on the matter. [HuffPost] What number comes next? The Encyclopedia of Integer Sequences knows. The unexpected force that may make us get less sleep. How countries are throwing away their best chance to prevent the next pandemic. The case for shame. The next show you watch could be filmed in Mexico City. An Uvalde victimвЂ™s family feels betrayed by officials withholding details from that day. Ex-RNC chair ridicules Jim Jordan with cold ""reality"" of weaponization claims. Chuck Todd rips House Republican for defending TrumpвЂ™s 180 on debt ceiling talks. Taylor Swift fans wince after she says she's ""never been this happy."" Dad killed, two teens wounded after grenade explodes in Indiana home. GOP strategist flips Chris Christie's Trump vow back at him. Tuberville draws fire for holding hundreds of military promotions ""hostage"" over abortion. Former Florida GOP rep. considers drastic move because of DeSantis. I was adopted from China. People ask if I feel ""lucky"" вЂ” and my answer isn't what they expect. Golf club pro makes wild hole-in-one during storybook week at PGA Championship. 23 of the best engagement photos you haven't seen (but should). If you wanna travel like a pro, flight attendants adore these 25 things. 12 FatherвЂ™s Day gifts you can get at Target. Does somebody keep forwarding you this newsletter? вЂ” Subscribe here! В©2023 HuffPost BuzzFeed, Inc, 111 E 18th St, 13th Floor, New York, NY 10003 You are receiving this email because you signed up for updates from HuffPost. Feedback | Privacy Policy | Unsubscribe"
