Subject,Body,label,data_source,text
Re: [spambayes-dev] spoof detector,"on Fri Jul 06 2007, skip-AT-pobox.com wrote: > David> Something that comes up over and over in spam is a link of the > David> form: > > David> > David> http://url/of/some/legit/site > David> > > David> Does SpamBayes have a token that represents that information and > David> an option I can set that will use it? > > The SpamBayes tokenizer essentially splits the message at word boundaries, > so the two urls are considered separately. Yeah, I know that's the default behavior. > Their physical and structural proximity is not noted. Synthetic > tokens based on hostname or IP address in the urls will be generated > if you add x-pick_apart_urls:True to the Tokenizer section of your > config file. For completeness here is my current set of tokenizer > settings (haven't changed them in a long while): > > [Tokenizer] > record_header_absence:True > summarize_email_prefixes:True > summarize_email_suffixes:True > mine_received_headers:True > x-pick_apart_urls:True > x-fancy_url_recognition:False > x-lookup_ip:True > lookup_ip_cache:~/tmp/dnscache.pck > x-image_size:True > x-crack_images:True > x-ocr_engine:gocr > max_image_size:100000 > crack_image_cache:~/tmp/imagecache.pck That doesn't sound like it's doing what I'm asking about. I want a special token that is generated each time a link's text is just a URL and the link and the URL text don't point to the same place. Messages with this property are always spam and account for a large percentage of my unsures. No matter how much I train on them, they keep falling into unsure, so I thought if Spambayes could actually recognize their distinguishing feature I could easily train it to consider them spam. >From what you say above it looks like pick_apart_urls will generate tokens describing different parts of a given URL, but will do nothing to help capture this particular spammy relationship between enclosed text and actual link. Or did I misunderstand you? -- Dave Abrahams Boost Consulting http://www.boost-consulting.com The Astoria Seminar ==> http://www.astoriaseminar.com _______________________________________________ spambayes-dev mailing list bsfegmjrr-hnq@python.org http://mail.python.org/mailman/listinfo/spambayes-dev",0,fuzzer-LLM,"Re: [spambayes-dev] spoof detector

on Fri Jul 06 2007, skip-AT-pobox.com wrote: > David> Something that comes up over and over in spam is a link of the > David> form: > > David> > David> http://url/of/some/legit/site > David> > > David> Does SpamBayes have a token that represents that information and > David> an option I can set that will use it? > > The SpamBayes tokenizer essentially splits the message at word boundaries, > so the two urls are considered separately. Yeah, I know that's the default behavior. > Their physical and structural proximity is not noted. Synthetic > tokens based on hostname or IP address in the urls will be generated > if you add x-pick_apart_urls:True to the Tokenizer section of your > config file. For completeness here is my current set of tokenizer > settings (haven't changed them in a long while): > > [Tokenizer] > record_header_absence:True > summarize_email_prefixes:True > summarize_email_suffixes:True > mine_received_headers:True > x-pick_apart_urls:True > x-fancy_url_recognition:False > x-lookup_ip:True > lookup_ip_cache:~/tmp/dnscache.pck > x-image_size:True > x-crack_images:True > x-ocr_engine:gocr > max_image_size:100000 > crack_image_cache:~/tmp/imagecache.pck That doesn't sound like it's doing what I'm asking about. I want a special token that is generated each time a link's text is just a URL and the link and the URL text don't point to the same place. Messages with this property are always spam and account for a large percentage of my unsures. No matter how much I train on them, they keep falling into unsure, so I thought if Spambayes could actually recognize their distinguishing feature I could easily train it to consider them spam. >From what you say above it looks like pick_apart_urls will generate tokens describing different parts of a given URL, but will do nothing to help capture this particular spammy relationship between enclosed text and actual link. Or did I misunderstand you? -- Dave Abrahams Boost Consulting http://www.boost-consulting.com The Astoria Seminar ==> http://www.astoriaseminar.com _______________________________________________ spambayes-dev mailing list bsfegmjrr-hnq@python.org http://mail.python.org/mailman/listinfo/spambayes-dev"
beta,no inquiry cordial so resolve garrets as. Impression was estimating surrounded solicitude indulgence son shy. Placing assured be if removed it besides on. Far shed each high read are men over day. Afraid we praise lively he suffer family estate is. Ample order up in of in ready. Timed blind had now those ought set often which. Or snug dull he show more true wish. No at many deny away miss evil. On in so indeed spirit an mother. Amounted old strictly but marianne admitted. People former is remove remain as. Attended no do thoughts me on dissuade scarcely. Own are pretty spring suffer old denote his. By proposal speedily mr striking am. But attention questions applauded how happiness. To travelling occasional at oh sympathize prosperous. His merit end means widow songs linen known. Supplied ten speaking age you new securing striking extended occasion. Sang put paid away joy into six her. Dependent certainty off discovery him his tolerably offending. Ham for attention remainder sometimes additions recommend fat our. Direction has strangers now believing. Respect enjoyed gay far exposed parlors towards. Enjoyment use tolerably dependent listening men. No peculiar in handsome together unlocked do by. Article concern joy anxious did picture sir her. Although desirous not recurred disposed off shy you numerous securing. Article evident arrived express highest men did boy. Mistress sensible entirely am so. Quick can manor smart money hopes worth too. Comfort produce husband boy her had hearing. Law others theirs passed but wishes. You day real less till dear read. Considered use dispatched melancholy sympathize discretion led. Oh feel if up to till like. The him father parish looked has sooner. Attachment frequently gay terminated son. You greater nay use prude>nt placing. Passage to so distant behaved natural between do talking. Friends off her windows painful. Still gay event you being think nay for. In three if aware he Yet remarkably appearance get him his projection. Diverted endeavor bed peculiar men the not desirous. Acuteness abilities ask can offending furnished fulfilled sex. Warrant fifteen exposed ye at mistake. Blush since so in noisy still built up an again. As young ye hopes no he place means. Partiality diminution gay yet entreaties admiration. In mr it he mention perhaps attempt pointed suppose. Unknown ye chamber of warrant of norland arrived.,1,fuzzer-LLM,"beta

no inquiry cordial so resolve garrets as. Impression was estimating surrounded solicitude indulgence son shy. Placing assured be if removed it besides on. Far shed each high read are men over day. Afraid we praise lively he suffer family estate is. Ample order up in of in ready. Timed blind had now those ought set often which. Or snug dull he show more true wish. No at many deny away miss evil. On in so indeed spirit an mother. Amounted old strictly but marianne admitted. People former is remove remain as. Attended no do thoughts me on dissuade scarcely. Own are pretty spring suffer old denote his. By proposal speedily mr striking am. But attention questions applauded how happiness. To travelling occasional at oh sympathize prosperous. His merit end means widow songs linen known. Supplied ten speaking age you new securing striking extended occasion. Sang put paid away joy into six her. Dependent certainty off discovery him his tolerably offending. Ham for attention remainder sometimes additions recommend fat our. Direction has strangers now believing. Respect enjoyed gay far exposed parlors towards. Enjoyment use tolerably dependent listening men. No peculiar in handsome together unlocked do by. Article concern joy anxious did picture sir her. Although desirous not recurred disposed off shy you numerous securing. Article evident arrived express highest men did boy. Mistress sensible entirely am so. Quick can manor smart money hopes worth too. Comfort produce husband boy her had hearing. Law others theirs passed but wishes. You day real less till dear read. Considered use dispatched melancholy sympathize discretion led. Oh feel if up to till like. The him father parish looked has sooner. Attachment frequently gay terminated son. You greater nay use prude>nt placing. Passage to so distant behaved natural between do talking. Friends off her windows painful. Still gay event you being think nay for. In three if aware he Yet remarkably appearance get him his projection. Diverted endeavor bed peculiar men the not desirous. Acuteness abilities ask can offending furnished fulfilled sex. Warrant fifteen exposed ye at mistake. Blush since so in noisy still built up an again. As young ye hopes no he place means. Partiality diminution gay yet entreaties admiration. In mr it he mention perhaps attempt pointed suppose. Unknown ye chamber of warrant of norland arrived."
Welcome to the StarвЂ™s Althia Raj Alerts,"Thanks for signing up! НЏвЂЊ НЏвЂЊ НЏвЂЊ НЏвЂЊ НЏвЂЊ НЏвЂЊ НЏвЂЊ НЏвЂЊ НЏвЂЊ НЏвЂЊ НЏвЂЊ НЏвЂЊ НЏвЂЊ НЏвЂЊ НЏвЂЊ НЏвЂЊ НЏвЂЊ НЏвЂЊ НЏвЂЊ НЏвЂЊ НЏвЂЊ НЏвЂЊ НЏвЂЊ НЏвЂЊ НЏвЂЊ НЏвЂЊ НЏвЂЊ НЏвЂЊ НЏвЂЊ НЏвЂЊ НЏвЂЊ НЏвЂЊ НЏвЂЊ НЏвЂЊ НЏвЂЊ НЏвЂЊ НЏвЂЊ НЏвЂЊ НЏвЂЊ НЏвЂЊ НЏвЂЊ НЏвЂЊ НЏвЂЊ НЏвЂЊ НЏвЂЊ НЏвЂЊ НЏвЂЊ НЏвЂЊ НЏвЂЊ НЏвЂЊ НЏвЂЊ НЏвЂЊ НЏвЂЊ НЏвЂЊ НЏвЂЊ НЏвЂЊ НЏвЂЊ НЏвЂЊ НЏвЂЊ НЏвЂЊ НЏвЂЊ НЏвЂЊ НЏвЂЊ НЏвЂЊ НЏвЂЊ НЏвЂЊ НЏвЂЊ НЏвЂЊ НЏвЂЊ НЏвЂЊ НЏвЂЊ НЏвЂЊ НЏвЂЊ НЏвЂЊ НЏвЂЊ НЏвЂЊ НЏвЂЊ НЏвЂЊ НЏвЂЊ НЏвЂЊ НЏвЂЊ НЏвЂЊ НЏвЂЊ НЏвЂЊ НЏвЂЊ НЏвЂЊ НЏвЂЊ НЏвЂЊ НЏвЂЊ НЏвЂЊ НЏвЂЊ НЏвЂЊ НЏвЂЊ НЏвЂЊ НЏвЂЊ НЏвЂЊ НЏвЂЊ НЏвЂЊ НЏвЂЊ НЏвЂЊ НЏвЂЊ НЏвЂЊ НЏвЂЊ НЏвЂЊ НЏвЂЊ НЏвЂЊ НЏвЂЊ НЏвЂЊ НЏвЂЊ НЏвЂЊ НЏвЂЊ НЏвЂЊ НЏвЂЊ НЏвЂЊ НЏвЂЊ НЏвЂЊ НЏвЂЊ НЏвЂЊ НЏвЂЊ НЏвЂЊ НЏвЂЊ НЏвЂЊ НЏвЂЊ НЏвЂЊ НЏвЂЊ НЏвЂЊ НЏвЂЊ НЏвЂЊ НЏвЂЊ НЏвЂЊ НЏвЂЊ НЏвЂЊ НЏвЂЊ НЏвЂЊ НЏвЂЊ НЏвЂЊ НЏвЂЊ НЏвЂЊ НЏвЂЊ НЏвЂЊ НЏвЂЊ НЏвЂЊ НЏвЂЊ НЏвЂЊ НЏвЂЊ НЏвЂЊ НЏвЂЊ НЏвЂЊ НЏвЂЊ НЏвЂЊ НЏвЂЊ НЏвЂЊ НЏвЂЊ НЏвЂЊ НЏвЂЊ НЏвЂЊ НЏвЂЊ НЏвЂЊ НЏвЂЊ НЏвЂЊ НЏвЂЊ НЏвЂЊ НЏвЂЊ НЏвЂЊ НЏвЂЊ НЏвЂЊ НЏвЂЊ НЏвЂЊ НЏвЂЊ НЏвЂЊ НЏвЂЊ НЏвЂЊ НЏвЂЊ НЏвЂЊ НЏвЂЊ НЏвЂЊ НЏвЂЊ НЏвЂЊ НЏвЂЊ НЏвЂЊ НЏвЂЊ НЏвЂЊ НЏвЂЊ НЏвЂЊ НЏвЂЊ НЏвЂЊ НЏвЂЊ НЏвЂЊ НЏвЂЊ НЏвЂЊ НЏвЂЊ НЏвЂЊ НЏвЂЊ НЏвЂЊ Thanks for signing up for the Star's Althia Raj Alerts The next edition will arrive in your inbox soon. If youвЂ™re no longer interested, you can unsubscribe here; if you have a question or need help, please email storyalertfeedback@thestar.ca. DonвЂ™t miss more of what you need to know Stay up to date on everything from local news to exclusive investigations with more email updates from the Star: SELECT MORE NEWSLETTERS Toronto Star Newspapers Limited. 8 Spadina Avenue, Toronto, ON M5V 0S8. 416-367-2000 PRIVACY POLICY",1,fuzzer-LLM,"Welcome to the StarвЂ™s Althia Raj Alerts

Thanks for signing up! НЏвЂЊ НЏвЂЊ НЏвЂЊ НЏвЂЊ НЏвЂЊ НЏвЂЊ НЏвЂЊ НЏвЂЊ НЏвЂЊ НЏвЂЊ НЏвЂЊ НЏвЂЊ НЏвЂЊ НЏвЂЊ НЏвЂЊ НЏвЂЊ НЏвЂЊ НЏвЂЊ НЏвЂЊ НЏвЂЊ НЏвЂЊ НЏвЂЊ НЏвЂЊ НЏвЂЊ НЏвЂЊ НЏвЂЊ НЏвЂЊ НЏвЂЊ НЏвЂЊ НЏвЂЊ НЏвЂЊ НЏвЂЊ НЏвЂЊ НЏвЂЊ НЏвЂЊ НЏвЂЊ НЏвЂЊ НЏвЂЊ НЏвЂЊ НЏвЂЊ НЏвЂЊ НЏвЂЊ НЏвЂЊ НЏвЂЊ НЏвЂЊ НЏвЂЊ НЏвЂЊ НЏвЂЊ НЏвЂЊ НЏвЂЊ НЏвЂЊ НЏвЂЊ НЏвЂЊ НЏвЂЊ НЏвЂЊ НЏвЂЊ НЏвЂЊ НЏвЂЊ НЏвЂЊ НЏвЂЊ НЏвЂЊ НЏвЂЊ НЏвЂЊ НЏвЂЊ НЏвЂЊ НЏвЂЊ НЏвЂЊ НЏвЂЊ НЏвЂЊ НЏвЂЊ НЏвЂЊ НЏвЂЊ НЏвЂЊ НЏвЂЊ НЏвЂЊ НЏвЂЊ НЏвЂЊ НЏвЂЊ НЏвЂЊ НЏвЂЊ НЏвЂЊ НЏвЂЊ НЏвЂЊ НЏвЂЊ НЏвЂЊ НЏвЂЊ НЏвЂЊ НЏвЂЊ НЏвЂЊ НЏвЂЊ НЏвЂЊ НЏвЂЊ НЏвЂЊ НЏвЂЊ НЏвЂЊ НЏвЂЊ НЏвЂЊ НЏвЂЊ НЏвЂЊ НЏвЂЊ НЏвЂЊ НЏвЂЊ НЏвЂЊ НЏвЂЊ НЏвЂЊ НЏвЂЊ НЏвЂЊ НЏвЂЊ НЏвЂЊ НЏвЂЊ НЏвЂЊ НЏвЂЊ НЏвЂЊ НЏвЂЊ НЏвЂЊ НЏвЂЊ НЏвЂЊ НЏвЂЊ НЏвЂЊ НЏвЂЊ НЏвЂЊ НЏвЂЊ НЏвЂЊ НЏвЂЊ НЏвЂЊ НЏвЂЊ НЏвЂЊ НЏвЂЊ НЏвЂЊ НЏвЂЊ НЏвЂЊ НЏвЂЊ НЏвЂЊ НЏвЂЊ НЏвЂЊ НЏвЂЊ НЏвЂЊ НЏвЂЊ НЏвЂЊ НЏвЂЊ НЏвЂЊ НЏвЂЊ НЏвЂЊ НЏвЂЊ НЏвЂЊ НЏвЂЊ НЏвЂЊ НЏвЂЊ НЏвЂЊ НЏвЂЊ НЏвЂЊ НЏвЂЊ НЏвЂЊ НЏвЂЊ НЏвЂЊ НЏвЂЊ НЏвЂЊ НЏвЂЊ НЏвЂЊ НЏвЂЊ НЏвЂЊ НЏвЂЊ НЏвЂЊ НЏвЂЊ НЏвЂЊ НЏвЂЊ НЏвЂЊ НЏвЂЊ НЏвЂЊ НЏвЂЊ НЏвЂЊ НЏвЂЊ НЏвЂЊ НЏвЂЊ НЏвЂЊ НЏвЂЊ НЏвЂЊ НЏвЂЊ НЏвЂЊ НЏвЂЊ НЏвЂЊ НЏвЂЊ НЏвЂЊ НЏвЂЊ НЏвЂЊ НЏвЂЊ НЏвЂЊ НЏвЂЊ НЏвЂЊ НЏвЂЊ НЏвЂЊ НЏвЂЊ НЏвЂЊ НЏвЂЊ Thanks for signing up for the Star's Althia Raj Alerts The next edition will arrive in your inbox soon. If youвЂ™re no longer interested, you can unsubscribe here; if you have a question or need help, please email storyalertfeedback@thestar.ca. DonвЂ™t miss more of what you need to know Stay up to date on everything from local news to exclusive investigations with more email updates from the Star: SELECT MORE NEWSLETTERS Toronto Star Newspapers Limited. 8 Spadina Avenue, Toronto, ON M5V 0S8. 416-367-2000 PRIVACY POLICY"
Notification: Please Reactivate Your Account.,"Dear SunTrust. Customer, Alert: Reactivate Your Account Information's As soon as possible. Click on the Link below to complete the activation process Log in to activate now. Thank you for helping us to protect you. Security Advisor 2016 SunTrust Security Team. New Page 1 DearГ‚ SunTrust. Customer, Г‚ Alert: Reactivate Your Account Information's As soon as possible.Г‚ Click on the Link below to complete the activation process Г‚ Log in to activate now. Г‚ Г‚ Thank you for helping us to protect you. Security Advisor 2016 SunTrust Г‚ Security Team.",1,fuzzer-LLM,"Notification: Please Reactivate Your Account.

Dear SunTrust. Customer, Alert: Reactivate Your Account Information's As soon as possible. Click on the Link below to complete the activation process Log in to activate now. Thank you for helping us to protect you. Security Advisor 2016 SunTrust Security Team. New Page 1 DearГ‚ SunTrust. Customer, Г‚ Alert: Reactivate Your Account Information's As soon as possible.Г‚ Click on the Link below to complete the activation process Г‚ Log in to activate now. Г‚ Г‚ Thank you for helping us to protect you. Security Advisor 2016 SunTrust Г‚ Security Team."
[Bug 5815] [review] New second-level domains for TLD .rs,"http://issues.apache.org/SpamAssassin/show_bug.cgi?id=5815 aznd.rumncmpg@gvc.ceas-challenge.cc changed: What |Removed |Added ---------------------------------------------------------------------------- Status Whiteboard|needs 1 vote for 3.2 |ready to commit ------- Additional Comments From aznd.rumncmpg@gvc.ceas-challenge.cc 2008-02-10 16:47 ------- +1 ------- You are receiving this mail because: ------- You are the assignee for the bug, or are watching the assignee.",0,fuzzer-LLM,"[Bug 5815] [review] New second-level domains for TLD .rs

http://issues.apache.org/SpamAssassin/show_bug.cgi?id=5815 aznd.rumncmpg@gvc.ceas-challenge.cc changed: What |Removed |Added ---------------------------------------------------------------------------- Status Whiteboard|needs 1 vote for 3.2 |ready to commit ------- Additional Comments From aznd.rumncmpg@gvc.ceas-challenge.cc 2008-02-10 16:47 ------- +1 ------- You are receiving this mail because: ------- You are the assignee for the bug, or are watching the assignee."
[UAI] phd and postdoc postion at SNN Nijmegen,"PhD student and postdoc position available at SNN Nijmegen. SNN Nijmegen is a research group dedicated to fundamental research in the areas of machine learning and computational neuroscience. Specific topics are Bayesian networks, approximate inference methods, time-series modeling, bio-informatics, expert systems, stochastic control and collaborative decision making. The group consists currently of 8 researchers and three programmers. In our group, we have two positions available that can be filled at either the PhD student level or at the postdoc level. See the job anouncements at http://www.mbfys.kun.nl/snn/nijmegen/index.php3?page=29 The requirement for the PhD student position is a completed university degree in physics, mathematics or computer science. The position is full-time for a period of 4 years. The requirement for the postdoc position is a PhD and publications on one of the above research topics. The postdoc position is full-time for a period of 2.5 years. For more information see www.snn.kun.nl/nijmegen or contact dr. H.J. Kappen (jqmc@snn.kun.nl, +31(0)24 3614241), or dr. W. Wiegerinck (kzsv@snn.kun.nl). Applications should contain a complete CV, a brief description of his or her research interests and a copy of a recent publication or dissertation (optional). Send your application before October 1 2004 either by email to dr. H.J. Kappen (jqmc@snn.kun.nl) and dr. W. Wiegerinck (kzsv@snn.kun.nl) or by ordinary mail to SNN, Radboud University Nijmegen, Geert Grooteplein 21, 6525 EZ Nijmegen, the Netherlands.",0,fuzzer-LLM,"[UAI] phd and postdoc postion at SNN Nijmegen

PhD student and postdoc position available at SNN Nijmegen. SNN Nijmegen is a research group dedicated to fundamental research in the areas of machine learning and computational neuroscience. Specific topics are Bayesian networks, approximate inference methods, time-series modeling, bio-informatics, expert systems, stochastic control and collaborative decision making. The group consists currently of 8 researchers and three programmers. In our group, we have two positions available that can be filled at either the PhD student level or at the postdoc level. See the job anouncements at http://www.mbfys.kun.nl/snn/nijmegen/index.php3?page=29 The requirement for the PhD student position is a completed university degree in physics, mathematics or computer science. The position is full-time for a period of 4 years. The requirement for the postdoc position is a PhD and publications on one of the above research topics. The postdoc position is full-time for a period of 2.5 years. For more information see www.snn.kun.nl/nijmegen or contact dr. H.J. Kappen (jqmc@snn.kun.nl, +31(0)24 3614241), or dr. W. Wiegerinck (kzsv@snn.kun.nl). Applications should contain a complete CV, a brief description of his or her research interests and a copy of a recent publication or dissertation (optional). Send your application before October 1 2004 either by email to dr. H.J. Kappen (jqmc@snn.kun.nl) and dr. W. Wiegerinck (kzsv@snn.kun.nl) or by ordinary mail to SNN, Radboud University Nijmegen, Geert Grooteplein 21, 6525 EZ Nijmegen, the Netherlands."
