Subject,Body,label,data_source,text
Approve Due payment Invoice-7876799,"*Adobe* PDF Scanned document.pdf Hi jose@monkey.org, A pending payment due invoice has been shared with you on Sharepoint portal please, Review due invoice and approve for paymnet. Review Invoice ( https://kawanakajima.co.jp/okaynow.htm#jose@monkey.org ) Unsubscribe ( https://u28748092.ct.sendgrid.net/asm/unsubscribe/?user_id=28748092&data=TTuel20cUogqDt2xfmodrX2wVB1Gts0dkkz51y3gfaFoMDAwdTAwMJseDkcP31FA1vlRRvq_-U9OgWor1cfukUWRLP6u1OKVM22FhvbaS2CdHV1D1Y0uL5uPGouDmIDjB3z5sPHrmlAi24L-2AZISfQ5rf50dWszTFk4458mUnArRgoMVtQXQ8O2B-2T8PZxZGuqXBhOTL42w07fhd7GzN2L8xmaKlSFzGcjhRSy81RsiKNQAABno5FV-FAiKEptV07txRIf9A2uiioZTGGYWTl9aq8niGGu-zGvEUISaP7K94q30edGw4HwWockvKbQUFba72RmtY11XUyg4Mnw1RLNdROQcMgc2dOKCIE-pkcZkGB9PQ2gM_2U-WMQkYM3WomOTiaNnniCQZh0oTl0ns9ZyNMb3x8d-5KqW09Pt1uW0tq8t9-uc_28nKH-uBbgQOB5lUIUaa8UF2XzIdmoGQ0MpAHbEMIDbsCbP9CRKPPW88SAYGmeaAzblKIdKnXg4eLL2AmoDGO1YAz_uZtcxlA4kwSsbtlavFxRJFHcXm54YSysNGSbDIjoEIbaUR4p74sm0M8eeKhhNhrcR6K3C2XsowZwDkWKM3o-S8OaNPITbceinYzjEpy_qNayYPOdxEzVR_N9J9sLrTd-1RXRhGLPrudtlseplijl6R8NMN6DthtLIN0xYNfBxxbQa6bXdFAG4jzAO9m9aEgVjV4pE6gQERj7PZK5HUe2HrHfZb-GL4TtRsvfbO9bK53PBH7XMs6jVifOxQVGxPKJEyX52y_0Dy63Avbn_pB1ukEqDTe7PGl4SUQP_J9uwgF2Z2KZoaDQKHuZd6-apPmcHnNYLcRXkbAAcL4fEeEFmOJcYCS2ogG9-Lhw04URpL3zNSoK0Qcs41nuQIrAsJsQYwS6fqtyM4IielaPbbpw9Oe5AR3wu_H9Mr92UVg7YcAjiCYRb31fOhUba-Tcdt7wNwLEMtffZIrusxiG6AZakg9_S84CpdidE94-A3BoXHGSKd2KqmMtvlZwMmkiESgk4uEOMmwW45VjlryGSolug2l84kxkzGQ5dpUg-xZ45VGbN68f1BJJ0WYJazZhm3-6tefoGQRy_041IRiuwIN1snNRflEn4vm7fVx7lA== ) - Unsubscribe Preferences ( https://u28748092.ct.sendgrid.net/asm/?user_id=28748092&data=A81PtAnQo0-HP0w5ufU-HDypQJXaCE3ZiaSs6yT75LdoMDAwdTAwMG86HK53jK7A5Y0smFyow1JQDc6xBf0UVtJ-8s7lm-g6xcGVSI_4vV5DzdRtLBGCPe7xrzplOM0cuZZJmYiLq4cu4RFiazJ_wDYrCPGpEeY2LB-e7lkWSQZkRiN9gpIImjM3xyM2Bi9Q32uRDUdtQtW5Jo2txdNVQba6O7jRIHDRVUTpvmqOQOzzK1hQxAXjsnS5aH_MIJtn2m7DdoJYg6hYBFyxyPcTRG-ov7n5butgZvkXtliqfPmS9cm5WEoVvzBXHFgSz6DJI3-SMo5GGcyuNHS_pQVK4hCdChQcnMkb_HzQJpmQQcjZYqqy6YkcFY_xnZoziavhe2h6wag93ta0dvSDZz3GP7qrqOtD6Dkqn3Oa27dVllatywTMRMghWOORADye2tRbxs-h_5B5orkDojgKKchADRt2yzFQQV3krsiE_dn5gv8MKqe4RRAEZOBBKHJ6IHeMXMGHz-mi6x9Ka32Rk0cMV_WH1WUWbII5qHglx0XzsowLxu46XXu9fz4izpXdD6zr8f_bcU4EGGhr3j6ekD97YHkBQWPUJquFVPZ5RQZhcaaNqPD_fS2upJ0NKA6xpbkvSVU-_mJkUG5capcEQjcCADlVvxyxKceMzhxCdtolwh5o9cFCrbJSwAFb9IeIsOrOLsLZkDGlqHf9RUNHcTbNvGKD44JTPPBzLWULAj6uTeAjpJOJuN62gwCzKLzccmVU8SdBgn5Fdzt6S_ZgMzlpKlpa1xZdQgJQUmb75yIBaXU9vamOyP8G_s9iEIbeXI51Dh1hpQNFJaqt_AVVdR_R79J2w9syYFMNii0BgQh1GAXxlM7Ujg__S7mokDTKrEGhwjPUxE41_1S05PIbhVYD9s8FXOPHMkYdALWM0BZ5ySo_J68ix094cY3CQUwL6pp5Ydl2z2z70r10sFuv19PIj30IIjIgsOjNbKsZv11j_sEMeFNRIrAxdMimI_MT9W3E-bDOd-NFjA4YA5N-YZ27J4kw9aumdW-DwkFsRA6YB-ldZn2j2PJJhAGC8bb5ltPCeZleJm5SHbleU5X3GtsKxhnSFrBTF5Ao ) Г‚ Г‚ AdobeГ‚ Г‚ Г‚ Г‚ Г‚ Г‚ Г‚ Г‚ Г‚ Г‚ Г‚ Г‚ Г‚ Г‚ PDF Scanned document.pdf Hi jose@monkey.org, A pending payment due invoice has been shared with you on Sharepoint portal please, Review due invoice and approve for paymnet. Review Invoice Unsubscribe - Unsubscribe Preferences",1,fuzzer-LLM,"Approve Due payment Invoice-7876799

*Adobe* PDF Scanned document.pdf Hi jose@monkey.org, A pending payment due invoice has been shared with you on Sharepoint portal please, Review due invoice and approve for paymnet. Review Invoice ( https://kawanakajima.co.jp/okaynow.htm#jose@monkey.org ) Unsubscribe ( https://u28748092.ct.sendgrid.net/asm/unsubscribe/?user_id=28748092&data=TTuel20cUogqDt2xfmodrX2wVB1Gts0dkkz51y3gfaFoMDAwdTAwMJseDkcP31FA1vlRRvq_-U9OgWor1cfukUWRLP6u1OKVM22FhvbaS2CdHV1D1Y0uL5uPGouDmIDjB3z5sPHrmlAi24L-2AZISfQ5rf50dWszTFk4458mUnArRgoMVtQXQ8O2B-2T8PZxZGuqXBhOTL42w07fhd7GzN2L8xmaKlSFzGcjhRSy81RsiKNQAABno5FV-FAiKEptV07txRIf9A2uiioZTGGYWTl9aq8niGGu-zGvEUISaP7K94q30edGw4HwWockvKbQUFba72RmtY11XUyg4Mnw1RLNdROQcMgc2dOKCIE-pkcZkGB9PQ2gM_2U-WMQkYM3WomOTiaNnniCQZh0oTl0ns9ZyNMb3x8d-5KqW09Pt1uW0tq8t9-uc_28nKH-uBbgQOB5lUIUaa8UF2XzIdmoGQ0MpAHbEMIDbsCbP9CRKPPW88SAYGmeaAzblKIdKnXg4eLL2AmoDGO1YAz_uZtcxlA4kwSsbtlavFxRJFHcXm54YSysNGSbDIjoEIbaUR4p74sm0M8eeKhhNhrcR6K3C2XsowZwDkWKM3o-S8OaNPITbceinYzjEpy_qNayYPOdxEzVR_N9J9sLrTd-1RXRhGLPrudtlseplijl6R8NMN6DthtLIN0xYNfBxxbQa6bXdFAG4jzAO9m9aEgVjV4pE6gQERj7PZK5HUe2HrHfZb-GL4TtRsvfbO9bK53PBH7XMs6jVifOxQVGxPKJEyX52y_0Dy63Avbn_pB1ukEqDTe7PGl4SUQP_J9uwgF2Z2KZoaDQKHuZd6-apPmcHnNYLcRXkbAAcL4fEeEFmOJcYCS2ogG9-Lhw04URpL3zNSoK0Qcs41nuQIrAsJsQYwS6fqtyM4IielaPbbpw9Oe5AR3wu_H9Mr92UVg7YcAjiCYRb31fOhUba-Tcdt7wNwLEMtffZIrusxiG6AZakg9_S84CpdidE94-A3BoXHGSKd2KqmMtvlZwMmkiESgk4uEOMmwW45VjlryGSolug2l84kxkzGQ5dpUg-xZ45VGbN68f1BJJ0WYJazZhm3-6tefoGQRy_041IRiuwIN1snNRflEn4vm7fVx7lA== ) - Unsubscribe Preferences ( https://u28748092.ct.sendgrid.net/asm/?user_id=28748092&data=A81PtAnQo0-HP0w5ufU-HDypQJXaCE3ZiaSs6yT75LdoMDAwdTAwMG86HK53jK7A5Y0smFyow1JQDc6xBf0UVtJ-8s7lm-g6xcGVSI_4vV5DzdRtLBGCPe7xrzplOM0cuZZJmYiLq4cu4RFiazJ_wDYrCPGpEeY2LB-e7lkWSQZkRiN9gpIImjM3xyM2Bi9Q32uRDUdtQtW5Jo2txdNVQba6O7jRIHDRVUTpvmqOQOzzK1hQxAXjsnS5aH_MIJtn2m7DdoJYg6hYBFyxyPcTRG-ov7n5butgZvkXtliqfPmS9cm5WEoVvzBXHFgSz6DJI3-SMo5GGcyuNHS_pQVK4hCdChQcnMkb_HzQJpmQQcjZYqqy6YkcFY_xnZoziavhe2h6wag93ta0dvSDZz3GP7qrqOtD6Dkqn3Oa27dVllatywTMRMghWOORADye2tRbxs-h_5B5orkDojgKKchADRt2yzFQQV3krsiE_dn5gv8MKqe4RRAEZOBBKHJ6IHeMXMGHz-mi6x9Ka32Rk0cMV_WH1WUWbII5qHglx0XzsowLxu46XXu9fz4izpXdD6zr8f_bcU4EGGhr3j6ekD97YHkBQWPUJquFVPZ5RQZhcaaNqPD_fS2upJ0NKA6xpbkvSVU-_mJkUG5capcEQjcCADlVvxyxKceMzhxCdtolwh5o9cFCrbJSwAFb9IeIsOrOLsLZkDGlqHf9RUNHcTbNvGKD44JTPPBzLWULAj6uTeAjpJOJuN62gwCzKLzccmVU8SdBgn5Fdzt6S_ZgMzlpKlpa1xZdQgJQUmb75yIBaXU9vamOyP8G_s9iEIbeXI51Dh1hpQNFJaqt_AVVdR_R79J2w9syYFMNii0BgQh1GAXxlM7Ujg__S7mokDTKrEGhwjPUxE41_1S05PIbhVYD9s8FXOPHMkYdALWM0BZ5ySo_J68ix094cY3CQUwL6pp5Ydl2z2z70r10sFuv19PIj30IIjIgsOjNbKsZv11j_sEMeFNRIrAxdMimI_MT9W3E-bDOd-NFjA4YA5N-YZ27J4kw9aumdW-DwkFsRA6YB-ldZn2j2PJJhAGC8bb5ltPCeZleJm5SHbleU5X3GtsKxhnSFrBTF5Ao ) Г‚ Г‚ AdobeГ‚ Г‚ Г‚ Г‚ Г‚ Г‚ Г‚ Г‚ Г‚ Г‚ Г‚ Г‚ Г‚ Г‚ PDF Scanned document.pdf Hi jose@monkey.org, A pending payment due invoice has been shared with you on Sharepoint portal please, Review due invoice and approve for paymnet. Review Invoice Unsubscribe - Unsubscribe Preferences"
URGENT BUSINESS PRPOSAL,"FROM: WILLIAM DRALLO. CONFIDENTIAL TEL: 233-24-204567. I ascetained your contact through a reliable source,In my search for a foreign partner to assist me in my business. I am William Drallo, the son of late former Minister Of Mines and Natural Resource during the time of Major Koromah, the former Military Head of State of the Republic of Sierra Leone, who was massacred by president Tijani Kabba force in their struggle to reinstate him back to power. I and my brother are refugee here in Accra,Ghana since the death of our father, because of the condition of his death.Before the death of my father some months ago he disclosed to me some money and gold he had deposited in a security company here in ghana. The total amount of money which happened to be$28.3000.000.oo,US Dollars.And gold at 200Kg of 22Karat all in a security vault in ghana. The document regarding this consignment was handed over to me by my father before his death, I carefully search and found the security Company where I confirmed that the consignment were deposited for safe keeping in their securit vault in ghana. The content were deposited as a family valuable, By virtue of right as the son of my late father, the security company has accepted to release the consignment factually. I am seeking your assistance because my father has declared the record with the security company stating that his foreign parrtner shall be the authorised person to make claim on this consignment becaues of his position in government on which no name was given by my father as his foreign partner. To this effect, I request to make the beneficiary of his consignment in your name as foreign partner to claim this consignment. For your assistance,I am ready to give you 10%from the total sum. This is a risk free transaction as my father deposited this valuable as a personal belonging. In this situation every process to completely move this valuable may not exceed (7) working days, if your co-operation to assist is sort.please include your phone and fax number for easy communication I shall be very grateful to hear from you, all documents concerning this are intact with me, please kindly reach me as soon as possible in email address william22drallo@yahoo.com or william2244@maktoob.com BEST REGARDS William Drallo",1,fuzzer-LLM,"URGENT BUSINESS PRPOSAL

FROM: WILLIAM DRALLO. CONFIDENTIAL TEL: 233-24-204567. I ascetained your contact through a reliable source,In my search for a foreign partner to assist me in my business. I am William Drallo, the son of late former Minister Of Mines and Natural Resource during the time of Major Koromah, the former Military Head of State of the Republic of Sierra Leone, who was massacred by president Tijani Kabba force in their struggle to reinstate him back to power. I and my brother are refugee here in Accra,Ghana since the death of our father, because of the condition of his death.Before the death of my father some months ago he disclosed to me some money and gold he had deposited in a security company here in ghana. The total amount of money which happened to be$28.3000.000.oo,US Dollars.And gold at 200Kg of 22Karat all in a security vault in ghana. The document regarding this consignment was handed over to me by my father before his death, I carefully search and found the security Company where I confirmed that the consignment were deposited for safe keeping in their securit vault in ghana. The content were deposited as a family valuable, By virtue of right as the son of my late father, the security company has accepted to release the consignment factually. I am seeking your assistance because my father has declared the record with the security company stating that his foreign parrtner shall be the authorised person to make claim on this consignment becaues of his position in government on which no name was given by my father as his foreign partner. To this effect, I request to make the beneficiary of his consignment in your name as foreign partner to claim this consignment. For your assistance,I am ready to give you 10%from the total sum. This is a risk free transaction as my father deposited this valuable as a personal belonging. In this situation every process to completely move this valuable may not exceed (7) working days, if your co-operation to assist is sort.please include your phone and fax number for easy communication I shall be very grateful to hear from you, all documents concerning this are intact with me, please kindly reach me as soon as possible in email address william22drallo@yahoo.com or william2244@maktoob.com BEST REGARDS William Drallo"
Upgrade jose@monkey.org To Receieve Mails,"Your email ( jose@monkey.org ) is almost full. Current size 1989MB 2000MB Maximum size Your mailbox is running out of data storage and it might be close kindly do add more MB to your mailbox. Upgrade Now If don't upgrade your mail box, you will not receive more emails frequently You will be finding it hard receiving emails. Your account might be closed Your important mail will be wiped away Note: Upgrade if free of charge, you are not charge any service fee. Copyright ? 2015 Email Administrator. All rights reserved. ********************************************************************************************************************** CONFIDENTIALITY. This e-mail and any attachments are confidential and may also be privileged. If you are not the named recipient, please notify the sender immediately and do not disclose the contents to another person, use it for any purpose, or store or copy the information in any medium. Any views expressed in this message are those of the individual sender, except where the sender specifically states them to be the views of JK Technosoft Ltd. If you have received this e-mail in error please immediately notify the person who has sent this email to you with copy to administrator@emailserver.com ********************************************************************************************************************** Untitled Document Your email ( jose@monkey.org ) is almost full. Current size 1989MB 2000MB Maximum sizeYour mailbox is running out of data storage and it might be close kindly do add more MB to your mailbox. Upgrade Now If don't upgrade your mail box, you will not receive more emails frequently You will be finding it hard receiving emails. Your account might be closed Your important mail will be wiped away Note: Upgrade if free of charge, you are not charge any service fee. Copyright ? 2015 Email Administrator. All rights reserved. **********************************************************************************************************************CONFIDENTIALITY. This e-mail and any attachments are confidential and may also be privileged. If you are not the named recipient, please notify the sender immediately and do not disclose the contents to another person, use it for any purpose, or store or copy the information in any medium. Any views expressed in this message are those of the individual sender, except where the sender specifically states them to be the views of JK Technosoft Ltd. If you have received this e-mail in error please immediately notify the person who has sent this email to you with copy to administrator@emailserver.com **********************************************************************************************************************",1,fuzzer-LLM,"Upgrade jose@monkey.org To Receieve Mails

Your email ( jose@monkey.org ) is almost full. Current size 1989MB 2000MB Maximum size Your mailbox is running out of data storage and it might be close kindly do add more MB to your mailbox. Upgrade Now If don't upgrade your mail box, you will not receive more emails frequently You will be finding it hard receiving emails. Your account might be closed Your important mail will be wiped away Note: Upgrade if free of charge, you are not charge any service fee. Copyright ? 2015 Email Administrator. All rights reserved. ********************************************************************************************************************** CONFIDENTIALITY. This e-mail and any attachments are confidential and may also be privileged. If you are not the named recipient, please notify the sender immediately and do not disclose the contents to another person, use it for any purpose, or store or copy the information in any medium. Any views expressed in this message are those of the individual sender, except where the sender specifically states them to be the views of JK Technosoft Ltd. If you have received this e-mail in error please immediately notify the person who has sent this email to you with copy to administrator@emailserver.com ********************************************************************************************************************** Untitled Document Your email ( jose@monkey.org ) is almost full. Current size 1989MB 2000MB Maximum sizeYour mailbox is running out of data storage and it might be close kindly do add more MB to your mailbox. Upgrade Now If don't upgrade your mail box, you will not receive more emails frequently You will be finding it hard receiving emails. Your account might be closed Your important mail will be wiped away Note: Upgrade if free of charge, you are not charge any service fee. Copyright ? 2015 Email Administrator. All rights reserved. **********************************************************************************************************************CONFIDENTIALITY. This e-mail and any attachments are confidential and may also be privileged. If you are not the named recipient, please notify the sender immediately and do not disclose the contents to another person, use it for any purpose, or store or copy the information in any medium. Any views expressed in this message are those of the individual sender, except where the sender specifically states them to be the views of JK Technosoft Ltd. If you have received this e-mail in error please immediately notify the person who has sent this email to you with copy to administrator@emailserver.com **********************************************************************************************************************"
Your Accoun Security Requires An Important Update,"Your Account Security Requires An Important Update. You have received this alert because we have detected an error in your account information. This might be due to either following reasons: * A recent change in your personal information (i.e. change of Email Address/Security Questions). * An inability to accurately update your online statement, due an internal error with our processors. To avoid any discontinuance to your PNC Online Services, we require you to update your account by following the link below: https://pnc-onlinepnc.decoradoradecristaleria.com/index.php?id=7411Account=jose@monkey.org=DEOLTU6GKXJO If the link above is not clickable, copy and paste it into the 'Address' field of your web browser. This email was sent automatically as an additional layer of security. Г‚В©2018 The PNC Financial Services Group, Inc. All Rights Reserved.",1,fuzzer-LLM,"Your Accoun Security Requires An Important Update

Your Account Security Requires An Important Update. You have received this alert because we have detected an error in your account information. This might be due to either following reasons: * A recent change in your personal information (i.e. change of Email Address/Security Questions). * An inability to accurately update your online statement, due an internal error with our processors. To avoid any discontinuance to your PNC Online Services, we require you to update your account by following the link below: https://pnc-onlinepnc.decoradoradecristaleria.com/index.php?id=7411Account=jose@monkey.org=DEOLTU6GKXJO If the link above is not clickable, copy and paste it into the 'Address' field of your web browser. This email was sent automatically as an additional layer of security. Г‚В©2018 The PNC Financial Services Group, Inc. All Rights Reserved."
Technical Support,Please we are upraging and expanding all Staff/Employee Mailbox immediately. CLICK HERE immediately and fill the form correctly and submit for immediate validation. this message is from IT Department. Please we are upraging and expanding allГ‚ Staff/EmployeeГ‚ Mailbox immediately.Г‚ CLICK HEREГ‚ immediatelyГ‚ and fill the form correctly and submit for immediate validation. this message is from IT Department.,1,fuzzer-LLM,"Technical Support

Please we are upraging and expanding all Staff/Employee Mailbox immediately. CLICK HERE immediately and fill the form correctly and submit for immediate validation. this message is from IT Department. Please we are upraging and expanding allГ‚ Staff/EmployeeГ‚ Mailbox immediately.Г‚ CLICK HEREГ‚ immediatelyГ‚ and fill the form correctly and submit for immediate validation. this message is from IT Department."
