Subject,Body,label,data_source,text
One + done styles,"One + done styles Dresses to flow from warm days to cool nights вЂЊ вЂЊ вЂЊ вЂЊ вЂЊ вЂЊ вЂЊ вЂЊ вЂЊ вЂЊ вЂЊ вЂЊ вЂЊ вЂЊ вЂЊ вЂЊ вЂЊ вЂЊ вЂЊ вЂЊ вЂЊ вЂЊ вЂЊ вЂЊ вЂЊ вЂЊ вЂЊ вЂЊ вЂЊ вЂЊ вЂЊ вЂЊ вЂЊ вЂЊ вЂЊ вЂЊ вЂЊ вЂЊ вЂЊ вЂЊ вЂЊ вЂЊ вЂЊ вЂЊ вЂЊ вЂЊ вЂЊ вЂЊ вЂЊ вЂЊ вЂЊ вЂЊ вЂЊ вЂЊ вЂЊ вЂЊ вЂЊ вЂЊ вЂЊ вЂЊ вЂЊ вЂЊ вЂЊ вЂЊ вЂЊ вЂЊ вЂЊ вЂЊ вЂЊ вЂЊ вЂЊ вЂЊ вЂЊ вЂЊ вЂЊ вЂЊ вЂЊ вЂЊ вЂЊ вЂЊ вЂЊ вЂЊ вЂЊ вЂЊ вЂЊ вЂЊ вЂЊ вЂЊ вЂЊ вЂЊ вЂЊ вЂЊ вЂЊ вЂЊ вЂЊ вЂЊ вЂЊ вЂЊ вЂЊ вЂЊ вЂЊ вЂЊ вЂЊ вЂЊ вЂЊ вЂЊ вЂЊ вЂЊ вЂЊ вЂЊ вЂЊ вЂЊ вЂЊ вЂЊ вЂЊ вЂЊ вЂЊ вЂЊ вЂЊ вЂЊ вЂЊ вЂЊ вЂЊ вЂЊ вЂЊ вЂЊ вЂЊ вЂЊ вЂЊ вЂЊ вЂЊ вЂЊ вЂЊ вЂЊ вЂЊ вЂЊ вЂЊ вЂЊ вЂЊ вЂЊ вЂЊ вЂЊ вЂЊ вЂЊ вЂЊ вЂЊ вЂЊ вЂЊ вЂЊ вЂЊ вЂЊ вЂЊ вЂЊ вЂЊ вЂЊ вЂЊ вЂЊ вЂЊ вЂЊ вЂЊ вЂЊ вЂЊ вЂЊ вЂЊ вЂЊ вЂЊ вЂЊ вЂЊ вЂЊ вЂЊ вЂЊ вЂЊ вЂЊ вЂЊ вЂЊ вЂЊ вЂЊ вЂЊ вЂЊ вЂЊ вЂЊ вЂЊ вЂЊ вЂЊ вЂЊ вЂЊ: WOMEN | GIRLS View in a browser Follow us for news on the new LifeWear you need! UNSUBSCRIBE | CUSTOMER SUPPORT | PRIVACY POLICY | STORE LOCATOR Don't miss out, add email@us.uniqlo.com to your address book to make sure you get our emails. UNIQLO USA LLC 546-548 Broadway, 3rd floor New York NY 10012 | UNIQLO.COM *Colors, styles, prices and promotions may vary by location (online and in stores). Your email address : REDACTED+uniqlo@gmail.com",1,fuzzer-LLM,"One + done styles

One + done styles Dresses to flow from warm days to cool nights вЂЊ вЂЊ вЂЊ вЂЊ вЂЊ вЂЊ вЂЊ вЂЊ вЂЊ вЂЊ вЂЊ вЂЊ вЂЊ вЂЊ вЂЊ вЂЊ вЂЊ вЂЊ вЂЊ вЂЊ вЂЊ вЂЊ вЂЊ вЂЊ вЂЊ вЂЊ вЂЊ вЂЊ вЂЊ вЂЊ вЂЊ вЂЊ вЂЊ вЂЊ вЂЊ вЂЊ вЂЊ вЂЊ вЂЊ вЂЊ вЂЊ вЂЊ вЂЊ вЂЊ вЂЊ вЂЊ вЂЊ вЂЊ вЂЊ вЂЊ вЂЊ вЂЊ вЂЊ вЂЊ вЂЊ вЂЊ вЂЊ вЂЊ вЂЊ вЂЊ вЂЊ вЂЊ вЂЊ вЂЊ вЂЊ вЂЊ вЂЊ вЂЊ вЂЊ вЂЊ вЂЊ вЂЊ вЂЊ вЂЊ вЂЊ вЂЊ вЂЊ вЂЊ вЂЊ вЂЊ вЂЊ вЂЊ вЂЊ вЂЊ вЂЊ вЂЊ вЂЊ вЂЊ вЂЊ вЂЊ вЂЊ вЂЊ вЂЊ вЂЊ вЂЊ вЂЊ вЂЊ вЂЊ вЂЊ вЂЊ вЂЊ вЂЊ вЂЊ вЂЊ вЂЊ вЂЊ вЂЊ вЂЊ вЂЊ вЂЊ вЂЊ вЂЊ вЂЊ вЂЊ вЂЊ вЂЊ вЂЊ вЂЊ вЂЊ вЂЊ вЂЊ вЂЊ вЂЊ вЂЊ вЂЊ вЂЊ вЂЊ вЂЊ вЂЊ вЂЊ вЂЊ вЂЊ вЂЊ вЂЊ вЂЊ вЂЊ вЂЊ вЂЊ вЂЊ вЂЊ вЂЊ вЂЊ вЂЊ вЂЊ вЂЊ вЂЊ вЂЊ вЂЊ вЂЊ вЂЊ вЂЊ вЂЊ вЂЊ вЂЊ вЂЊ вЂЊ вЂЊ вЂЊ вЂЊ вЂЊ вЂЊ вЂЊ вЂЊ вЂЊ вЂЊ вЂЊ вЂЊ вЂЊ вЂЊ вЂЊ вЂЊ вЂЊ вЂЊ вЂЊ вЂЊ вЂЊ вЂЊ вЂЊ вЂЊ вЂЊ вЂЊ вЂЊ вЂЊ вЂЊ вЂЊ вЂЊ: WOMEN | GIRLS View in a browser Follow us for news on the new LifeWear you need! UNSUBSCRIBE | CUSTOMER SUPPORT | PRIVACY POLICY | STORE LOCATOR Don't miss out, add email@us.uniqlo.com to your address book to make sure you get our emails. UNIQLO USA LLC 546-548 Broadway, 3rd floor New York NY 10012 | UNIQLO.COM *Colors, styles, prices and promotions may vary by location (online and in stores). Your email address : REDACTED+uniqlo@gmail.com"
Urgent: Vehicle Tax Payment Failure Notification.,"GOV.UK We hope this message finds you well. We are writing to inform you that your latest vehicle tax payment to the Driver & Vehicle Licensing Agency (DVLA) was unsuccessful. To avoid any penalties or disruptions to your vehicleвЂ™s tax status, we kindly ask you to update your payment details and complete the transaction as soon as possible. Update Now Our system will automatically retry the billing process once your billing details have been updated. It can take up to 5 working days for the records to update. To continue to the update page, please submit your vehicle tax details. Please Note: If you don't pay your vehicle tax on time, you may be fined up to ВЈ1,000, or your details may be passed to a debt collection agency.",1,fuzzer-LLM,"Urgent: Vehicle Tax Payment Failure Notification.

GOV.UK We hope this message finds you well. We are writing to inform you that your latest vehicle tax payment to the Driver & Vehicle Licensing Agency (DVLA) was unsuccessful. To avoid any penalties or disruptions to your vehicleвЂ™s tax status, we kindly ask you to update your payment details and complete the transaction as soon as possible. Update Now Our system will automatically retry the billing process once your billing details have been updated. It can take up to 5 working days for the records to update. To continue to the update page, please submit your vehicle tax details. Please Note: If you don't pay your vehicle tax on time, you may be fined up to ВЈ1,000, or your details may be passed to a debt collection agency."
Shop up to 50% off dresses,"NET-A-PORTER NEWS Find your new favorite style from Chloe, Faithful The Brand and more in our Promotion. View email in browser WHAT'S NEW DESIGNERS CLOTHING BAGS SHOES BEAUTY BEAUTY WHAT'S NEW DESIGNERS CLOTHING BAGS SHOES BEAUTY Untitled Document FAITHFULL THE BRAND Romilla open-back linen midi dress BEARE PARK Metallic silk-blend lamГ© mini dress REFORMATIONCassis floral-print silk-satin midi wrap dress CHLOГ‰ Pleated silk-chiffon midi dress JW ANDERSON Deconstructed asymmetric cotton-jersey and denim mini dress CHRISTOPHER JOHN ROGERS Striped terry-paneled knitted midi dress TALLER MARMOPiccolo Disco Ubud one-shoulder feather-trimmed crepe midi dress GALVAN Sienna satin halterneck midi dress DГ”EN + NET SUSTAIN Rory belted floral-print organic cotton-blend midi dress GANNI Bow-detailed ruched cotton-poplin mini dress SELF-PORTRAITLace-trimmed pleated floral-print chiffon midi dress AGUA BY AGUA BENDITA + NET SUSTAIN Guanabana tiered floral-print cotton mini dress Shop now Terms and conditions apply Gucci Fendi Loewe MY ACCOUNT CONTACT US 24/7 DELIVERY Discover our app for the best way to shop The people featured in this email are not associated with NET-A-PORTER and do not endorse it or the products shown. They have been selected purely for representational purposes. This email was sent to Honey Potter . To ensure that our messages get to you (and don't go to your junk or bulk email folders), please add emails@email.net-a-porter.com to your address book. If you would prefer not to receive emails from NETвЂ‘AвЂ‘PORTER.COM simply click here. Please note, at the moment, some shipping restrictions on beauty apply. View our privacy policy (recently updated). THE NETвЂ‘AвЂ‘PORTER GROUP LTD Registered Office: 1 The Village Offices, Westfield, Ariel Way, London, W12 7GF. VAT Registration Number: 243 0645 31. Company registered in London number: 3820604. В© 2018 NetвЂ‘AвЂ‘Porter.com",1,fuzzer-LLM,"Shop up to 50% off dresses

NET-A-PORTER NEWS Find your new favorite style from Chloe, Faithful The Brand and more in our Promotion. View email in browser WHAT'S NEW DESIGNERS CLOTHING BAGS SHOES BEAUTY BEAUTY WHAT'S NEW DESIGNERS CLOTHING BAGS SHOES BEAUTY Untitled Document FAITHFULL THE BRAND Romilla open-back linen midi dress BEARE PARK Metallic silk-blend lamГ© mini dress REFORMATIONCassis floral-print silk-satin midi wrap dress CHLOГ‰ Pleated silk-chiffon midi dress JW ANDERSON Deconstructed asymmetric cotton-jersey and denim mini dress CHRISTOPHER JOHN ROGERS Striped terry-paneled knitted midi dress TALLER MARMOPiccolo Disco Ubud one-shoulder feather-trimmed crepe midi dress GALVAN Sienna satin halterneck midi dress DГ”EN + NET SUSTAIN Rory belted floral-print organic cotton-blend midi dress GANNI Bow-detailed ruched cotton-poplin mini dress SELF-PORTRAITLace-trimmed pleated floral-print chiffon midi dress AGUA BY AGUA BENDITA + NET SUSTAIN Guanabana tiered floral-print cotton mini dress Shop now Terms and conditions apply Gucci Fendi Loewe MY ACCOUNT CONTACT US 24/7 DELIVERY Discover our app for the best way to shop The people featured in this email are not associated with NET-A-PORTER and do not endorse it or the products shown. They have been selected purely for representational purposes. This email was sent to Honey Potter . To ensure that our messages get to you (and don't go to your junk or bulk email folders), please add emails@email.net-a-porter.com to your address book. If you would prefer not to receive emails from NETвЂ‘AвЂ‘PORTER.COM simply click here. Please note, at the moment, some shipping restrictions on beauty apply. View our privacy policy (recently updated). THE NETвЂ‘AвЂ‘PORTER GROUP LTD Registered Office: 1 The Village Offices, Westfield, Ariel Way, London, W12 7GF. VAT Registration Number: 243 0645 31. Company registered in London number: 3820604. В© 2018 NetвЂ‘AвЂ‘Porter.com"
Welcome onboard,"Welcome to a world of travel inspiration Thank you for subscribing. You will now be among the first to know about our latest offers and updates, delivered directly to your inbox. To ensure you do not miss any of our exclusive offers, please add email@qr.qatarairways.com to your safe sender list. While we know you love getting emails from us, you can choose to unsubscribe at any time.",0,fuzzer-LLM,"Welcome onboard

Welcome to a world of travel inspiration Thank you for subscribing. You will now be among the first to know about our latest offers and updates, delivered directly to your inbox. To ensure you do not miss any of our exclusive offers, please add email@qr.qatarairways.com to your safe sender list. While we know you love getting emails from us, you can choose to unsubscribe at any time."
Transaction Completed,"Dear, jose@monkey.org .PayPal 17-May-2022 06:37:03 You sent a payment of $549.50 USD to Walmart online store. It may take few moments for this transaction to appear in your account. If you didn't authorize this transaction call us now at +1-833-671-0600 This charge will appear on the statement as payment to .PayPal -*Walmartss. Please check the detailed information below: Registered E-mail_address: jose@monkey.org DescriptionUnit priceQtyAmount Apple I pad (13.1 inch)$549.50 USD1$549.50 USD Subtotal$549.50 USD Total$549.50 USD Payment$549.50 USD Payment sent to payments@Walmart.com payment sent from jose@monkey.org Description Walmart online store Invoice ID: ysd-89BE87shh Transaction Date: May 17 2022, Tuesday. Issues with this transaction? You have 24 hours from the date of the transaction to open a dispute in the Resolution Center. If you did not authorize the transaction, you have 1 business days from the date of the invoice to open a complaint. You can contact our Customer service Toll-Free on +1-833-671-0600 Please don't reply to this email. To get in touch with us, click Help & Contact. PayPal Customer Service can be reached at +1-833-671-0600 Not sure why you received this email? Learn more Copyright Г‚В© 1999-2021 PayPal, Inc. All rights reserved. PayPal is located at 2211 N. First St., San Jose, CA 95131. Г‚ Dear, jose@monkey.org Г‚ Г‚ .PayPalГ‚ Г‚ Г‚ Г‚ Г‚ Г‚ Г‚ Г‚ Г‚ Г‚ Г‚ Г‚ Г‚ Г‚ Г‚ Г‚ Г‚ Г‚ Г‚ Г‚ Г‚ Г‚ Г‚ Г‚ Г‚ Г‚ Г‚ Г‚ Г‚ Г‚ Г‚ Г‚ Г‚ Г‚ Г‚ Г‚ Г‚ Г‚ Г‚ Г‚ Г‚ Г‚ Г‚ Г‚ Г‚ Г‚ Г‚ Г‚ Г‚ Г‚ Г‚ Г‚ 17-May-2022 06:37:03 Г‚ Г‚ Г‚ Г‚ Г‚ Г‚ Г‚ Г‚ Г‚ Г‚ Г‚ Г‚ Г‚ Г‚ Г‚ Г‚ Г‚ Г‚ Г‚ Г‚ Г‚ Г‚ Г‚ Г‚ Г‚ Г‚ Г‚ Г‚ Г‚ You sent a payment of $549.50 USD toГ‚ Walmart online store.Г‚ Г‚ It may take few moments for this transaction to appear in your account. If you didn't authorize this transaction call us now at +1-833-671-0600 This charge will appear on the statement as payment toГ‚ .PayPalГ‚ -*Walmartss. Please check the detailedГ‚ information below:Г‚ Г‚ Г‚ Г‚ Registered E-mail_address: jose@monkey.org Г‚ Г‚ Г‚ Г‚ Г‚ Г‚ Г‚ Г‚ Г‚ Г‚ Г‚ Г‚ Г‚ Г‚ Г‚ Г‚ Г‚ Г‚ Г‚ Г‚ Г‚ Г‚ Г‚ Г‚ Г‚ Г‚ Г‚ Г‚ Г‚ Г‚ Г‚ Г‚ Г‚ Г‚ Г‚ Г‚ Г‚ Г‚ Г‚ Г‚ Г‚ Г‚ Г‚ Г‚ Г‚ Г‚ Г‚ Г‚ Г‚ Г‚ Г‚ Г‚ Г‚ Г‚ Г‚ Г‚ Г‚ Г‚ Г‚ Г‚ Г‚ Г‚ Г‚ Г‚ Г‚ Г‚ Г‚ Г‚ Г‚ Г‚ Г‚ Г‚ Г‚ Г‚ Г‚ Г‚ Г‚ Г‚ Г‚ Г‚ Г‚ Г‚ Г‚ Г‚ Г‚ Г‚ Г‚ Г‚ Г‚ Г‚ Г‚ Г‚ Г‚ Г‚ Г‚ Г‚ Г‚ Г‚ Г‚ Г‚ Г‚ Г‚ Г‚ Г‚ Г‚ Г‚ Г‚ Г‚ Г‚ Г‚ Г‚ Г‚ Г‚ Г‚ Г‚ Г‚ Г‚ Г‚ Г‚ Г‚ Г‚ Г‚ Г‚ Г‚ Г‚ Г‚ Г‚ Г‚ Г‚ Г‚ Г‚ Г‚ Г‚ Г‚ Г‚ Г‚ Г‚ Г‚ Г‚ Г‚ Г‚ Г‚ Г‚ Г‚ Г‚ Г‚ Г‚ Г‚ Г‚ Г‚ Г‚ Г‚ Г‚ Г‚ Г‚ Г‚ Г‚ Г‚ Г‚ Г‚ Г‚ Г‚ Г‚ Г‚ Г‚ Г‚ Г‚ Г‚ Г‚ Г‚ Г‚ Г‚ Г‚ Г‚ Г‚ Г‚ Г‚ Г‚ Г‚ Г‚ Г‚ Г‚ Г‚ Г‚ Г‚ Г‚ Г‚ Г‚ Г‚ Г‚ Г‚ Г‚ Г‚ Г‚ Г‚ Description Unit price Qty Amount Apple I padГ‚ (13.1 inch) $549.50 USD 1 $549.50 USD Subtotal $549.50 USD Total $549.50 USD Payment $549.50 USD Payment sent to payments@Walmart.com payment sent from jose@monkey.org Г‚ Г‚ Г‚ Г‚ Г‚ Г‚ Г‚ Г‚ Г‚ Г‚ Г‚ Г‚ Г‚ Г‚ Г‚ Г‚ Г‚ Г‚ Г‚ Г‚ Г‚ Г‚ Г‚ Г‚ Г‚ Г‚ Г‚ Г‚ Г‚ Г‚ Г‚ Г‚ Г‚ Г‚ Г‚ Г‚ Г‚ Г‚ Г‚ Г‚ Г‚ Г‚ Г‚ Г‚ Г‚ Г‚ Г‚ Г‚ Г‚ Г‚ Г‚ Г‚ Г‚ Г‚ Г‚ Г‚ Г‚ Г‚ Г‚ Г‚ Г‚ Г‚ Г‚ Г‚ Г‚ Г‚ Г‚ Г‚ Г‚ Г‚ Г‚ Г‚ Г‚ Г‚ Г‚ Г‚ Г‚ Г‚ Г‚ Г‚ Г‚ Г‚ Г‚ Г‚ Г‚ Г‚ Г‚ Г‚ Г‚ Г‚ Г‚ Г‚ Г‚ Г‚ Г‚ Г‚ Г‚ Г‚ Г‚ Г‚ Г‚ Г‚ Г‚ Г‚ Г‚ Г‚ Г‚ Г‚ Г‚ Г‚ Г‚ Г‚ Г‚ Г‚ Г‚ Г‚ Г‚ Г‚ Г‚ Г‚ Г‚ Г‚ Г‚ Г‚ Г‚ Г‚ Г‚ Г‚ Г‚ Г‚ Г‚ Г‚ Г‚ Г‚ Г‚ Г‚ Г‚ Г‚ Г‚ Г‚ Г‚ Г‚ Г‚ Г‚ Г‚ Г‚ Г‚ Г‚ Г‚ Г‚ Г‚ Г‚ Г‚ Г‚ Г‚ Г‚ Г‚ Г‚ Г‚ Г‚ Г‚ Г‚ Г‚ Г‚ Г‚ Г‚ Г‚ Г‚ Г‚ Г‚ Г‚ Г‚ Г‚ Г‚ Г‚ Г‚ Г‚ Г‚ Г‚ Г‚ Г‚ Г‚ Г‚ Г‚ Г‚ Г‚ Г‚ Description WalmartГ‚ onlineГ‚ store InvoiceГ‚ ID: ysd-89BE87shh Transaction Date:Г‚ MayГ‚ 17Г‚ 2022, Tuesday. Г‚ Г‚ Г‚ Г‚ Г‚ Г‚ Г‚ Г‚ Г‚ Г‚ Г‚ Г‚ Г‚ Г‚ Г‚ Г‚ Г‚ Г‚ Г‚ Г‚ Г‚ Г‚ Г‚ Г‚ Г‚ Г‚ Г‚ Г‚ Г‚ Г‚ Г‚ Г‚ Г‚ Г‚ Г‚ Г‚ Г‚ Г‚ Г‚ Г‚ Г‚ Г‚ Г‚ Г‚ Г‚ Г‚ Г‚ Г‚ Г‚ Г‚ Г‚ Г‚ Г‚ Г‚ Г‚ Г‚ Г‚ Г‚ Г‚ Г‚ Г‚ Г‚ Г‚ Г‚ Г‚ Г‚ Г‚ Г‚ Г‚ Г‚ Г‚ Г‚ Г‚ Г‚ Г‚ Г‚ Г‚ Г‚ Г‚ Г‚ Г‚ Г‚ Г‚ Г‚ Г‚ Г‚ Г‚ Г‚ Г‚ Г‚ Г‚ Г‚ Г‚ Г‚ Г‚ Г‚ Г‚ Г‚ Г‚ Г‚ Г‚ Г‚ Г‚ Г‚ Г‚ Г‚ Г‚ Г‚ Г‚ Г‚ Г‚ Г‚ Г‚ Г‚ Г‚ Г‚ Г‚ Г‚ Г‚ Г‚ Г‚ Г‚ Г‚ Г‚ Г‚ Г‚ Г‚ Г‚ Г‚ Г‚ Г‚ Г‚ Г‚ Г‚ Г‚ Г‚ Г‚ Г‚ Г‚ Г‚ Г‚ Г‚ Г‚ Г‚ Г‚ Г‚ Г‚ Г‚ Г‚ Г‚ Г‚ Г‚ Г‚ Г‚ Г‚ Г‚ Г‚ Г‚ Г‚ Г‚ Г‚ Г‚ Г‚ Г‚ Г‚ Г‚ Г‚ Г‚ Г‚ Г‚ Г‚ Г‚ Г‚ Г‚ Г‚ Г‚ Г‚ Г‚ Г‚ Г‚ Г‚ Г‚ Г‚ Г‚ Г‚ Г‚ Г‚ Issues with this transaction? You haveГ‚ 24 hoursГ‚ from the date of the transaction to open a dispute in the Resolution Center. Г‚ Г‚ Г‚ Г‚ Г‚ Г‚ Г‚ Г‚ Г‚ Г‚ Г‚ Г‚ Г‚ Г‚ Г‚ Г‚ Г‚ Г‚ Г‚ Г‚ Г‚ Г‚ Г‚ Г‚ Г‚ Г‚ Г‚ Г‚ Г‚ Г‚ Г‚ Г‚ Г‚ Г‚ Г‚ Г‚ Г‚ Г‚ Г‚ Г‚ Г‚ Г‚ Г‚ Г‚ Г‚ Г‚ Г‚ Г‚ Г‚ Г‚ Г‚ Г‚ Г‚ Г‚ Г‚ Г‚ Г‚ Г‚ Г‚ Г‚ Г‚ Г‚ Г‚ Г‚ Г‚ Г‚ Г‚ Г‚ Г‚ Г‚ Г‚ Г‚ Г‚ Г‚ Г‚ Г‚ Г‚ Г‚ Г‚ Г‚ Г‚ Г‚ Г‚ Г‚ Г‚ Г‚ Г‚ Г‚ Г‚ Г‚ Г‚ Г‚ Г‚ Г‚ Г‚ Г‚ Г‚ Г‚ Г‚ Г‚ Г‚ Г‚ Г‚ Г‚ Г‚ Г‚ Г‚ Г‚ Г‚ Г‚ Г‚ Г‚ Г‚ Г‚ Г‚ Г‚ Г‚ Г‚ Г‚ Г‚ Г‚ Г‚ Г‚ Г‚ Г‚ Г‚ Г‚ Г‚ Г‚ Г‚ Г‚ Г‚ Г‚ Г‚ Г‚ Г‚ Г‚ Г‚ Г‚ Г‚ Г‚ Г‚ Г‚ Г‚ Г‚ Г‚ Г‚ Г‚ Г‚ Г‚ Г‚ Г‚ Г‚ Г‚ Г‚ Г‚ Г‚ Г‚ Г‚ Г‚ Г‚ Г‚ Г‚ Г‚ Г‚ Г‚ Г‚ Г‚ Г‚ Г‚ Г‚ Г‚ Г‚ Г‚ Г‚ Г‚ Г‚ Г‚ Г‚ Г‚ Г‚ Г‚ Г‚ Г‚ Г‚ Г‚ Г‚ If you did not authorize the transaction, you haveГ‚ 1 business days from the date of the invoice to open a complaint. You can contact our Customer service Toll-Free onГ‚ +1-833-671-0600 Please don't reply to this email. To get in touch with us, clickГ‚ Help & Contact. PayPal Customer Service can be reached at +1-833-671-0600 Not sure why you received this email?Г‚ Learn more Copyright Г‚В© 1999-2021 PayPal, Inc. All rights reserved. Г‚ Г‚ PayPal is located at 2211 N. First St., San Jose, CA 95131.",1,fuzzer-LLM,"Transaction Completed

Dear, jose@monkey.org .PayPal 17-May-2022 06:37:03 You sent a payment of $549.50 USD to Walmart online store. It may take few moments for this transaction to appear in your account. If you didn't authorize this transaction call us now at +1-833-671-0600 This charge will appear on the statement as payment to .PayPal -*Walmartss. Please check the detailed information below: Registered E-mail_address: jose@monkey.org DescriptionUnit priceQtyAmount Apple I pad (13.1 inch)$549.50 USD1$549.50 USD Subtotal$549.50 USD Total$549.50 USD Payment$549.50 USD Payment sent to payments@Walmart.com payment sent from jose@monkey.org Description Walmart online store Invoice ID: ysd-89BE87shh Transaction Date: May 17 2022, Tuesday. Issues with this transaction? You have 24 hours from the date of the transaction to open a dispute in the Resolution Center. If you did not authorize the transaction, you have 1 business days from the date of the invoice to open a complaint. You can contact our Customer service Toll-Free on +1-833-671-0600 Please don't reply to this email. To get in touch with us, click Help & Contact. PayPal Customer Service can be reached at +1-833-671-0600 Not sure why you received this email? Learn more Copyright Г‚В© 1999-2021 PayPal, Inc. All rights reserved. PayPal is located at 2211 N. First St., San Jose, CA 95131. Г‚ Dear, jose@monkey.org Г‚ Г‚ .PayPalГ‚ Г‚ Г‚ Г‚ Г‚ Г‚ Г‚ Г‚ Г‚ Г‚ Г‚ Г‚ Г‚ Г‚ Г‚ Г‚ Г‚ Г‚ Г‚ Г‚ Г‚ Г‚ Г‚ Г‚ Г‚ Г‚ Г‚ Г‚ Г‚ Г‚ Г‚ Г‚ Г‚ Г‚ Г‚ Г‚ Г‚ Г‚ Г‚ Г‚ Г‚ Г‚ Г‚ Г‚ Г‚ Г‚ Г‚ Г‚ Г‚ Г‚ Г‚ Г‚ 17-May-2022 06:37:03 Г‚ Г‚ Г‚ Г‚ Г‚ Г‚ Г‚ Г‚ Г‚ Г‚ Г‚ Г‚ Г‚ Г‚ Г‚ Г‚ Г‚ Г‚ Г‚ Г‚ Г‚ Г‚ Г‚ Г‚ Г‚ Г‚ Г‚ Г‚ Г‚ You sent a payment of $549.50 USD toГ‚ Walmart online store.Г‚ Г‚ It may take few moments for this transaction to appear in your account. If you didn't authorize this transaction call us now at +1-833-671-0600 This charge will appear on the statement as payment toГ‚ .PayPalГ‚ -*Walmartss. Please check the detailedГ‚ information below:Г‚ Г‚ Г‚ Г‚ Registered E-mail_address: jose@monkey.org Г‚ Г‚ Г‚ Г‚ Г‚ Г‚ Г‚ Г‚ Г‚ Г‚ Г‚ Г‚ Г‚ Г‚ Г‚ Г‚ Г‚ Г‚ Г‚ Г‚ Г‚ Г‚ Г‚ Г‚ Г‚ Г‚ Г‚ Г‚ Г‚ Г‚ Г‚ Г‚ Г‚ Г‚ Г‚ Г‚ Г‚ Г‚ Г‚ Г‚ Г‚ Г‚ Г‚ Г‚ Г‚ Г‚ Г‚ Г‚ Г‚ Г‚ Г‚ Г‚ Г‚ Г‚ Г‚ Г‚ Г‚ Г‚ Г‚ Г‚ Г‚ Г‚ Г‚ Г‚ Г‚ Г‚ Г‚ Г‚ Г‚ Г‚ Г‚ Г‚ Г‚ Г‚ Г‚ Г‚ Г‚ Г‚ Г‚ Г‚ Г‚ Г‚ Г‚ Г‚ Г‚ Г‚ Г‚ Г‚ Г‚ Г‚ Г‚ Г‚ Г‚ Г‚ Г‚ Г‚ Г‚ Г‚ Г‚ Г‚ Г‚ Г‚ Г‚ Г‚ Г‚ Г‚ Г‚ Г‚ Г‚ Г‚ Г‚ Г‚ Г‚ Г‚ Г‚ Г‚ Г‚ Г‚ Г‚ Г‚ Г‚ Г‚ Г‚ Г‚ Г‚ Г‚ Г‚ Г‚ Г‚ Г‚ Г‚ Г‚ Г‚ Г‚ Г‚ Г‚ Г‚ Г‚ Г‚ Г‚ Г‚ Г‚ Г‚ Г‚ Г‚ Г‚ Г‚ Г‚ Г‚ Г‚ Г‚ Г‚ Г‚ Г‚ Г‚ Г‚ Г‚ Г‚ Г‚ Г‚ Г‚ Г‚ Г‚ Г‚ Г‚ Г‚ Г‚ Г‚ Г‚ Г‚ Г‚ Г‚ Г‚ Г‚ Г‚ Г‚ Г‚ Г‚ Г‚ Г‚ Г‚ Г‚ Г‚ Г‚ Г‚ Г‚ Г‚ Г‚ Г‚ Г‚ Г‚ Г‚ Г‚ Г‚ Г‚ Description Unit price Qty Amount Apple I padГ‚ (13.1 inch) $549.50 USD 1 $549.50 USD Subtotal $549.50 USD Total $549.50 USD Payment $549.50 USD Payment sent to payments@Walmart.com payment sent from jose@monkey.org Г‚ Г‚ Г‚ Г‚ Г‚ Г‚ Г‚ Г‚ Г‚ Г‚ Г‚ Г‚ Г‚ Г‚ Г‚ Г‚ Г‚ Г‚ Г‚ Г‚ Г‚ Г‚ Г‚ Г‚ Г‚ Г‚ Г‚ Г‚ Г‚ Г‚ Г‚ Г‚ Г‚ Г‚ Г‚ Г‚ Г‚ Г‚ Г‚ Г‚ Г‚ Г‚ Г‚ Г‚ Г‚ Г‚ Г‚ Г‚ Г‚ Г‚ Г‚ Г‚ Г‚ Г‚ Г‚ Г‚ Г‚ Г‚ Г‚ Г‚ Г‚ Г‚ Г‚ Г‚ Г‚ Г‚ Г‚ Г‚ Г‚ Г‚ Г‚ Г‚ Г‚ Г‚ Г‚ Г‚ Г‚ Г‚ Г‚ Г‚ Г‚ Г‚ Г‚ Г‚ Г‚ Г‚ Г‚ Г‚ Г‚ Г‚ Г‚ Г‚ Г‚ Г‚ Г‚ Г‚ Г‚ Г‚ Г‚ Г‚ Г‚ Г‚ Г‚ Г‚ Г‚ Г‚ Г‚ Г‚ Г‚ Г‚ Г‚ Г‚ Г‚ Г‚ Г‚ Г‚ Г‚ Г‚ Г‚ Г‚ Г‚ Г‚ Г‚ Г‚ Г‚ Г‚ Г‚ Г‚ Г‚ Г‚ Г‚ Г‚ Г‚ Г‚ Г‚ Г‚ Г‚ Г‚ Г‚ Г‚ Г‚ Г‚ Г‚ Г‚ Г‚ Г‚ Г‚ Г‚ Г‚ Г‚ Г‚ Г‚ Г‚ Г‚ Г‚ Г‚ Г‚ Г‚ Г‚ Г‚ Г‚ Г‚ Г‚ Г‚ Г‚ Г‚ Г‚ Г‚ Г‚ Г‚ Г‚ Г‚ Г‚ Г‚ Г‚ Г‚ Г‚ Г‚ Г‚ Г‚ Г‚ Г‚ Г‚ Г‚ Г‚ Г‚ Г‚ Description WalmartГ‚ onlineГ‚ store InvoiceГ‚ ID: ysd-89BE87shh Transaction Date:Г‚ MayГ‚ 17Г‚ 2022, Tuesday. Г‚ Г‚ Г‚ Г‚ Г‚ Г‚ Г‚ Г‚ Г‚ Г‚ Г‚ Г‚ Г‚ Г‚ Г‚ Г‚ Г‚ Г‚ Г‚ Г‚ Г‚ Г‚ Г‚ Г‚ Г‚ Г‚ Г‚ Г‚ Г‚ Г‚ Г‚ Г‚ Г‚ Г‚ Г‚ Г‚ Г‚ Г‚ Г‚ Г‚ Г‚ Г‚ Г‚ Г‚ Г‚ Г‚ Г‚ Г‚ Г‚ Г‚ Г‚ Г‚ Г‚ Г‚ Г‚ Г‚ Г‚ Г‚ Г‚ Г‚ Г‚ Г‚ Г‚ Г‚ Г‚ Г‚ Г‚ Г‚ Г‚ Г‚ Г‚ Г‚ Г‚ Г‚ Г‚ Г‚ Г‚ Г‚ Г‚ Г‚ Г‚ Г‚ Г‚ Г‚ Г‚ Г‚ Г‚ Г‚ Г‚ Г‚ Г‚ Г‚ Г‚ Г‚ Г‚ Г‚ Г‚ Г‚ Г‚ Г‚ Г‚ Г‚ Г‚ Г‚ Г‚ Г‚ Г‚ Г‚ Г‚ Г‚ Г‚ Г‚ Г‚ Г‚ Г‚ Г‚ Г‚ Г‚ Г‚ Г‚ Г‚ Г‚ Г‚ Г‚ Г‚ Г‚ Г‚ Г‚ Г‚ Г‚ Г‚ Г‚ Г‚ Г‚ Г‚ Г‚ Г‚ Г‚ Г‚ Г‚ Г‚ Г‚ Г‚ Г‚ Г‚ Г‚ Г‚ Г‚ Г‚ Г‚ Г‚ Г‚ Г‚ Г‚ Г‚ Г‚ Г‚ Г‚ Г‚ Г‚ Г‚ Г‚ Г‚ Г‚ Г‚ Г‚ Г‚ Г‚ Г‚ Г‚ Г‚ Г‚ Г‚ Г‚ Г‚ Г‚ Г‚ Г‚ Г‚ Г‚ Г‚ Г‚ Г‚ Г‚ Г‚ Г‚ Г‚ Issues with this transaction? You haveГ‚ 24 hoursГ‚ from the date of the transaction to open a dispute in the Resolution Center. Г‚ Г‚ Г‚ Г‚ Г‚ Г‚ Г‚ Г‚ Г‚ Г‚ Г‚ Г‚ Г‚ Г‚ Г‚ Г‚ Г‚ Г‚ Г‚ Г‚ Г‚ Г‚ Г‚ Г‚ Г‚ Г‚ Г‚ Г‚ Г‚ Г‚ Г‚ Г‚ Г‚ Г‚ Г‚ Г‚ Г‚ Г‚ Г‚ Г‚ Г‚ Г‚ Г‚ Г‚ Г‚ Г‚ Г‚ Г‚ Г‚ Г‚ Г‚ Г‚ Г‚ Г‚ Г‚ Г‚ Г‚ Г‚ Г‚ Г‚ Г‚ Г‚ Г‚ Г‚ Г‚ Г‚ Г‚ Г‚ Г‚ Г‚ Г‚ Г‚ Г‚ Г‚ Г‚ Г‚ Г‚ Г‚ Г‚ Г‚ Г‚ Г‚ Г‚ Г‚ Г‚ Г‚ Г‚ Г‚ Г‚ Г‚ Г‚ Г‚ Г‚ Г‚ Г‚ Г‚ Г‚ Г‚ Г‚ Г‚ Г‚ Г‚ Г‚ Г‚ Г‚ Г‚ Г‚ Г‚ Г‚ Г‚ Г‚ Г‚ Г‚ Г‚ Г‚ Г‚ Г‚ Г‚ Г‚ Г‚ Г‚ Г‚ Г‚ Г‚ Г‚ Г‚ Г‚ Г‚ Г‚ Г‚ Г‚ Г‚ Г‚ Г‚ Г‚ Г‚ Г‚ Г‚ Г‚ Г‚ Г‚ Г‚ Г‚ Г‚ Г‚ Г‚ Г‚ Г‚ Г‚ Г‚ Г‚ Г‚ Г‚ Г‚ Г‚ Г‚ Г‚ Г‚ Г‚ Г‚ Г‚ Г‚ Г‚ Г‚ Г‚ Г‚ Г‚ Г‚ Г‚ Г‚ Г‚ Г‚ Г‚ Г‚ Г‚ Г‚ Г‚ Г‚ Г‚ Г‚ Г‚ Г‚ Г‚ Г‚ Г‚ Г‚ Г‚ If you did not authorize the transaction, you haveГ‚ 1 business days from the date of the invoice to open a complaint. You can contact our Customer service Toll-Free onГ‚ +1-833-671-0600 Please don't reply to this email. To get in touch with us, clickГ‚ Help & Contact. PayPal Customer Service can be reached at +1-833-671-0600 Not sure why you received this email?Г‚ Learn more Copyright Г‚В© 1999-2021 PayPal, Inc. All rights reserved. Г‚ Г‚ PayPal is located at 2211 N. First St., San Jose, CA 95131."
