Subject,Body,label,data_source,text
Cricut Rolls & Smart Materials: Buy 3 Get 3 FREE (50% off online),"Joann.com® Up to 70% off Bloom Room floral + open stock paper 10/$3! BOGO deals you can’t miss 10 for $3 Open Stock Paper 10 for $3 SHOP ALL SHIPS FREE $129 ea Cricut® Joy Reg. $179 ea BUY NOW 70% off Artsmith™ Fine Art Canvas SHOP ALL $2.99 ea Gildan® Adult, Youth, Toddler & Ladies Short Sleeve T-Shirts Reg. $3.99–6.99 ea SHOP ALL UP TO 70% off ENTIRE STOCKBloom Room® Floral SHOP ALL 70% off Place & Time®Planters & Plant Stands SHOP ALL 50% off Park Lane® Paper Stacks, Big Deal Stacks & Value Pack Paper SHOP ALL IN-STORE DEAL B1G1 FREE 50% Off Online 1yd & 2yd Cotton Precuts* SHOP ALL 50% off Knit & Silky Prints Apparel Fabrics SHOP ALL ONLINE DEAL $3.99 ea Caron® Simply Soft® Yarn Reg $5.49 ea SHOP NOW ONLINE DEAL $4.99 ea Bernat® Tweedie Yarn Reg. $9.99 ea SHOP NOW ENDS TOMORROW! • IN-STORE & ONLINE • FOR PICK-UP IN-STORE OR CURBSIDE 60% off ANY ONE REGULAR-PRICED ITEM GET COUPON SHOP NOW ONLINE WITH CODE: SUMMER60 SAVE THROUGH 6/24 • ONLINE ONLY 30% off YOUR TOTAL REGULAR-PRICED PURCHASE SHOP NOW ONLINE WITH CODE: 30JUNESAVE SAVE THROUGH 6/25 • ONLINE ONLY FREE SHIPPING ON SPRING & SUMMER DECOR & FLORAL SHOP NOW ONLINE WITH CODE: SHIPSFREE SAVE THROUGH 6/24 • ONLINE ONLY 99¢ SHIPPING ON ALL ORDERS SHOP NOW ONLINE WITH CODE: JUNESHIP99 CUSTOM FRAMING SAVE THROUGH 6/28 • IN-STORE ONLY 60% off + EXTRA 20% off YOUR ENTIRECUSTOM FRAMING ORDER GET COUPON Rewards crafted just for you It's easy! Use your barcode in-store. Earn rewards automatically when you sign in online or in the app. See joann.com/smiles for details. SEE THE DEALS IN OUR WEEKLY AD SHOP AD SHOP ONLINE DEALS Save more on what you love FABRIC SEWING KIDS CRAFTS YARN HOME DECOR FLORAL STORAGE PAPERCRAFTING coupons rewards shop our ad projects Join JOANN text alerts and get 25% off!† TAP TO JOIN or text WELCOME to 56266 Please do not reply to this e-mail, as we are not able to respond to messages sent to this address. For all inquiries, contact us.To ensure delivery to your inbox, add joannstores@em.joann.com to your address book. This email was sent to REDACTED+joann@gmail.com Get more of what you want! Update your email preferences here. To unsubscribe, click here | Privacy Policy. Shop & Save through 06/18/2023 11:59pm ET. General Promotional Disclaimer.PERSONALIZED INTERNET COUPON. Distribution of these coupons in PDF or other portable document formats is not permitted. Void if copied, altered, reproduced, sold, traded, transferred or assigned. Any such misuse or other misuse constitutes fraud and is prosecutable under federal wire and other statutes. Promotional shipping offers valid for U.S. shipping addresses only. Not valid for Canadian shipping addresses.*BOGO OFFERS. Free or discounted items must be of equal or lesser value.†By signing up for text alerts, you agree to receive recurring automated marketing text messages from JOANN, which may include shopping cart reminders, to the number provided. You'll be asked to reply Y from your mobile device to confirm opt-in. Sign-up is not required to buy goods or services. Message & data rates may apply. Text HELP to 56266 for help, Text STOP to 56266 to opt out. Go to https://www.joann.com/sms-terms.html for T&C's and privacy policy. © 2023 Joann.com®5555 Darrow Road, Hudson, OH 44236",1,fuzzer-LLM,"Cricut Rolls & Smart Materials: Buy 3 Get 3 FREE (50% off online)

Joann.com® Up to 70% off Bloom Room floral + open stock paper 10/$3! BOGO deals you can’t miss 10 for $3 Open Stock Paper 10 for $3 SHOP ALL SHIPS FREE $129 ea Cricut® Joy Reg. $179 ea BUY NOW 70% off Artsmith™ Fine Art Canvas SHOP ALL $2.99 ea Gildan® Adult, Youth, Toddler & Ladies Short Sleeve T-Shirts Reg. $3.99–6.99 ea SHOP ALL UP TO 70% off ENTIRE STOCKBloom Room® Floral SHOP ALL 70% off Place & Time®Planters & Plant Stands SHOP ALL 50% off Park Lane® Paper Stacks, Big Deal Stacks & Value Pack Paper SHOP ALL IN-STORE DEAL B1G1 FREE 50% Off Online 1yd & 2yd Cotton Precuts* SHOP ALL 50% off Knit & Silky Prints Apparel Fabrics SHOP ALL ONLINE DEAL $3.99 ea Caron® Simply Soft® Yarn Reg $5.49 ea SHOP NOW ONLINE DEAL $4.99 ea Bernat® Tweedie Yarn Reg. $9.99 ea SHOP NOW ENDS TOMORROW! • IN-STORE & ONLINE • FOR PICK-UP IN-STORE OR CURBSIDE 60% off ANY ONE REGULAR-PRICED ITEM GET COUPON SHOP NOW ONLINE WITH CODE: SUMMER60 SAVE THROUGH 6/24 • ONLINE ONLY 30% off YOUR TOTAL REGULAR-PRICED PURCHASE SHOP NOW ONLINE WITH CODE: 30JUNESAVE SAVE THROUGH 6/25 • ONLINE ONLY FREE SHIPPING ON SPRING & SUMMER DECOR & FLORAL SHOP NOW ONLINE WITH CODE: SHIPSFREE SAVE THROUGH 6/24 • ONLINE ONLY 99¢ SHIPPING ON ALL ORDERS SHOP NOW ONLINE WITH CODE: JUNESHIP99 CUSTOM FRAMING SAVE THROUGH 6/28 • IN-STORE ONLY 60% off + EXTRA 20% off YOUR ENTIRECUSTOM FRAMING ORDER GET COUPON Rewards crafted just for you It's easy! Use your barcode in-store. Earn rewards automatically when you sign in online or in the app. See joann.com/smiles for details. SEE THE DEALS IN OUR WEEKLY AD SHOP AD SHOP ONLINE DEALS Save more on what you love FABRIC SEWING KIDS CRAFTS YARN HOME DECOR FLORAL STORAGE PAPERCRAFTING coupons rewards shop our ad projects Join JOANN text alerts and get 25% off!† TAP TO JOIN or text WELCOME to 56266 Please do not reply to this e-mail, as we are not able to respond to messages sent to this address. For all inquiries, contact us.To ensure delivery to your inbox, add joannstores@em.joann.com to your address book. This email was sent to REDACTED+joann@gmail.com Get more of what you want! Update your email preferences here. To unsubscribe, click here | Privacy Policy. Shop & Save through 06/18/2023 11:59pm ET. General Promotional Disclaimer.PERSONALIZED INTERNET COUPON. Distribution of these coupons in PDF or other portable document formats is not permitted. Void if copied, altered, reproduced, sold, traded, transferred or assigned. Any such misuse or other misuse constitutes fraud and is prosecutable under federal wire and other statutes. Promotional shipping offers valid for U.S. shipping addresses only. Not valid for Canadian shipping addresses.*BOGO OFFERS. Free or discounted items must be of equal or lesser value.†By signing up for text alerts, you agree to receive recurring automated marketing text messages from JOANN, which may include shopping cart reminders, to the number provided. You'll be asked to reply Y from your mobile device to confirm opt-in. Sign-up is not required to buy goods or services. Message & data rates may apply. Text HELP to 56266 for help, Text STOP to 56266 to opt out. Go to https://www.joann.com/sms-terms.html for T&C's and privacy policy. © 2023 Joann.com®5555 Darrow Road, Hudson, OH 44236"
Next battle in the debt ceiling saga?,"Now it's about selling the deal. Advertisement eNewspaper | Crosswords | Horoscopes Read in browser Read in browser The Daily Briefing YOUR MORNING NEWS ROUNDUP Tue May 30 2023 Nicole Fallert | Newsletter Writer Next battle in the debt ceiling saga? Now it's about selling the deal. Advertisement President Joe Biden, House Speaker Kevin McCarthy and other leaders have less than a week to pull together the votes to shepherd the agreement to raise the nation's debt ceiling through a splintered Congress. Also in the news: Disgraced Theranos CEO Elizabeth Holmes is set to surrender at a federal prison in Texas today. The Miami Heat has cinched a spot in the NBA Finals and Las Vegas is heading to the Stanley Cup Finals. 🙋🏼‍♀️ I'm Nicole Fallert, Daily Briefing author. Memorial Day may be over but these 200+ Amazon deals are still available. Now, here we go with Tuesday's news. Critical House committee takes its first vote on debt ceiling deal A debt ceiling deal faces an early test Tuesday in the House Rules Committee, which must approve the procedure for bringing the legislation to the floor. President Joe Biden and House Speaker Kevin McCarthy struck a tentative agreement on Saturday to raise the debt ceiling until 2025 in exchange for a number of Republican demands to cut spending. •The full House is expected to vote Wednesday. The administration has warned that Congress must raise the debt ceiling by June 5 or risk tripping the nation into the first default in its history.•Biden and McCarthy have been selling their plan to lawmakers to garner votes on the deal and the president expressed optimism Monday about getting the necessary support.• But there are echoes of discontent. Hardline conservatives said the bill will not produce the scale of spending cuts they wanted, while liberal Democrats said they were uncomfortable with concessions Biden made on safety-net programs. 9 injured, including children, in Memorial Day shooting near beach in Hollywood, Florida Nine people were injured Monday evening when gunfire erupted along a beach boardwalk in Hollywood, Florida, authorities said, as people ran for cover on Memorial Day. Six adults and three children were hurt, according to Yanet Obarrio Sanchez, a spokesperson for Memorial Healthcare System. All of the victims were in stable condition, she said. A preliminary investigation shows that an altercation between two groups resulted in gunfire. One person has been detained and another suspect is being still being sought. Read more Police are pictured investigating after gunfire erupted on Memorial Day along a beach boardwalk in Hollywood, Florida, sending people frantically running for cover on Monday. Mike Stocker, AP More news to know now •The suspect in a 2018 Pittsburgh synagogue massacre is going on trial Tuesday. •Sen. Ted Cruz lashed out at a harsh anti-LGBTQ measure signed into law in Uganda that imposes the death penalty.•Donald Trump fought to save Texas ally Ken Paxton from impeachment. It didn't work. •Is the government coming for your gas stove? Here's how the controversy first got cooking.•On today's 5 Things podcast, USA TODAY Health Reporter Karen Weintraub looks at a shortage of cancer drugs. Listen on Apple Podcasts, Spotify, or your smart speaker. What's the weather today? Check your local forecast here. Russia blames Ukraine for pre-dawn attack Russian air defenses stopped eight drones converging on Moscow, officials said Tuesday, in an attack that authorities blamed on Ukraine, while Russia continued a a relentless wave of daylight and nighttime bombardment on Kyiv that began Monday. Residents of the Ukrainian capital fled for cover from ballistic and cruise missiles late Monday morning after a drone and missile fusillade several hours before, packing the central subway station for shelter. City officials said it was the 16th air assault on Kyiv this month. Read more •France's new ambassador to the U.S. puts his flair on party diplomacy. May 2023: People take cover at a metro station during a Russian rocket attack in Kyiv, Ukraine. Explosions have rattled Kyiv during daylight as Russian ballistic missiles fell on the Ukrainian capital. The barrage came hours after a more common nighttime attack of the city by drones and cruise missiles. Evgeniy Maloletka, AP Elizabeth Holmes to start prison term Disgraced Theranos CEO Elizabeth Holmes on Tuesday will enter a federal prison in Texas where she has been sentenced to spend the next 11 years for overseeing a blood-testing hoax that became a parable about greed and hubris in Silicon Valley. The 39-year-old will leave behind a nearly 2-year-old son and 3-month-old daughter that were born amid the hoopla surrounding her high-profile trial and conviction on four counts of fraud and conspiracy. Read more •A short supply of cancer drugs has doctors and patients worried: ''We're at a critical juncture.'' Theranos founder and CEO Elizabeth Holmes, center, walks into federal court with her partner Billy Evans, right, and her parents in San Jose, California, Friday, Nov. 18, 2022. Nic Coury, AP Just for subscribers: •In national mortgage war, is United Wholesale Mortgage's Mat Ishbia a genius or 'bully'? •Oklahoma State Department of Education video ''painted a target on our backs,'' teacher says.•Nazi diaries, forgers at the Vatican: How Delaware became a hotbed for solving art crime. •Their adoptions broke. Their lives fractured. Now they strive to make things better for others. These articles are for USA TODAY subscribers. You can sign up here. Miami Heat to face Denver Nuggets in NBA Finals The Miami Heat advanced to the NBA Finals on Monday after a 103-84 series-clinching win over the Boston Celtics in Game 7 in Boston. Jimmy Butler led the Heat with 28 points, seven rebounds and six assists. Miami closed out the series after the Celtics won three games in a row to force a Game 7. The Heat will now face the Denver Nuggets Thursday for Game 1 of the Finals. The Nuggets are making their first-ever Finals appearance, while the Heat will make their seventh franchise appearance and their first since the 2020 bubble season. Read more •Analysis: The ascending Celtics took a significant step backward with a loss to Heat. •NBA opened an investigation into a referee over potential use of a burner account. Game 7: The Miami Heat's Jimmy Butler dunks against the Boston Celtics during the fourth quarter at TD Garden. The Heat won the game, 103-84, to advance to the NBA Finals. Winslow Townson, USA TODAY Sports Quick hits •George Maharis, ""Route 66"" star and '60s icon, has died at 94.• Prince Eric is the best Disney prince. Here's why we love the underrated ''Little Mermaid'' hero.•Sydney Sweeney talks true story behind Reality Winner movie: ''You can't even write stuff like this!''• State Farm will no longer insure new homes in California because of wildfire risks.•96-year-old woman sets a world record in a 5K for her age group at Ottawa race. Photo of the day: Vegas Golden Knights reach the Stanley Cup Final There will be a first-time Stanley Cup winner after this year's NHL championship round. The Vegas Golden Knights reached the Stanley Cup Final for the second time in their six-year history by defeating the Dallas Stars 6-0 in Game 6 Monday night in the Western Conference final. Vegas will face the Florida Panthers, who swept their conference final and are making their first appearance in the Final since 1996. Read more On Monday night the Golden Knights stormed out to a 3-0 first-period lead en route to a decisive series-clinching victory. AP Nicole Fallert is a newsletter writer at USA TODAY, sign up for the email here. Want to send Nicole a note? Shoot her an email at NFallert@usatoday.com or follow along with her musings on Twitter. Support journalism like this – subscribe to USA TODAY here. Associated Press contributed reporting. Advertisement Follow Us Problem viewing email? View in browser Unsubscribe • Manage Newsletters • Terms of Service • Privacy Policy/Your California Privacy Rights • Privacy Notice • Do Not Sell My Info/Cookie Policy • Feedback",1,fuzzer-LLM,"Next battle in the debt ceiling saga?

Now it's about selling the deal. Advertisement eNewspaper | Crosswords | Horoscopes Read in browser Read in browser The Daily Briefing YOUR MORNING NEWS ROUNDUP Tue May 30 2023 Nicole Fallert | Newsletter Writer Next battle in the debt ceiling saga? Now it's about selling the deal. Advertisement President Joe Biden, House Speaker Kevin McCarthy and other leaders have less than a week to pull together the votes to shepherd the agreement to raise the nation's debt ceiling through a splintered Congress. Also in the news: Disgraced Theranos CEO Elizabeth Holmes is set to surrender at a federal prison in Texas today. The Miami Heat has cinched a spot in the NBA Finals and Las Vegas is heading to the Stanley Cup Finals. 🙋🏼‍♀️ I'm Nicole Fallert, Daily Briefing author. Memorial Day may be over but these 200+ Amazon deals are still available. Now, here we go with Tuesday's news. Critical House committee takes its first vote on debt ceiling deal A debt ceiling deal faces an early test Tuesday in the House Rules Committee, which must approve the procedure for bringing the legislation to the floor. President Joe Biden and House Speaker Kevin McCarthy struck a tentative agreement on Saturday to raise the debt ceiling until 2025 in exchange for a number of Republican demands to cut spending. •The full House is expected to vote Wednesday. The administration has warned that Congress must raise the debt ceiling by June 5 or risk tripping the nation into the first default in its history.•Biden and McCarthy have been selling their plan to lawmakers to garner votes on the deal and the president expressed optimism Monday about getting the necessary support.• But there are echoes of discontent. Hardline conservatives said the bill will not produce the scale of spending cuts they wanted, while liberal Democrats said they were uncomfortable with concessions Biden made on safety-net programs. 9 injured, including children, in Memorial Day shooting near beach in Hollywood, Florida Nine people were injured Monday evening when gunfire erupted along a beach boardwalk in Hollywood, Florida, authorities said, as people ran for cover on Memorial Day. Six adults and three children were hurt, according to Yanet Obarrio Sanchez, a spokesperson for Memorial Healthcare System. All of the victims were in stable condition, she said. A preliminary investigation shows that an altercation between two groups resulted in gunfire. One person has been detained and another suspect is being still being sought. Read more Police are pictured investigating after gunfire erupted on Memorial Day along a beach boardwalk in Hollywood, Florida, sending people frantically running for cover on Monday. Mike Stocker, AP More news to know now •The suspect in a 2018 Pittsburgh synagogue massacre is going on trial Tuesday. •Sen. Ted Cruz lashed out at a harsh anti-LGBTQ measure signed into law in Uganda that imposes the death penalty.•Donald Trump fought to save Texas ally Ken Paxton from impeachment. It didn't work. •Is the government coming for your gas stove? Here's how the controversy first got cooking.•On today's 5 Things podcast, USA TODAY Health Reporter Karen Weintraub looks at a shortage of cancer drugs. Listen on Apple Podcasts, Spotify, or your smart speaker. What's the weather today? Check your local forecast here. Russia blames Ukraine for pre-dawn attack Russian air defenses stopped eight drones converging on Moscow, officials said Tuesday, in an attack that authorities blamed on Ukraine, while Russia continued a a relentless wave of daylight and nighttime bombardment on Kyiv that began Monday. Residents of the Ukrainian capital fled for cover from ballistic and cruise missiles late Monday morning after a drone and missile fusillade several hours before, packing the central subway station for shelter. City officials said it was the 16th air assault on Kyiv this month. Read more •France's new ambassador to the U.S. puts his flair on party diplomacy. May 2023: People take cover at a metro station during a Russian rocket attack in Kyiv, Ukraine. Explosions have rattled Kyiv during daylight as Russian ballistic missiles fell on the Ukrainian capital. The barrage came hours after a more common nighttime attack of the city by drones and cruise missiles. Evgeniy Maloletka, AP Elizabeth Holmes to start prison term Disgraced Theranos CEO Elizabeth Holmes on Tuesday will enter a federal prison in Texas where she has been sentenced to spend the next 11 years for overseeing a blood-testing hoax that became a parable about greed and hubris in Silicon Valley. The 39-year-old will leave behind a nearly 2-year-old son and 3-month-old daughter that were born amid the hoopla surrounding her high-profile trial and conviction on four counts of fraud and conspiracy. Read more •A short supply of cancer drugs has doctors and patients worried: ''We're at a critical juncture.'' Theranos founder and CEO Elizabeth Holmes, center, walks into federal court with her partner Billy Evans, right, and her parents in San Jose, California, Friday, Nov. 18, 2022. Nic Coury, AP Just for subscribers: •In national mortgage war, is United Wholesale Mortgage's Mat Ishbia a genius or 'bully'? •Oklahoma State Department of Education video ''painted a target on our backs,'' teacher says.•Nazi diaries, forgers at the Vatican: How Delaware became a hotbed for solving art crime. •Their adoptions broke. Their lives fractured. Now they strive to make things better for others. These articles are for USA TODAY subscribers. You can sign up here. Miami Heat to face Denver Nuggets in NBA Finals The Miami Heat advanced to the NBA Finals on Monday after a 103-84 series-clinching win over the Boston Celtics in Game 7 in Boston. Jimmy Butler led the Heat with 28 points, seven rebounds and six assists. Miami closed out the series after the Celtics won three games in a row to force a Game 7. The Heat will now face the Denver Nuggets Thursday for Game 1 of the Finals. The Nuggets are making their first-ever Finals appearance, while the Heat will make their seventh franchise appearance and their first since the 2020 bubble season. Read more •Analysis: The ascending Celtics took a significant step backward with a loss to Heat. •NBA opened an investigation into a referee over potential use of a burner account. Game 7: The Miami Heat's Jimmy Butler dunks against the Boston Celtics during the fourth quarter at TD Garden. The Heat won the game, 103-84, to advance to the NBA Finals. Winslow Townson, USA TODAY Sports Quick hits •George Maharis, ""Route 66"" star and '60s icon, has died at 94.• Prince Eric is the best Disney prince. Here's why we love the underrated ''Little Mermaid'' hero.•Sydney Sweeney talks true story behind Reality Winner movie: ''You can't even write stuff like this!''• State Farm will no longer insure new homes in California because of wildfire risks.•96-year-old woman sets a world record in a 5K for her age group at Ottawa race. Photo of the day: Vegas Golden Knights reach the Stanley Cup Final There will be a first-time Stanley Cup winner after this year's NHL championship round. The Vegas Golden Knights reached the Stanley Cup Final for the second time in their six-year history by defeating the Dallas Stars 6-0 in Game 6 Monday night in the Western Conference final. Vegas will face the Florida Panthers, who swept their conference final and are making their first appearance in the Final since 1996. Read more On Monday night the Golden Knights stormed out to a 3-0 first-period lead en route to a decisive series-clinching victory. AP Nicole Fallert is a newsletter writer at USA TODAY, sign up for the email here. Want to send Nicole a note? Shoot her an email at NFallert@usatoday.com or follow along with her musings on Twitter. Support journalism like this – subscribe to USA TODAY here. Associated Press contributed reporting. Advertisement Follow Us Problem viewing email? View in browser Unsubscribe • Manage Newsletters • Terms of Service • Privacy Policy/Your California Privacy Rights • Privacy Notice • Do Not Sell My Info/Cookie Policy • Feedback"
