Subject,Body,label,data_source,text
"Morning Distribution for Thursday, May 25, 2023","A email Morning Distribution Thursday, May 25, 2023 Your daily briefing from FiveThirtyEight The Morning Story The Rise, Fall And Potential Resurrection Of Ron DeSantis By Geoffrey Skelley After signaling a campaign for months — even years — Florida Gov. Ron DeSantis formally announced on Wednesday that he’s running for president. As a result, the two leading Republican candidates in the primary polls, former President Donald Trump and DeSantis, are now both officially in the race. In the leadup to his announcement, DeSantis’s pre-campaign experience demonstrated how quickly political winds can shift. Coming off of a resounding reelection victory in November 2022, DeSantis seemingly had the Republican world at his fingertips. Conservative media fêted his potential 2024 presidential candidacy, and polls of the nascent primary found him not far behind — and sometimes even ahead of — Trump. Fast forward six months, however, and Trump has a larger lead over DeSantis in FiveThirtyEight’s national polling average than at any point since March 1. DeSantis has struggled in the face of media scrutiny and Trump’s early efforts to define him, prompting questions about the Florida governor’s personal appeal and raising concerns among prospective donors that DeSantis might not be up to the task of taking on Trump.Read more Weekly ListenPolitics Podcast: Can Tim Scott’s Optimism Win Over The GOP? View in browserABC News Unsubscribe Our mailing address: FiveThirtyEight,47 West 66th Street, New York, NY 10023.",1,fuzzer-LLM,"Morning Distribution for Thursday, May 25, 2023

A email Morning Distribution Thursday, May 25, 2023 Your daily briefing from FiveThirtyEight The Morning Story The Rise, Fall And Potential Resurrection Of Ron DeSantis By Geoffrey Skelley After signaling a campaign for months — even years — Florida Gov. Ron DeSantis formally announced on Wednesday that he’s running for president. As a result, the two leading Republican candidates in the primary polls, former President Donald Trump and DeSantis, are now both officially in the race. In the leadup to his announcement, DeSantis’s pre-campaign experience demonstrated how quickly political winds can shift. Coming off of a resounding reelection victory in November 2022, DeSantis seemingly had the Republican world at his fingertips. Conservative media fêted his potential 2024 presidential candidacy, and polls of the nascent primary found him not far behind — and sometimes even ahead of — Trump. Fast forward six months, however, and Trump has a larger lead over DeSantis in FiveThirtyEight’s national polling average than at any point since March 1. DeSantis has struggled in the face of media scrutiny and Trump’s early efforts to define him, prompting questions about the Florida governor’s personal appeal and raising concerns among prospective donors that DeSantis might not be up to the task of taking on Trump.Read more Weekly ListenPolitics Podcast: Can Tim Scott’s Optimism Win Over The GOP? View in browserABC News Unsubscribe Our mailing address: FiveThirtyEight,47 West 66th Street, New York, NY 10023."
What a debt ceiling deal means for you,"As the White House and Congress near a deal to raise the nation's debt ceiling, what a deal – or what no deal – would mean for you and the economy. Advertisement eNewspaper | Crosswords | Horoscopes Read in browser Read in browser The Daily Briefing YOUR MORNING NEWS ROUNDUP Sat May 27 2023 What a debt ceiling deal would mean for your wallet and the economy As the White House and Congress near a deal to raise the nation's debt ceiling, what a deal – or what no deal – would mean for you and the economy. READ MORE Advertisement 4-year-old wonders why there isn't any 'music' in Poland A young girl's family shelters her from realities of war and surgery even as U.S. doctors work to repair her severe burns. READ MORE Arnold Schwarzenegger's Netflix series is an embarrassment Action star Schwarzenegger comes to TV for Netflix's ""Fubar,"" and perhaps he should have stayed in the film business. READ MORE Photos don’t do this national park justice Black Canyon of the Gunnison is one of America’s least visited national parks. Here’s what you’re missing out on. READ MORE 4-day extension: Yellen revises date for potential government default President Joe Biden and congressional leaders head into Memorial Day with progress but still no deal on raising the debt ceiling. READ MORE Why you should never recline your seat on a plane There's a growing consensus that leaning back is a no-no under almost all circumstances. We're simply out of room. READ MORE Biden calls Turkey's Erdogan an 'autocrat.' Will he win reelection? After two decades in power, Turkey's all-powerful leader Recep Tayyip Erdogan appears to have the upper hand in a presidential election runoff Sunday. READ MORE LSU women's basketball player faints during White House visit Sa'Myah Smith fainted during the LSU women's basketball team's visit to the White House on Friday, halting a speech by President Joe Biden. READ MORE This week in politics: Washington closes in on debt ceiling deal Negotiators look to be closing in on a deal to raise the debt ceiling and Ron DeSantis entered the 2024 Republican presidential primary. READ MORE 12 injured after passenger opens emergency exit on flight Officials said the Asiana Airlines passenger opened an emergency exit door. Video shows air to blasting into the cabin as the plane was landing. READ MORE Sign up for the news you want Exclusive newsletters are part of your subscription, don’t miss out! We’re always working to add benefits for subscribers like you. SEE ALL NEWSLETTERS ➔ SEE ALL NEWSLETTERS ➔ Advertisement SUBSCRIBE TODAY Our Reporting. Your Stories. •Access subscriber-only content on all of your devices. •Share a bonus subscription with a family member or friend. •Read our universal eNewspaper - the digital version of our print paper. •Experience bonus monthly magazines and hundreds of local papers. SUBSCRIBE TODAY SUBSCRIBE TODAY Follow Us Problem viewing email? View in browser Unsubscribe • Manage Newsletters • Terms of Service • Privacy Policy/Your California Privacy Rights • Privacy Notice • Do Not Sell My Info/Cookie Policy • Feedback",1,fuzzer-LLM,"What a debt ceiling deal means for you

As the White House and Congress near a deal to raise the nation's debt ceiling, what a deal – or what no deal – would mean for you and the economy. Advertisement eNewspaper | Crosswords | Horoscopes Read in browser Read in browser The Daily Briefing YOUR MORNING NEWS ROUNDUP Sat May 27 2023 What a debt ceiling deal would mean for your wallet and the economy As the White House and Congress near a deal to raise the nation's debt ceiling, what a deal – or what no deal – would mean for you and the economy. READ MORE Advertisement 4-year-old wonders why there isn't any 'music' in Poland A young girl's family shelters her from realities of war and surgery even as U.S. doctors work to repair her severe burns. READ MORE Arnold Schwarzenegger's Netflix series is an embarrassment Action star Schwarzenegger comes to TV for Netflix's ""Fubar,"" and perhaps he should have stayed in the film business. READ MORE Photos don’t do this national park justice Black Canyon of the Gunnison is one of America’s least visited national parks. Here’s what you’re missing out on. READ MORE 4-day extension: Yellen revises date for potential government default President Joe Biden and congressional leaders head into Memorial Day with progress but still no deal on raising the debt ceiling. READ MORE Why you should never recline your seat on a plane There's a growing consensus that leaning back is a no-no under almost all circumstances. We're simply out of room. READ MORE Biden calls Turkey's Erdogan an 'autocrat.' Will he win reelection? After two decades in power, Turkey's all-powerful leader Recep Tayyip Erdogan appears to have the upper hand in a presidential election runoff Sunday. READ MORE LSU women's basketball player faints during White House visit Sa'Myah Smith fainted during the LSU women's basketball team's visit to the White House on Friday, halting a speech by President Joe Biden. READ MORE This week in politics: Washington closes in on debt ceiling deal Negotiators look to be closing in on a deal to raise the debt ceiling and Ron DeSantis entered the 2024 Republican presidential primary. READ MORE 12 injured after passenger opens emergency exit on flight Officials said the Asiana Airlines passenger opened an emergency exit door. Video shows air to blasting into the cabin as the plane was landing. READ MORE Sign up for the news you want Exclusive newsletters are part of your subscription, don’t miss out! We’re always working to add benefits for subscribers like you. SEE ALL NEWSLETTERS ➔ SEE ALL NEWSLETTERS ➔ Advertisement SUBSCRIBE TODAY Our Reporting. Your Stories. •Access subscriber-only content on all of your devices. •Share a bonus subscription with a family member or friend. •Read our universal eNewspaper - the digital version of our print paper. •Experience bonus monthly magazines and hundreds of local papers. SUBSCRIBE TODAY SUBSCRIBE TODAY Follow Us Problem viewing email? View in browser Unsubscribe • Manage Newsletters • Terms of Service • Privacy Policy/Your California Privacy Rights • Privacy Notice • Do Not Sell My Info/Cookie Policy • Feedback"
This Weekend's Long Reads,"Weekend Long Reads Including: These prime Blue Jays season tickets have been in their family for decades. Their cost just increased by up to $122,000 ‌ ‌ ‌ ‌ ‌ ‌ ‌ ‌ ‌ ‌ ‌ ‌ ‌ ‌ ‌ ‌ ‌ ‌ ‌ ‌ ‌ ‌ ‌ ‌ ‌ ‌ ‌ ‌ ‌ ‌ ‌ ‌ ‌ ‌ ‌ ‌ ‌ ‌ ‌ ‌ ‌ ‌ ‌ ‌ ‌ ‌ ‌ ‌ ‌ ‌ ‌ ‌ ‌ ‌ ‌ ‌ ‌ ‌ ‌ ‌ ‌ ‌ ‌ ‌ ‌ ‌ ‌ ‌ ‌ ‌ ‌ ‌ ‌ ‌ ‌ ‌ ‌ ‌ ‌ ‌ ‌ ‌ ‌ ‌ ‌ ‌ ‌ ‌ ‌ ‌ ‌ ‌ ‌ ‌ ‌ ‌ ‌ ‌ ‌ ‌ ‌ ‌ ‌ ‌ ‌ ‌ ‌ ‌ ‌ ‌ ‌ ‌ ‌ ‌ ‌ ‌ ‌ ‌ ‌ ‌ ‌ ‌ ‌ ‌ ‌ ‌ ‌ ‌ ‌ ‌ ‌ ‌ ‌ ‌ ‌ ‌ ‌ ‌ ‌ ‌ ‌ ‌ ‌ Weekend Long Reads These prime Blue Jays season tickets have been in their family for decades. Their cost just increased by up to $122,000 Some fans learned the revamped seating arrangements at Rogers Centre will mean their tickets will cost tens of thousands of dollars more. Read more » Late-night texts, secret jobs, constant fear: Inside an undocumented worker’s life in the shadows and a new federal program that could change her life Read more » Is this the end of lettuce? Why Canada’s food supply is headed for uncharted territory Read more » ‘This is the kind of project that threatens companies.’ An exclusive first look inside the Eglinton LRT as Crosslinx breaks silence on what’s gone wrong Read more » The Ontario government offered the Star an interview with its top doctor. At the last minute, it was cancelled. We found out the real reason why Read more » Is AI coming for your job? These are the workers who will be replaced first, according to experts Read more » Investors are out, hybrid workers are in: How cottage country found its new normal Read more » Renaming Dundas Street: Inside the fiery debate that led to the decision, and why it’s back in the public eye Read more » ‘I will not be silenced’: Pierre Poilievre calls on David Johnston to resign, refuses request to review foreign interference intelligence Read more » Has the onscreen sex scene gasped its last climactic breath? Read more » Her post on sexism in the workplace went viral. A year later, the CEO in heels reflects on the comments that sparked a global conversation Read more » OPINION Bruce: Trust issues. Severe cash shortages. Internal politics. Can new general secretary Jason deVos save Canada Soccer? Read more » ‘It’s the number one issue for us’: Why renters could be a force in deciding Toronto’s mayoral race Read more » OPINION Dave Feschuk: The Leafs didn’t say goodbye to Kyle Dubas because of money. It was about power, and a lack of faith Read more » Addiction. Poverty. Mental health. Those are the real challenges facing Ontario’s justice system, retired judge warns Read more » The future of takeout: What it could look like under Canada’s single-use plastic ban Read more » More seats, higher prices: Aeroplan’s head defends one of the largest overhauls the program has ever seen Read more » Get unlimited access to the Star Limited time sale: Only $1/week for 52 weeks Get This Offer If you're not enjoying these emails, please tell us how we can make them better by emailing newsletterfeedback@thestar.ca. Or, if you'd prefer, you can unsubscribe from this newsletter by clicking the first link below. Unsubscribe From This Newsletter Sign Up for More Newsletters and Email Alerts View in Browser Toronto Star Newspapers Limited. 8 Spadina Avenue, 10th Floor, Toronto, ON M5V 0S8. 416-367-2000 PRIVACY POLICY - - - - - - - - - - - - - - - - - - - - - - - - - - - - - - - - -",1,fuzzer-LLM,"This Weekend's Long Reads

Weekend Long Reads Including: These prime Blue Jays season tickets have been in their family for decades. Their cost just increased by up to $122,000 ‌ ‌ ‌ ‌ ‌ ‌ ‌ ‌ ‌ ‌ ‌ ‌ ‌ ‌ ‌ ‌ ‌ ‌ ‌ ‌ ‌ ‌ ‌ ‌ ‌ ‌ ‌ ‌ ‌ ‌ ‌ ‌ ‌ ‌ ‌ ‌ ‌ ‌ ‌ ‌ ‌ ‌ ‌ ‌ ‌ ‌ ‌ ‌ ‌ ‌ ‌ ‌ ‌ ‌ ‌ ‌ ‌ ‌ ‌ ‌ ‌ ‌ ‌ ‌ ‌ ‌ ‌ ‌ ‌ ‌ ‌ ‌ ‌ ‌ ‌ ‌ ‌ ‌ ‌ ‌ ‌ ‌ ‌ ‌ ‌ ‌ ‌ ‌ ‌ ‌ ‌ ‌ ‌ ‌ ‌ ‌ ‌ ‌ ‌ ‌ ‌ ‌ ‌ ‌ ‌ ‌ ‌ ‌ ‌ ‌ ‌ ‌ ‌ ‌ ‌ ‌ ‌ ‌ ‌ ‌ ‌ ‌ ‌ ‌ ‌ ‌ ‌ ‌ ‌ ‌ ‌ ‌ ‌ ‌ ‌ ‌ ‌ ‌ ‌ ‌ ‌ ‌ ‌ Weekend Long Reads These prime Blue Jays season tickets have been in their family for decades. Their cost just increased by up to $122,000 Some fans learned the revamped seating arrangements at Rogers Centre will mean their tickets will cost tens of thousands of dollars more. Read more » Late-night texts, secret jobs, constant fear: Inside an undocumented worker’s life in the shadows and a new federal program that could change her life Read more » Is this the end of lettuce? Why Canada’s food supply is headed for uncharted territory Read more » ‘This is the kind of project that threatens companies.’ An exclusive first look inside the Eglinton LRT as Crosslinx breaks silence on what’s gone wrong Read more » The Ontario government offered the Star an interview with its top doctor. At the last minute, it was cancelled. We found out the real reason why Read more » Is AI coming for your job? These are the workers who will be replaced first, according to experts Read more » Investors are out, hybrid workers are in: How cottage country found its new normal Read more » Renaming Dundas Street: Inside the fiery debate that led to the decision, and why it’s back in the public eye Read more » ‘I will not be silenced’: Pierre Poilievre calls on David Johnston to resign, refuses request to review foreign interference intelligence Read more » Has the onscreen sex scene gasped its last climactic breath? Read more » Her post on sexism in the workplace went viral. A year later, the CEO in heels reflects on the comments that sparked a global conversation Read more » OPINION Bruce: Trust issues. Severe cash shortages. Internal politics. Can new general secretary Jason deVos save Canada Soccer? Read more » ‘It’s the number one issue for us’: Why renters could be a force in deciding Toronto’s mayoral race Read more » OPINION Dave Feschuk: The Leafs didn’t say goodbye to Kyle Dubas because of money. It was about power, and a lack of faith Read more » Addiction. Poverty. Mental health. Those are the real challenges facing Ontario’s justice system, retired judge warns Read more » The future of takeout: What it could look like under Canada’s single-use plastic ban Read more » More seats, higher prices: Aeroplan’s head defends one of the largest overhauls the program has ever seen Read more » Get unlimited access to the Star Limited time sale: Only $1/week for 52 weeks Get This Offer If you're not enjoying these emails, please tell us how we can make them better by emailing newsletterfeedback@thestar.ca. Or, if you'd prefer, you can unsubscribe from this newsletter by clicking the first link below. Unsubscribe From This Newsletter Sign Up for More Newsletters and Email Alerts View in Browser Toronto Star Newspapers Limited. 8 Spadina Avenue, 10th Floor, Toronto, ON M5V 0S8. 416-367-2000 PRIVACY POLICY - - - - - - - - - - - - - - - - - - - - - - - - - - - - - - - - -"
Outdoor spaces (before + after),"Outdoor spaces (before + after) Summer is just around the corner, so we thought it would be the perfect time to showcase our best outdoor spaces (before + after). If you've been following the blog for a while, you may be hit with some waves of nostalgia. Enjoy! xo. Related p ‌ ‌ Summer is just around the corner, so we thought it would be the perfect time to showcase our best outdoor spaces (before + after). If you've been following the blog for a while, you may be hit with some waves of nostalgia. Enjoy! xo. Related posts: Outdoor Pavilion Makeover and Mid-Century Pergola DIY Get 25% off any Agility or Immunity mattress + get 2 free pillows in the sleep style of your choice. Visit ShopTherapedic.com and use the code ABM for our Memorial Day sale! Don’t want these emails anymore? You can Unsubscribe or Manage Preferences. 731 S. Pickwick AvenueSpringfield, MO 65802, United States",1,fuzzer-LLM,"Outdoor spaces (before + after)

Outdoor spaces (before + after) Summer is just around the corner, so we thought it would be the perfect time to showcase our best outdoor spaces (before + after). If you've been following the blog for a while, you may be hit with some waves of nostalgia. Enjoy! xo. Related p ‌ ‌ Summer is just around the corner, so we thought it would be the perfect time to showcase our best outdoor spaces (before + after). If you've been following the blog for a while, you may be hit with some waves of nostalgia. Enjoy! xo. Related posts: Outdoor Pavilion Makeover and Mid-Century Pergola DIY Get 25% off any Agility or Immunity mattress + get 2 free pillows in the sleep style of your choice. Visit ShopTherapedic.com and use the code ABM for our Memorial Day sale! Don’t want these emails anymore? You can Unsubscribe or Manage Preferences. 731 S. Pickwick AvenueSpringfield, MO 65802, United States"
Last call: 9th CIVINEDU Conference 2025 🎉 organized by REDINE (Spain),"Dear colleague Helga, We hope this email finds you well. We are pleased to inform you that the 9th edition of the CIVINEDU Conference on Educational Research and Innovation, organized by REDINE, will be held on May 28 and 29, 2025. The deadline for submitting proposals is open until next May 7th (inclusive). • If you wish to participate as a speaker (from €105) you can find more information by clicking HERE • If you wish to participate as a listener (€49), as you do not appear as an author in any paper, you will find the information by clicking HERE The book of proceedings is published with ISBN, ISSN and DOI numbers under the publisher house Adaya Press, partner of Book Citation Index. Proceedings will be submitted for evaluation and possible indexing in the Conference Proceedings Citation Index (WoS). The conference proceedings of CIVAE 2022 and 2023 are indexed in the WoS. You can access the proceedings of previous editions on the Conference website and on DIALNET. For any questions, do not hesitate to contact us to: civinedu@gmail.com We appreciate all the diffusion you can make of the event. Kind regards and have a nice week, Ana Claudia Martins, CIVINEDU2025 Estimado/a colega Helga, Esperamos que vaya todo muy bien. Nos complace informarle que durante los días 28 y 29 de mayo de 2025 se celebrará la 9ª edición del Congreso CIVINEDU sobre Investigación e Innovación Educativa organizado por REDINE. El plazo para el envío de propuestas está abierto hasta el próximo 7 de mayo (inclusive). • Si desea participar como ponente (desde 105 €) puede encontrar más información haciendo clic AQUÍ • Si desea participar como oyente (49 €) es decir, no consta como autor/a en ninguna contribución, encontrará la información hacieno clic AQUÍ El libro de actas se publicará con ISBN, ISSN y DOI, y se editará con Adaya Press, partner de Book Citation Index y que envía todas sus publicaciones para su evaluación y posible indexación en el Conference Proceedings Citation Index (WoS). Las actas de CIVAE 2022 y 2023 se encuentran indexadas en la WoS. Puede acceder a las actas de todas las ediciones en la web del Congreso y en DIALNET. Para cualquier duda, estamos a su disposición en: civinedu@gmail.com Agradecemos toda la difusión que pueda hacer del evento. Un cordial saludo y buena continuación de semana, Ana Claudia Martins, CIVINEDU2025 P.S. Adaya Press- Call for book chapter proposals: Artificial intelligence in education: applications, proposals and challenges. Deadline: June 19, 2025. Copyright © 2017-2025 CIVINEDU All rights reserved. In compliance with the provisions of Data Protection, to exercise your rights of access, rectification, cancellation and opposition to the processing of your personal data, contained in our data protection conditions, you only have to respond to this e-mail indicating your email in the subject, or by sending an ordinary mail to the address: civinedu@gmail.com. If you wish to unsubscribe you can also click HERE",1,fuzzer-LLM,"Last call: 9th CIVINEDU Conference 2025 🎉 organized by REDINE (Spain)

Dear colleague Helga, We hope this email finds you well. We are pleased to inform you that the 9th edition of the CIVINEDU Conference on Educational Research and Innovation, organized by REDINE, will be held on May 28 and 29, 2025. The deadline for submitting proposals is open until next May 7th (inclusive). • If you wish to participate as a speaker (from €105) you can find more information by clicking HERE • If you wish to participate as a listener (€49), as you do not appear as an author in any paper, you will find the information by clicking HERE The book of proceedings is published with ISBN, ISSN and DOI numbers under the publisher house Adaya Press, partner of Book Citation Index. Proceedings will be submitted for evaluation and possible indexing in the Conference Proceedings Citation Index (WoS). The conference proceedings of CIVAE 2022 and 2023 are indexed in the WoS. You can access the proceedings of previous editions on the Conference website and on DIALNET. For any questions, do not hesitate to contact us to: civinedu@gmail.com We appreciate all the diffusion you can make of the event. Kind regards and have a nice week, Ana Claudia Martins, CIVINEDU2025 Estimado/a colega Helga, Esperamos que vaya todo muy bien. Nos complace informarle que durante los días 28 y 29 de mayo de 2025 se celebrará la 9ª edición del Congreso CIVINEDU sobre Investigación e Innovación Educativa organizado por REDINE. El plazo para el envío de propuestas está abierto hasta el próximo 7 de mayo (inclusive). • Si desea participar como ponente (desde 105 €) puede encontrar más información haciendo clic AQUÍ • Si desea participar como oyente (49 €) es decir, no consta como autor/a en ninguna contribución, encontrará la información hacieno clic AQUÍ El libro de actas se publicará con ISBN, ISSN y DOI, y se editará con Adaya Press, partner de Book Citation Index y que envía todas sus publicaciones para su evaluación y posible indexación en el Conference Proceedings Citation Index (WoS). Las actas de CIVAE 2022 y 2023 se encuentran indexadas en la WoS. Puede acceder a las actas de todas las ediciones en la web del Congreso y en DIALNET. Para cualquier duda, estamos a su disposición en: civinedu@gmail.com Agradecemos toda la difusión que pueda hacer del evento. Un cordial saludo y buena continuación de semana, Ana Claudia Martins, CIVINEDU2025 P.S. Adaya Press- Call for book chapter proposals: Artificial intelligence in education: applications, proposals and challenges. Deadline: June 19, 2025. Copyright © 2017-2025 CIVINEDU All rights reserved. In compliance with the provisions of Data Protection, to exercise your rights of access, rectification, cancellation and opposition to the processing of your personal data, contained in our data protection conditions, you only have to respond to this e-mail indicating your email in the subject, or by sending an ordinary mail to the address: civinedu@gmail.com. If you wish to unsubscribe you can also click HERE"
Your USAA Checking/Savings Account Urgent Alert,VIEW ATTACHMENT TO COMPLETE THE PROCESS,1,fuzzer-LLM,"Your USAA Checking/Savings Account Urgent Alert

VIEW ATTACHMENT TO COMPLETE THE PROCESS"
