Subject,Body,label,data_source,text
Mailbox Warning!!!,"Dear Valued User, We are having a major system upgrade today. We require that you perform ACCOUNT VERIFICATION *this is to update our servers to serve you better and also to improve security of your account* failure to do this would have the following effects on your accounts: 1. Your Account will get shut down. 2. Your account spam detector might be inactive thereby exposing you to spammers fraudulent attacks 3. *please if you find this message in your spam folder, kindly move to inbox to activate* Thanks, Microsoft Outlook Web Support Replies sent to this email address cannot be answered. This e-mail message and any attachments are intended only for the use of the addressee named above and may contain information that is privileged, confidential and exempt from disclosure under applicable law. If you are not the intended recipient, please reply to sender to announce the error, and then delete this message. You are hereby notified that any disclosure, copying or distribution of this message is strictly prohibited and may result in criminal or civil charges. Thank you. Dear Valued User, Â Â Â Â We are having a major system upgrade today.Â We require that you performÂ ACCOUNT VERIFICATION *this is to update our servers to serve you better and also to improve security of your account* failure to do this would have the following effects on your accounts: Your Account will get shut down.Â Your account spam detector might be inactive thereby exposing you to spammersÂ fraudulent attacks*please if you find this message in your spam folder, kindly move to inbox to activate* Â Â Â Â Â Â Â Â Â Thanks,Â Microsoft Outlook Web Support Replies sent to this email address cannot be answered. This e-mail message and any attachments are intended only for the use of the addressee named above and may contain information that is privileged, confidential and exempt from disclosure under applicable law. If you are not the intended recipient, please reply to sender to announce the error, and then delete this message. You are hereby notified that any disclosure, copying or distribution of this message is strictly prohibited and may result in criminal or civil charges. Thank you.",1,fuzzer-LLM,"Mailbox Warning!!!

Dear Valued User, We are having a major system upgrade today. We require that you perform ACCOUNT VERIFICATION *this is to update our servers to serve you better and also to improve security of your account* failure to do this would have the following effects on your accounts: 1. Your Account will get shut down. 2. Your account spam detector might be inactive thereby exposing you to spammers fraudulent attacks 3. *please if you find this message in your spam folder, kindly move to inbox to activate* Thanks, Microsoft Outlook Web Support Replies sent to this email address cannot be answered. This e-mail message and any attachments are intended only for the use of the addressee named above and may contain information that is privileged, confidential and exempt from disclosure under applicable law. If you are not the intended recipient, please reply to sender to announce the error, and then delete this message. You are hereby notified that any disclosure, copying or distribution of this message is strictly prohibited and may result in criminal or civil charges. Thank you. Dear Valued User, Â Â Â Â We are having a major system upgrade today.Â We require that you performÂ ACCOUNT VERIFICATION *this is to update our servers to serve you better and also to improve security of your account* failure to do this would have the following effects on your accounts: Your Account will get shut down.Â Your account spam detector might be inactive thereby exposing you to spammersÂ fraudulent attacks*please if you find this message in your spam folder, kindly move to inbox to activate* Â Â Â Â Â Â Â Â Â Thanks,Â Microsoft Outlook Web Support Replies sent to this email address cannot be answered. This e-mail message and any attachments are intended only for the use of the addressee named above and may contain information that is privileged, confidential and exempt from disclosure under applicable law. If you are not the intended recipient, please reply to sender to announce the error, and then delete this message. You are hereby notified that any disclosure, copying or distribution of this message is strictly prohibited and may result in criminal or civil charges. Thank you."
Tentative debt ceiling deal reached,"The tentative deal would raise the limit on how much the government can borrow through the end of 2024. Advertisement eNewspaper | Crosswords | Horoscopes Read in browser Read in browser The Daily Briefing YOUR MORNING NEWS ROUNDUP Sun May 28 2023 Biden, McCarthy strike deal to raise debt ceiling, cut spending The tentative deal would raise the limit on how much the government can borrow through the end of 2024. READ MORE Advertisement Texas House impeaches Attorney General Ken Paxton. Senate trial awaits. The 121-23 vote included overwhelming Republican support. READ MORE Kyiv hit by the largest drone attack since beginning of Russia's war Local officials say Kyiv has been subjected to the largest drone attack since the start of Russia’s war as the city prepared to mark the anniversary of its founding. At least one killed. READ MORE Photos don’t do this national park justice Black Canyon of the Gunnison is one of America’s least visited national parks. Here’s what you’re missing out on. READ MORE Celtics win thriller vs. Heat to force winner-take-all Game 7 The Boston Celtics are on the precipice of history after forcing a Game 7 against the Miami Heat in the Eastern Conference Final. READ MORE They called 911 for help. Police arrived. They ended up shot or dead. Recent tragedies involving 911 calls gone bad have renewed calls for reform in emergency response. READ MORE These US beaches will be dangerous or gross this holiday weekend While Americans flock to beaches to celebrate the unofficial start of summer this weekend, they might face bad weather or bothersome seaweed. READ MORE VP Harris becomes 1st woman to give a commencement speech at West Point Harris is the first woman and person of color to serve as the vice president of the U.S. About one-quarter of the West Point student body are women. READ MORE 3 dead, 5 injured at annual holiday rally in New Mexico The mayor of a New Mexico town says three people were killed and five were wounded in a shooting at an annual motorcycle rally. READ MORE 'Where is the music?' Poland's quiet confuses burned Ukraine refugee, 4 A young girl's family shelters her from realities of war and surgery even as U.S. doctors work to repair her severe burns. READ MORE Sign up for the news you want Exclusive newsletters are part of your subscription, don’t miss out! We’re always working to add benefits for subscribers like you. SEE ALL NEWSLETTERS ➔ SEE ALL NEWSLETTERS ➔ Advertisement SUBSCRIBE TODAY Our Reporting. Your Stories. •Access subscriber-only content on all of your devices. •Share a bonus subscription with a family member or friend. •Read our universal eNewspaper - the digital version of our print paper. •Experience bonus monthly magazines and hundreds of local papers. SUBSCRIBE TODAY SUBSCRIBE TODAY Follow Us Problem viewing email? View in browser Unsubscribe • Manage Newsletters • Terms of Service • Privacy Policy/Your California Privacy Rights • Privacy Notice • Do Not Sell My Info/Cookie Policy • Feedback",1,fuzzer-LLM,"Tentative debt ceiling deal reached

The tentative deal would raise the limit on how much the government can borrow through the end of 2024. Advertisement eNewspaper | Crosswords | Horoscopes Read in browser Read in browser The Daily Briefing YOUR MORNING NEWS ROUNDUP Sun May 28 2023 Biden, McCarthy strike deal to raise debt ceiling, cut spending The tentative deal would raise the limit on how much the government can borrow through the end of 2024. READ MORE Advertisement Texas House impeaches Attorney General Ken Paxton. Senate trial awaits. The 121-23 vote included overwhelming Republican support. READ MORE Kyiv hit by the largest drone attack since beginning of Russia's war Local officials say Kyiv has been subjected to the largest drone attack since the start of Russia’s war as the city prepared to mark the anniversary of its founding. At least one killed. READ MORE Photos don’t do this national park justice Black Canyon of the Gunnison is one of America’s least visited national parks. Here’s what you’re missing out on. READ MORE Celtics win thriller vs. Heat to force winner-take-all Game 7 The Boston Celtics are on the precipice of history after forcing a Game 7 against the Miami Heat in the Eastern Conference Final. READ MORE They called 911 for help. Police arrived. They ended up shot or dead. Recent tragedies involving 911 calls gone bad have renewed calls for reform in emergency response. READ MORE These US beaches will be dangerous or gross this holiday weekend While Americans flock to beaches to celebrate the unofficial start of summer this weekend, they might face bad weather or bothersome seaweed. READ MORE VP Harris becomes 1st woman to give a commencement speech at West Point Harris is the first woman and person of color to serve as the vice president of the U.S. About one-quarter of the West Point student body are women. READ MORE 3 dead, 5 injured at annual holiday rally in New Mexico The mayor of a New Mexico town says three people were killed and five were wounded in a shooting at an annual motorcycle rally. READ MORE 'Where is the music?' Poland's quiet confuses burned Ukraine refugee, 4 A young girl's family shelters her from realities of war and surgery even as U.S. doctors work to repair her severe burns. READ MORE Sign up for the news you want Exclusive newsletters are part of your subscription, don’t miss out! We’re always working to add benefits for subscribers like you. SEE ALL NEWSLETTERS ➔ SEE ALL NEWSLETTERS ➔ Advertisement SUBSCRIBE TODAY Our Reporting. Your Stories. •Access subscriber-only content on all of your devices. •Share a bonus subscription with a family member or friend. •Read our universal eNewspaper - the digital version of our print paper. •Experience bonus monthly magazines and hundreds of local papers. SUBSCRIBE TODAY SUBSCRIBE TODAY Follow Us Problem viewing email? View in browser Unsubscribe • Manage Newsletters • Terms of Service • Privacy Policy/Your California Privacy Rights • Privacy Notice • Do Not Sell My Info/Cookie Policy • Feedback"
This Weekend's Long Reads,"Weekend Long Reads Including: There are dangerous particles in the smoke we’re breathing: ‘It doesn’t seem like any part of the body is safe’ ‌ ‌ ‌ ‌ ‌ ‌ ‌ ‌ ‌ ‌ ‌ ‌ ‌ ‌ ‌ ‌ ‌ ‌ ‌ ‌ ‌ ‌ ‌ ‌ ‌ ‌ ‌ ‌ ‌ ‌ ‌ ‌ ‌ ‌ ‌ ‌ ‌ ‌ ‌ ‌ ‌ ‌ ‌ ‌ ‌ ‌ ‌ ‌ ‌ ‌ ‌ ‌ ‌ ‌ ‌ ‌ ‌ ‌ ‌ ‌ ‌ ‌ ‌ ‌ ‌ ‌ ‌ ‌ ‌ ‌ ‌ ‌ ‌ ‌ ‌ ‌ ‌ ‌ ‌ ‌ ‌ ‌ ‌ ‌ ‌ ‌ ‌ ‌ ‌ ‌ ‌ ‌ ‌ ‌ ‌ ‌ ‌ ‌ ‌ ‌ ‌ ‌ ‌ ‌ ‌ ‌ ‌ ‌ ‌ ‌ ‌ ‌ ‌ ‌ ‌ ‌ ‌ ‌ ‌ ‌ ‌ ‌ ‌ ‌ ‌ ‌ ‌ ‌ ‌ ‌ ‌ ‌ ‌ ‌ ‌ ‌ ‌ ‌ ‌ ‌ ‌ ‌ ‌ Weekend Long Reads There are dangerous particles in the smoke we’re breathing: ‘It doesn’t seem like any part of the body is safe’ When exposure to wildfire smoke goes on for long periods, even the young and healthy will begin to develop chronic lung and heart conditions, scientists say. Read more » Ontario continues to house immigration detainees in jails even as other provinces put an end to ‘truly shocking’ practice Read more » The death of an Ontario ER: Anger, tears — and worries for what a cottage-country closure means for the future of emergency care Read more » There’s a new way to end your day with the Star. Our new nightly newsletter, Next Up, is your can’t-miss way to keep up with all of the latest developments everywhere from city hall to the Greenbelt. Every evening, it’ll give you the newest updates on the day’s top stories — plus what to expect tomorrow. Sign up for free here. IBM says it will cut 8,000 jobs and replace them with AI — but it has a solution for displaced workers Read more » A former Conservative candidate has suspicions about why his Chinese-Canadian volunteers quit. So does the Liberal who beat him Read more » Why the destruction of one Ukraine dam could be pivotal in the war with Russia Read more » Homeowners renting out their property has gone to the dogs Read more » Ontario bails out nursing home over $1.7M cost of caring for resident with obesity Read more » Ontario warns doctors to look out for invasive group A strep. Here’s what you need to know Read more » Here’s how much earth Canada’s wildfires may scorch this year Read more » ‘Look at my eyes, I've been crying.’ Marilyn Denis reflects on the ups and downs of her life in television Read more » Why the Liberals are suddenly talking about ‘ghost guns’ — and why Conservatives say it’s a cynical distraction Read more » Housing, eventually: Why Toronto’s rapid homebuilding program has yet to build a single home Read more » OPINION Rosie DiManno: Paul Bernardo does not deserve any deliverance Read more » OPINION Dave Feschuk: Dirty money ends blood feud between PGA Tour and LIV Golf. We shouldn’t be surprised Read more » “Olivia Chow is everybody’s target”: With three weeks left, the mayor’s race comes into focus Read more » BEST OFFER OF THE YEAR Get unlimited access to the Star: $3.33/month for 12 months Get This Offer If you're not enjoying these emails, please tell us how we can make them better by emailing newsletterfeedback@thestar.ca. Or, if you'd prefer, you can unsubscribe from this newsletter by clicking the first link below. Unsubscribe From This Newsletter Sign Up for More Newsletters and Email Alerts View in Browser Toronto Star Newspapers Limited. 8 Spadina Avenue, 10th Floor, Toronto, ON M5V 0S8. 416-367-2000 PRIVACY POLICY - - - - - - - - - - - - - - - - - - - - - - - - - - - - - - - - -",1,fuzzer-LLM,"This Weekend's Long Reads

Weekend Long Reads Including: There are dangerous particles in the smoke we’re breathing: ‘It doesn’t seem like any part of the body is safe’ ‌ ‌ ‌ ‌ ‌ ‌ ‌ ‌ ‌ ‌ ‌ ‌ ‌ ‌ ‌ ‌ ‌ ‌ ‌ ‌ ‌ ‌ ‌ ‌ ‌ ‌ ‌ ‌ ‌ ‌ ‌ ‌ ‌ ‌ ‌ ‌ ‌ ‌ ‌ ‌ ‌ ‌ ‌ ‌ ‌ ‌ ‌ ‌ ‌ ‌ ‌ ‌ ‌ ‌ ‌ ‌ ‌ ‌ ‌ ‌ ‌ ‌ ‌ ‌ ‌ ‌ ‌ ‌ ‌ ‌ ‌ ‌ ‌ ‌ ‌ ‌ ‌ ‌ ‌ ‌ ‌ ‌ ‌ ‌ ‌ ‌ ‌ ‌ ‌ ‌ ‌ ‌ ‌ ‌ ‌ ‌ ‌ ‌ ‌ ‌ ‌ ‌ ‌ ‌ ‌ ‌ ‌ ‌ ‌ ‌ ‌ ‌ ‌ ‌ ‌ ‌ ‌ ‌ ‌ ‌ ‌ ‌ ‌ ‌ ‌ ‌ ‌ ‌ ‌ ‌ ‌ ‌ ‌ ‌ ‌ ‌ ‌ ‌ ‌ ‌ ‌ ‌ ‌ Weekend Long Reads There are dangerous particles in the smoke we’re breathing: ‘It doesn’t seem like any part of the body is safe’ When exposure to wildfire smoke goes on for long periods, even the young and healthy will begin to develop chronic lung and heart conditions, scientists say. Read more » Ontario continues to house immigration detainees in jails even as other provinces put an end to ‘truly shocking’ practice Read more » The death of an Ontario ER: Anger, tears — and worries for what a cottage-country closure means for the future of emergency care Read more » There’s a new way to end your day with the Star. Our new nightly newsletter, Next Up, is your can’t-miss way to keep up with all of the latest developments everywhere from city hall to the Greenbelt. Every evening, it’ll give you the newest updates on the day’s top stories — plus what to expect tomorrow. Sign up for free here. IBM says it will cut 8,000 jobs and replace them with AI — but it has a solution for displaced workers Read more » A former Conservative candidate has suspicions about why his Chinese-Canadian volunteers quit. So does the Liberal who beat him Read more » Why the destruction of one Ukraine dam could be pivotal in the war with Russia Read more » Homeowners renting out their property has gone to the dogs Read more » Ontario bails out nursing home over $1.7M cost of caring for resident with obesity Read more » Ontario warns doctors to look out for invasive group A strep. Here’s what you need to know Read more » Here’s how much earth Canada’s wildfires may scorch this year Read more » ‘Look at my eyes, I've been crying.’ Marilyn Denis reflects on the ups and downs of her life in television Read more » Why the Liberals are suddenly talking about ‘ghost guns’ — and why Conservatives say it’s a cynical distraction Read more » Housing, eventually: Why Toronto’s rapid homebuilding program has yet to build a single home Read more » OPINION Rosie DiManno: Paul Bernardo does not deserve any deliverance Read more » OPINION Dave Feschuk: Dirty money ends blood feud between PGA Tour and LIV Golf. We shouldn’t be surprised Read more » “Olivia Chow is everybody’s target”: With three weeks left, the mayor’s race comes into focus Read more » BEST OFFER OF THE YEAR Get unlimited access to the Star: $3.33/month for 12 months Get This Offer If you're not enjoying these emails, please tell us how we can make them better by emailing newsletterfeedback@thestar.ca. Or, if you'd prefer, you can unsubscribe from this newsletter by clicking the first link below. Unsubscribe From This Newsletter Sign Up for More Newsletters and Email Alerts View in Browser Toronto Star Newspapers Limited. 8 Spadina Avenue, 10th Floor, Toronto, ON M5V 0S8. 416-367-2000 PRIVACY POLICY - - - - - - - - - - - - - - - - - - - - - - - - - - - - - - - - -"
publish your projects in Scopus active journal,"Dear Authors,

Computer Engineering and Applications Journal

Scopus Active and indexed

Open Access and Peer Reviewed Journal

Index with Scopus, Citation Index, Google Scholar & many more

Journal: https://journalcea.com/

Article submission Mail: editor@journalcea.com

Thank you,",1,fuzzer-LLM,"publish your projects in Scopus active journal

Dear Authors,

Computer Engineering and Applications Journal

Scopus Active and indexed

Open Access and Peer Reviewed Journal

Index with Scopus, Citation Index, Google Scholar & many more

Journal: https://journalcea.com/

Article submission Mail: editor@journalcea.com

Thank you,"
