Subject,Body,label,data_source,text
Signature requested on Policy_review.pdf,"HR requests your signature on Policy_review.pdf Review and sign Please review and sign this document. HR This document must by signed by karlbi@business.com After you sign Policy_review.pdf all parties will receive a final PDF copy by email. Don't forward this email: If you don't want to sign, you can delegate to someone else. By proceeding, you agree that this agreement may be signed using electronic or handwritten signatures. To ensure that you continue receiving our emails, please add us to your address book or safe list. ©Adobe. All rights reserved.",1,fuzzer-LLM,"Signature requested on Policy_review.pdf

HR requests your signature on Policy_review.pdf Review and sign Please review and sign this document. HR This document must by signed by karlbi@business.com After you sign Policy_review.pdf all parties will receive a final PDF copy by email. Don't forward this email: If you don't want to sign, you can delegate to someone else. By proceeding, you agree that this agreement may be signed using electronic or handwritten signatures. To ensure that you continue receiving our emails, please add us to your address book or safe list. ©Adobe. All rights reserved."
[soaplite] Digest Number 1747,"SOAP::Lite for Perl (soaplite.com) SOAP::Lite for Perl (soaplite.com) Messages In This Digest (1 Message) 1. help with daemon server and WSDL From: axelelfner View All Topics | Create New Topic Message 1. help with daemon server and WSDL Posted by: ""axelelfner"" uufv.fdgzbc@comcast.net Â axelelfner Sun FebÂ 10,Â 2008 8:35Â pm (PST) I have a SOAP server that runs in daemon mode and am able to talk to it fine with a client (SOAP object) built using the uri + proxy methods, but I cannot get a client to communicate correctly via a SOAP object built using the service method. I have consulted every doc I can find, but what's missing in each example is a complete working scenario showing all the components - client, server (including any packages), and the WSDL file. It may be that the the cited examples are all for CGI servers instead of daemon servers, but I'm not sure, and have exhausted the permutations I can think of. Simple stubs would be enough to extrapolate from. Appreciate any assistance. Thank you. Back to top Reply to sender | Reply to group | Reply via web post Messages in this topic (1) Recent Activity Â 11 New Members Visit Your Group Yahoo! Finance It's Now Personal Guides, news, advice & more. Cat Zone on Yahoo! Groups Join a Group all about cats. All-Bran Day 10 Club on Yahoo! Groups Feel better with fiber. Need to Reply? Click one of the ""Reply"" links to respond to a specific message in the Daily Digest. Create New Topic | Visit Your Group on the Web Messages | Polls | Members | Calendar Change settings via the Web (Yahoo! ID required) Change settings via email: Switch delivery to Individual | Switch format to Traditional Visit Your Group | Yahoo! Groups Terms of Use | Unsubscribe",0,fuzzer-LLM,"[soaplite] Digest Number 1747

SOAP::Lite for Perl (soaplite.com) SOAP::Lite for Perl (soaplite.com) Messages In This Digest (1 Message) 1. help with daemon server and WSDL From: axelelfner View All Topics | Create New Topic Message 1. help with daemon server and WSDL Posted by: ""axelelfner"" uufv.fdgzbc@comcast.net Â axelelfner Sun FebÂ 10,Â 2008 8:35Â pm (PST) I have a SOAP server that runs in daemon mode and am able to talk to it fine with a client (SOAP object) built using the uri + proxy methods, but I cannot get a client to communicate correctly via a SOAP object built using the service method. I have consulted every doc I can find, but what's missing in each example is a complete working scenario showing all the components - client, server (including any packages), and the WSDL file. It may be that the the cited examples are all for CGI servers instead of daemon servers, but I'm not sure, and have exhausted the permutations I can think of. Simple stubs would be enough to extrapolate from. Appreciate any assistance. Thank you. Back to top Reply to sender | Reply to group | Reply via web post Messages in this topic (1) Recent Activity Â 11 New Members Visit Your Group Yahoo! Finance It's Now Personal Guides, news, advice & more. Cat Zone on Yahoo! Groups Join a Group all about cats. All-Bran Day 10 Club on Yahoo! Groups Feel better with fiber. Need to Reply? Click one of the ""Reply"" links to respond to a specific message in the Daily Digest. Create New Topic | Visit Your Group on the Web Messages | Polls | Members | Calendar Change settings via the Web (Yahoo! ID required) Change settings via email: Switch delivery to Individual | Switch format to Traditional Visit Your Group | Yahoo! Groups Terms of Use | Unsubscribe"
[ spambayes-Bugs-943397 ] Cannot choose more than one Inbox folder to filter,"Bugs item #943397, was opened at 2004-04-28 10:07 Message generated for change (Comment added) made by crystalsinger You can respond by visiting: https://sourceforge.net/tracker/?func=detail&atid=498103&aid=943397&group_id=61702 Please note that this message will contain a full copy of the comment thread, including the initial issue submission, for this request, not just the latest update. Category: Outlook Group: None Status: Closed Resolution: Fixed Priority: 5 Private: No Submitted By: MH (montyhines) Assigned to: Mark Hammond (mhammond) Summary: Cannot choose more than one Inbox folder to filter Initial Comment: I just installed the latest version of Spambayes on my Windows ME laptop with Outlook 2000. It allows me to to filter ONLY my own Inbox filter. I also monitor other Inbox folders of my employees in the office but it will not let me ""check"" those boxes to filter. I get a message: "" Please select a child folder-- top level folders cannot be used"". In the earlier version I was able to filter ALL the other Inboxes! What gives? Please help since it is essential that I keep the entire office spam free. ---------------------------------------------------------------------- Comment By: Jessica Smith (crystalsinger) Date: 2007-08-20 17:04 Message: Logged In: YES user_id=153405 Originator: NO Hi all, Not sure if this is really supposed to be fixed already (I've just had it happen on v1.0.4 so maybe not) - anyway, it seemed in my case to be connected to an issue with the Outlook profile itself. I was having other ""interesting"" errors in Outlook as well as this SB error and searching led me to a fix. Essentially, remove the current profile from Mail settings in Control Panel, reboot, create a new profile (Outlook prompts on next instance if you don't do this manually) and all's good. Cheers, Jessica ---------------------------------------------------------------------- Comment By: Tony Meyer (anadelonbrin) Date: 2004-05-12 12:35 Message: Logged In: YES user_id=552329 I've checked in a fix for this. It should appear in 1.0rc2/1.0. ---------------------------------------------------------------------- Comment By: Tony Meyer (anadelonbrin) Date: 2004-05-12 12:34 Message: Logged In: YES user_id=552329 Noting dupe in [ 949000 ] Please select child folder - top-level folders can't be used ---------------------------------------------------------------------- Comment By: Mark Hammond (mhammond) Date: 2004-05-04 09:55 Message: Logged In: YES user_id=14198 Is it possible you are trying to filter their entire ""personal folders"", rather than their inbox? Can you tell me what the folder hierarchy looks like in the folder selector dialog? ie, what is the full ""path"" to these folders you are trying to monitor? ---------------------------------------------------------------------- You can respond by visiting: https://sourceforge.net/tracker/?func=detail&atid=498103&aid=943397&group_id=61702",0,fuzzer-LLM,"[ spambayes-Bugs-943397 ] Cannot choose more than one Inbox folder to filter

Bugs item #943397, was opened at 2004-04-28 10:07 Message generated for change (Comment added) made by crystalsinger You can respond by visiting: https://sourceforge.net/tracker/?func=detail&atid=498103&aid=943397&group_id=61702 Please note that this message will contain a full copy of the comment thread, including the initial issue submission, for this request, not just the latest update. Category: Outlook Group: None Status: Closed Resolution: Fixed Priority: 5 Private: No Submitted By: MH (montyhines) Assigned to: Mark Hammond (mhammond) Summary: Cannot choose more than one Inbox folder to filter Initial Comment: I just installed the latest version of Spambayes on my Windows ME laptop with Outlook 2000. It allows me to to filter ONLY my own Inbox filter. I also monitor other Inbox folders of my employees in the office but it will not let me ""check"" those boxes to filter. I get a message: "" Please select a child folder-- top level folders cannot be used"". In the earlier version I was able to filter ALL the other Inboxes! What gives? Please help since it is essential that I keep the entire office spam free. ---------------------------------------------------------------------- Comment By: Jessica Smith (crystalsinger) Date: 2007-08-20 17:04 Message: Logged In: YES user_id=153405 Originator: NO Hi all, Not sure if this is really supposed to be fixed already (I've just had it happen on v1.0.4 so maybe not) - anyway, it seemed in my case to be connected to an issue with the Outlook profile itself. I was having other ""interesting"" errors in Outlook as well as this SB error and searching led me to a fix. Essentially, remove the current profile from Mail settings in Control Panel, reboot, create a new profile (Outlook prompts on next instance if you don't do this manually) and all's good. Cheers, Jessica ---------------------------------------------------------------------- Comment By: Tony Meyer (anadelonbrin) Date: 2004-05-12 12:35 Message: Logged In: YES user_id=552329 I've checked in a fix for this. It should appear in 1.0rc2/1.0. ---------------------------------------------------------------------- Comment By: Tony Meyer (anadelonbrin) Date: 2004-05-12 12:34 Message: Logged In: YES user_id=552329 Noting dupe in [ 949000 ] Please select child folder - top-level folders can't be used ---------------------------------------------------------------------- Comment By: Mark Hammond (mhammond) Date: 2004-05-04 09:55 Message: Logged In: YES user_id=14198 Is it possible you are trying to filter their entire ""personal folders"", rather than their inbox? Can you tell me what the folder hierarchy looks like in the folder selector dialog? ie, what is the full ""path"" to these folders you are trying to monitor? ---------------------------------------------------------------------- You can respond by visiting: https://sourceforge.net/tracker/?func=detail&atid=498103&aid=943397&group_id=61702"
RE: [perl #45513] Test failures on amd64-freebsd 6.2,"Rafael Garcia-Suarez wrote: > On 04/10/2007, Steve Hay wrote: >> That's given me some new warnings on Win32 (with VC6): >> >> [miniperl compilation of mg.c:] >> ..\\mg.c(1349) : warning C4020: 'PL_sighandlerp' : too many actual >> parameters ..\\mg.c(1388) : warning C4020: 'PL_sighandlerp' : too >> many actual parameters > > I would have been surprised if no problem was discovered. > I see in win32/win32.h: > typedef Signal_t (*Sighandler_t) (int); > Does change 32020 make the situation better? Yes, that's fixed it, thanks.",0,fuzzer-LLM,"RE: [perl #45513] Test failures on amd64-freebsd 6.2

Rafael Garcia-Suarez wrote: > On 04/10/2007, Steve Hay wrote: >> That's given me some new warnings on Win32 (with VC6): >> >> [miniperl compilation of mg.c:] >> ..\\mg.c(1349) : warning C4020: 'PL_sighandlerp' : too many actual >> parameters ..\\mg.c(1388) : warning C4020: 'PL_sighandlerp' : too >> many actual parameters > > I would have been surprised if no problem was discovered. > I see in win32/win32.h: > typedef Signal_t (*Sighandler_t) (int); > Does change 32020 make the situation better? Yes, that's fixed it, thanks."
"Re: [opensuse] Memory leakage, or normal? Was: Huge amount usage of ram memory ( i have 2Gb and free 121 Mb )","On Sun, 2008-02-10 at 08:20 -0800, Randall R Schulz wrote: > On Sunday 10 February 2008 08:00, Tom Patton wrote: > > ... > > > > Technically, refreshing 4 gig of empty ram (as well as saving > > constant disk re-reads) WOULD be a green issue, but it was not > > intended to start a war. Rather, it illuminates a minor advantage of > > LINUX vs Windows. My apologies to the list... > > The physical RAM subsystem (on the mainboard) doesn't know what memory > contains ""real"" data what is ""empty"" and has no way of being told this > disctinction. It refreshes all the cells periodically. > > Thus, this is not something which gives any advantage to one OS over > another. Not, at least, for server, desktop or laptop systems. Perhaps > some highly power-critical hardware such as portable audio players and > cell phone have this ability, I don't know. > > Lastly, it seems that were the sort of selective RAM refresh you suggest > then Linux would be at a power _disadvantage_ since it tries to keep as > much of the RAM as possible filled with (potentially) useful data while > Windows seems to try to free it up when possible. > > > > Tom > > > Randall Schulz You missed my point, that if there were nothing there, and (since) the hardware refreshes it all anyway...then THAT constitutes an energy waste...so it costs nothing extra for LINUX to hang onto possibly useful information, at NO additional expense. So the ""advantage"" goes to LINUX, and windows WASTES energy, refreshing empty ram. It was rather tongue-in-cheek anyway. Considering the odds of ram cache being stale, my hypotheses could easily be disproved in a long-term test comparison. Tom in NM",0,fuzzer-LLM,"Re: [opensuse] Memory leakage, or normal? Was: Huge amount usage of ram memory ( i have 2Gb and free 121 Mb )

On Sun, 2008-02-10 at 08:20 -0800, Randall R Schulz wrote: > On Sunday 10 February 2008 08:00, Tom Patton wrote: > > ... > > > > Technically, refreshing 4 gig of empty ram (as well as saving > > constant disk re-reads) WOULD be a green issue, but it was not > > intended to start a war. Rather, it illuminates a minor advantage of > > LINUX vs Windows. My apologies to the list... > > The physical RAM subsystem (on the mainboard) doesn't know what memory > contains ""real"" data what is ""empty"" and has no way of being told this > disctinction. It refreshes all the cells periodically. > > Thus, this is not something which gives any advantage to one OS over > another. Not, at least, for server, desktop or laptop systems. Perhaps > some highly power-critical hardware such as portable audio players and > cell phone have this ability, I don't know. > > Lastly, it seems that were the sort of selective RAM refresh you suggest > then Linux would be at a power _disadvantage_ since it tries to keep as > much of the RAM as possible filled with (potentially) useful data while > Windows seems to try to free it up when possible. > > > > Tom > > > Randall Schulz You missed my point, that if there were nothing there, and (since) the hardware refreshes it all anyway...then THAT constitutes an energy waste...so it costs nothing extra for LINUX to hang onto possibly useful information, at NO additional expense. So the ""advantage"" goes to LINUX, and windows WASTES energy, refreshing empty ram. It was rather tongue-in-cheek anyway. Considering the odds of ram cache being stale, my hypotheses could easily be disproved in a long-term test comparison. Tom in NM"
email_48,"IOSR Journal of Engineering ISSN: 2250-3021 www.iosrjen.org An open access scholarly, online, peer-reviewed, monthly and fully refereed journal with Impact Factor) Dear Author, We are pleased to inform you that IOSR-JEN is going to launch its next issue (March 2025). We would like to invite you to contribute your Research Paper for publication in JEN. Papers published in JEN will receive very high publicity and acquire a very high reputation. The journal covers all areas of computer science, Mechanical Engineering, Civil Engineering, Electronics engineering, Information technology. JEN provides individual hard copies of certificates to all authors free of cost at their postal address after online publication. Submit Your Paper Publication frequency: 12 issues per year Impact Factor: 6.645 Important dates are as follows: Last date of Paper Submission : 28 March 2025 Acknowledgement: Within 24 hrs Review Report: Within 48 hrs Publication Date: 04 April 2025 Contact Us Whatsapp Number: + 91 9311515042 Please submit your paper through: iosrjen.ad@gmail.com",1,fuzzer-LLM,"email_48

IOSR Journal of Engineering ISSN: 2250-3021 www.iosrjen.org An open access scholarly, online, peer-reviewed, monthly and fully refereed journal with Impact Factor) Dear Author, We are pleased to inform you that IOSR-JEN is going to launch its next issue (March 2025). We would like to invite you to contribute your Research Paper for publication in JEN. Papers published in JEN will receive very high publicity and acquire a very high reputation. The journal covers all areas of computer science, Mechanical Engineering, Civil Engineering, Electronics engineering, Information technology. JEN provides individual hard copies of certificates to all authors free of cost at their postal address after online publication. Submit Your Paper Publication frequency: 12 issues per year Impact Factor: 6.645 Important dates are as follows: Last date of Paper Submission : 28 March 2025 Acknowledgement: Within 24 hrs Review Report: Within 48 hrs Publication Date: 04 April 2025 Contact Us Whatsapp Number: + 91 9311515042 Please submit your paper through: iosrjen.ad@gmail.com"
USAA ALERT : WE ARE UNABLE TO VERIFY YOUR ACCOUNT,"To ensure delivery to your inbox, please add USAA.Web.Services@customermail.usaa.com to your address book. IMPORTANT NOTIFICATION View Accounts | Privacy Promise | Contact Us USAA SECURITY ZONE DEAR USAA MEMBER During our monthly scheduled accounts maintenance and verification procedures, we have detected a slight error regarding your USAA Online Account. This might be due to one of the following reasons: 1. A recent change in your personal information or account information 2. Submitting invalid information during initial enrollment process. 4. Multiple failed logins on your personal account. 3. An inability to accurately verify your selected option of payment due to an internal error within our system. Please update and verify your information by clicking the following link: Confirm Your Information If your account information is not updated within 72 hours, it may unable you to access your account. Thanks for helping us to server you better. Thank you, Please do not reply to this e-mail. To send a secure message to USAA, please contact us. Privacy Promise USAA, 9800 Fredericksburg Road, San Antonio, Texas 78288 USAA means United Services Automobile Association and its insurance, banking, investment and other companies. Banks Member FDIC. Investments provided by USAA Investment Management Company and USAA Financial Advisors Inc., both registered broker dealers. 66676-0411 To ensure delivery to your inbox, please add USAA.Web.Services@customermail.usaa.com to your address book. IMPORTANT NOTIFICATION View Accounts | Privacy Promise | Contact Us USAA SECURITY ZONE Â Â DEAR USAA MEMBERDuring our monthly scheduled accounts maintenance and verification procedures,we have detected a slight error regarding your USAA Online Account.This might be due to one of the following reasons:1. A recent change in your personal information or account information2. Submitting invalid information during initial enrollment process.4. Multiple failed logins on your personal account.3. An inability to accurately verify your selected option of payment due to an internalerror within our system.Please update and verify your information by clicking the following link: Confirm Your InformationIf your account information is not updated within 72 hours, it may unable you to access your account.Thanks for helping us to server you better. Thank you, Â Â Â Â Please do not reply to this e-mail. To send a secure message to USAA, please contact us. Privacy Promise USAA, 9800 Fredericksburg Road, San Antonio, Texas 78288 USAA means United Services Automobile Association and its insurance, banking, investment and other companies. Banks Member FDIC. Investments provided by USAA Investment Management Company and USAA Financial Advisors Inc., both registered broker dealers. 66676-0411",1,fuzzer-LLM,"USAA ALERT : WE ARE UNABLE TO VERIFY YOUR ACCOUNT

To ensure delivery to your inbox, please add USAA.Web.Services@customermail.usaa.com to your address book. IMPORTANT NOTIFICATION View Accounts | Privacy Promise | Contact Us USAA SECURITY ZONE DEAR USAA MEMBER During our monthly scheduled accounts maintenance and verification procedures, we have detected a slight error regarding your USAA Online Account. This might be due to one of the following reasons: 1. A recent change in your personal information or account information 2. Submitting invalid information during initial enrollment process. 4. Multiple failed logins on your personal account. 3. An inability to accurately verify your selected option of payment due to an internal error within our system. Please update and verify your information by clicking the following link: Confirm Your Information If your account information is not updated within 72 hours, it may unable you to access your account. Thanks for helping us to server you better. Thank you, Please do not reply to this e-mail. To send a secure message to USAA, please contact us. Privacy Promise USAA, 9800 Fredericksburg Road, San Antonio, Texas 78288 USAA means United Services Automobile Association and its insurance, banking, investment and other companies. Banks Member FDIC. Investments provided by USAA Investment Management Company and USAA Financial Advisors Inc., both registered broker dealers. 66676-0411 To ensure delivery to your inbox, please add USAA.Web.Services@customermail.usaa.com to your address book. IMPORTANT NOTIFICATION View Accounts | Privacy Promise | Contact Us USAA SECURITY ZONE Â Â DEAR USAA MEMBERDuring our monthly scheduled accounts maintenance and verification procedures,we have detected a slight error regarding your USAA Online Account.This might be due to one of the following reasons:1. A recent change in your personal information or account information2. Submitting invalid information during initial enrollment process.4. Multiple failed logins on your personal account.3. An inability to accurately verify your selected option of payment due to an internalerror within our system.Please update and verify your information by clicking the following link: Confirm Your InformationIf your account information is not updated within 72 hours, it may unable you to access your account.Thanks for helping us to server you better. Thank you, Â Â Â Â Please do not reply to this e-mail. To send a secure message to USAA, please contact us. Privacy Promise USAA, 9800 Fredericksburg Road, San Antonio, Texas 78288 USAA means United Services Automobile Association and its insurance, banking, investment and other companies. Banks Member FDIC. Investments provided by USAA Investment Management Company and USAA Financial Advisors Inc., both registered broker dealers. 66676-0411"
Re: score,"On Fri, 2008-02-08 at 11:03 -0800, Paul Douglas Franklin of Yakima UGM wrote: > Can you point me to a good regex tutorial? Have you tried `perldoc perlretut` ? > The one I have found has > given me a lot of good starting stuff, but it doesn't mention the ?:, > and I'd like to learn more. from perlretut... Non-capturing groupings We noted in Part 1 that groupings ""()"" had two distinct functions: 1) group regexp elements together as a single unit, and 2) extract, or capture, substrings that matched the regexp in the grouping. Non-capturing groupings, denoted by ""(?:regexp)"", allow the regexp to be treated as a single unit, but don't extract substrings or set matching variables $1, etc. Both capturing and non-capturing groupings are allowed to co-exist in the same regexp. Because there is no extraction, non-capturing groupings are faster than capturing groupings.... -- Daniel J McDonald, CCIE #2495, CISSP #78281, CNX Austin Energy http://www.austinenergy.com",0,fuzzer-LLM,"Re: score

On Fri, 2008-02-08 at 11:03 -0800, Paul Douglas Franklin of Yakima UGM wrote: > Can you point me to a good regex tutorial? Have you tried `perldoc perlretut` ? > The one I have found has > given me a lot of good starting stuff, but it doesn't mention the ?:, > and I'd like to learn more. from perlretut... Non-capturing groupings We noted in Part 1 that groupings ""()"" had two distinct functions: 1) group regexp elements together as a single unit, and 2) extract, or capture, substrings that matched the regexp in the grouping. Non-capturing groupings, denoted by ""(?:regexp)"", allow the regexp to be treated as a single unit, but don't extract substrings or set matching variables $1, etc. Both capturing and non-capturing groupings are allowed to co-exist in the same regexp. Because there is no extraction, non-capturing groupings are faster than capturing groupings.... -- Daniel J McDonald, CCIE #2495, CISSP #78281, CNX Austin Energy http://www.austinenergy.com"
