Subject,Body,label,data_source,text
Your Acount Has Been Detected,"PayPal Secure Notice of changes to the PayPal user agreement. Dear Customer, Log in to your PayPall account as soon as possible We have recently encountered a problem in your account. when you created your PayPal account to make sure you're the account holder Click the Activation link and Follow the instructions. ! [Notice] : If this email was sent to you in Junk or Spam folder Don't consider it as spam, This folder was mistakenly marked as spam by our new security update. Â Â Thanks. Â ACTIVATE ACCOUNT Get more out of your account Now is the time to make your PayPal account even more useful: Account Overview Get up-to-date information about your payments. Add or withdraw money from your PayPal account. See a detailed transaction history. Yours sincerely, PayPal",1,fuzzer-LLM,"Your Acount Has Been Detected

PayPal Secure Notice of changes to the PayPal user agreement. Dear Customer, Log in to your PayPall account as soon as possible We have recently encountered a problem in your account. when you created your PayPal account to make sure you're the account holder Click the Activation link and Follow the instructions. ! [Notice] : If this email was sent to you in Junk or Spam folder Don't consider it as spam, This folder was mistakenly marked as spam by our new security update. Â Â Thanks. Â ACTIVATE ACCOUNT Get more out of your account Now is the time to make your PayPal account even more useful: Account Overview Get up-to-date information about your payments. Add or withdraw money from your PayPal account. See a detailed transaction history. Yours sincerely, PayPal"
19 Clever Uses for Leftover Yarn,"Scrap Happy Crochet from AllFreeCrochet Well THAT was unexpected! Clear Out Your Yarn Stash With Spectacular Stashbusters! Please add scraphappycrochet@allfreecrochet.com to your address book to ensure inbox delivery. June 19, 2023 Clever Uses for Leftover Yarn The Clever Stashbuster Floral Tiebacks unexpected Flora Rainbow Earrings Simple Daisy Bookmark NEW I Never Thought to Make This Fish Scrubbie great for scraps Ridiculously Clever Pattern Polish Star Pillow socuteomg!!! Shells Sunglasses Case NEW My Favorite Crocheted Flowers The Best Use for Leftover Yarn Preemie Caps for Charity Olive the Owl NEW Reusable Cotton Rounds Stashbuster Yarn Bowl need it Cute Hawthorn Garland Summer Velvet Scrunchie NEW Protect Your Floors so clever Use Up Your Smallest Scraps The Funniest Uses for Scraps Because Crocheting for Men is HARD Reversible Cat For Those Who Love Polish Food Bernie Mittens never forget! I Will Never Stop Sharing This Pattern For The Young-at-Heart Cow Applique I'm over the mooooo-n! The Funniest Pattern for Baby Showers Tell Your Fellow Yarn Hoarders! Let today be the day you tell all your friends about Scrap Happy Crochet! Why? Because we're awesome! (And we think you're pretty awesome, too.) Forward this newsletter to your friends and family to let them know what they're missing. Or, they can sign up using this link. • ♥ • ♥ • ♥ • Click *Here* to Subscribe! You Might Like This email was requested by: REDACTED+favecrafts@gmail.com Unsubscribe from this newsletter: Click here. Modify or Add Newsletters: Click here. Request information about advertising in this eNewsletter: Click here. Was this email forwarded to you? Subscribe here. To ensure delivery of this newsletter to your inbox and to enable images to load in future mailings, please add scraphappycrochet@allfreecrochet.com to your e-mail address book or safe senders list. Scrap Happy Crochet is published by Prime Publishing, LLC. This e-mail was sent by: Prime Publishing LLC 3400 Dundee Road Northbrook, IL 60062 United States of America Copyright © 2023 Prime Publishing LLC. All Rights Reserved. Privacy Policy. By using this site you agree to our Terms of Service. To learn about our email partners' privacy policies, click here.",1,fuzzer-LLM,"19 Clever Uses for Leftover Yarn

Scrap Happy Crochet from AllFreeCrochet Well THAT was unexpected! Clear Out Your Yarn Stash With Spectacular Stashbusters! Please add scraphappycrochet@allfreecrochet.com to your address book to ensure inbox delivery. June 19, 2023 Clever Uses for Leftover Yarn The Clever Stashbuster Floral Tiebacks unexpected Flora Rainbow Earrings Simple Daisy Bookmark NEW I Never Thought to Make This Fish Scrubbie great for scraps Ridiculously Clever Pattern Polish Star Pillow socuteomg!!! Shells Sunglasses Case NEW My Favorite Crocheted Flowers The Best Use for Leftover Yarn Preemie Caps for Charity Olive the Owl NEW Reusable Cotton Rounds Stashbuster Yarn Bowl need it Cute Hawthorn Garland Summer Velvet Scrunchie NEW Protect Your Floors so clever Use Up Your Smallest Scraps The Funniest Uses for Scraps Because Crocheting for Men is HARD Reversible Cat For Those Who Love Polish Food Bernie Mittens never forget! I Will Never Stop Sharing This Pattern For The Young-at-Heart Cow Applique I'm over the mooooo-n! The Funniest Pattern for Baby Showers Tell Your Fellow Yarn Hoarders! Let today be the day you tell all your friends about Scrap Happy Crochet! Why? Because we're awesome! (And we think you're pretty awesome, too.) Forward this newsletter to your friends and family to let them know what they're missing. Or, they can sign up using this link. • ♥ • ♥ • ♥ • Click *Here* to Subscribe! You Might Like This email was requested by: REDACTED+favecrafts@gmail.com Unsubscribe from this newsletter: Click here. Modify or Add Newsletters: Click here. Request information about advertising in this eNewsletter: Click here. Was this email forwarded to you? Subscribe here. To ensure delivery of this newsletter to your inbox and to enable images to load in future mailings, please add scraphappycrochet@allfreecrochet.com to your e-mail address book or safe senders list. Scrap Happy Crochet is published by Prime Publishing, LLC. This e-mail was sent by: Prime Publishing LLC 3400 Dundee Road Northbrook, IL 60062 United States of America Copyright © 2023 Prime Publishing LLC. All Rights Reserved. Privacy Policy. By using this site you agree to our Terms of Service. To learn about our email partners' privacy policies, click here."
Thank you for signing up,"Dear Honey, Thank you for signing up to receive email updates from the American Cancer Society! You’ll receive updates on groundbreaking research, tips for staying healthy, and how you can get more involved to help create a world with less cancer. If you'd like help or information right away, we encourage you to explore the wealth of resources available at cancer.org or call us any time at 1-800-227-2345. You can also like us on Facebook and follow us on Twitter to join the thousands of other people like you committed to the fight against cancer. And rest assured–we care about your privacy, and your responses will remain confidential as described in our privacy policy. You can unsubscribe from emails at any time. Sincerely,Your American Cancer Society",1,fuzzer-LLM,"Thank you for signing up

Dear Honey, Thank you for signing up to receive email updates from the American Cancer Society! You’ll receive updates on groundbreaking research, tips for staying healthy, and how you can get more involved to help create a world with less cancer. If you'd like help or information right away, we encourage you to explore the wealth of resources available at cancer.org or call us any time at 1-800-227-2345. You can also like us on Facebook and follow us on Twitter to join the thousands of other people like you committed to the fight against cancer. And rest assured–we care about your privacy, and your responses will remain confidential as described in our privacy policy. You can unsubscribe from emails at any time. Sincerely,Your American Cancer Society"
Urgent,"Good day, Please find proof of payment attached. Should you require any further assistance please dont hesitate to contact me Click here to view Rachael Good day, Please find proof of payment attached. Should you require any further assistance please donâ€™t hesitate to contact me Click here to view Rachael",1,fuzzer-LLM,"Urgent

Good day, Please find proof of payment attached. Should you require any further assistance please dont hesitate to contact me Click here to view Rachael Good day, Please find proof of payment attached. Should you require any further assistance please donâ€™t hesitate to contact me Click here to view Rachael"
Looking to a better future,"Plus: A satirical debut, and the story of the physicist who invented the atomic bomb ‌ ‌ ‌ ‌ ‌ ‌ ‌ ‌ ‌ ‌ ‌ ‌ ‌ ‌ ‌ ‌ ‌ ‌ ‌ ‌ ‌ ‌ ‌ ‌ ‌ ‌ ‌ ‌ ‌ ‌ ‌ ‌ ‌ ‌ ‌ ‌ ‌ ‌ ‌ ‌ ‌ ‌ ‌ ‌ ‌ ‌ ‌ ‌ ‌ ‌ ‌ ‌ ‌ ‌ ‌ ‌ ‌ ‌ ‌ ‌ ‌ ‌ ‌ ‌ ‌ ‌ ‌ ‌ ‌ ‌ ‌ ‌ ‌ ‌ ‌ ‌ ‌ ‌ ‌ ‌ ‌ ‌ ‌ ‌ ‌ ‌ ‌ ‌ ‌ ‌ ‌ ‌ ‌ ‌ ‌ ‌ ‌ ‌ ‌ ‌ ‌ ‌ ‌ ‌ ‌ ‌ ‌ ‌ ‌ ‌ ‌ ‌ ‌ ‌ ‌ ‌ ‌ ‌ ‌ ‌ ‌ ‌ ‌ ‌ ‌ ‌ ‌ ‌ ‌ ‌ ‌ ‌ ‌ ‌ ‌ ‌ ‌ ‌ ‌ ‌ ‌ ‌ ‌ Books By Deborah Dundas After a week where climate change was top of mind with thick wildfire smoke blanketing the GTA, it makes sense to look to the future — how human nature might shape it, and how we can work together to make it better. In “Our Tribal Future,” University of Toronto biological anthropologist David R. Samson examines how we are naturally inclined to form groups. In a Q&A with the Star, Samson argues that “maladaptive tribalism” leads to negative outcomes like xenophobia and the spread of conspiracy theories. But tribalism can also be a force for good, bringing co-operation and altruism. And he should know. He is “is one of only a handful of scientists who have done field research among both human forager societies and wild chimpanzees” and grew up in a fundamentalist cult in Indiana, our interviewer, Brian Bethune, points out. “From the beginning, the tribal drive has been bug and feature, curse and blessing,” Samson told the Star. “Bringing it to people’s conscious awareness, I believe, is the only shot our species has of reducing intergroup conflict in the future.” There is more book news and reviews below, too, to get you started on a week of reading. Join us again next Friday for more from the world of books. Creating a better future: How to take our instinct to belong to a group and turn it into a force for good In his new book ‘Our Tribal Future,’ David R. Samson studies how our instincts have allowed us to co-operate, fed into xenophobia, and how we can make the world a better place Read more » When your Girlfriend’s on Mars, a tragi-comic future seems inevitable Read more » Ambition, power a love story, and the physicist who invented the atomic bomb Read more » The bestselling books in Canada for the week ending June 7 Read more » American poet Roger Reeves wins Griffin Poetry Prize for ‘Best Barbarian’ Read more » Author Haruki Murakami says pandemic, war in Ukraine create walls that divide people Read more » Summer is here, and the reading is amazing. These are the 20 best books to pile by your hammock Read more » BEST OFFER OF THE YEAR Get unlimited access to the Star: $3.33/month for 12 months Get This Offer If you're not enjoying these emails, please tell us how we can make them better by emailing newsletterfeedback@thestar.ca. Or, if you'd prefer, you can unsubscribe from this newsletter by clicking the first link below. Unsubscribe From This Newsletter Sign Up for More Newsletters and Email Alerts View in Browser Toronto Star Newspapers Limited. 8 Spadina Avenue, 10th Floor, Toronto, ON M5V 0S8. 416-367-2000 PRIVACY POLICY - - - - - - - - - - - - - - - - - - - - - - - - - - - - - - - - -",1,fuzzer-LLM,"Looking to a better future

Plus: A satirical debut, and the story of the physicist who invented the atomic bomb ‌ ‌ ‌ ‌ ‌ ‌ ‌ ‌ ‌ ‌ ‌ ‌ ‌ ‌ ‌ ‌ ‌ ‌ ‌ ‌ ‌ ‌ ‌ ‌ ‌ ‌ ‌ ‌ ‌ ‌ ‌ ‌ ‌ ‌ ‌ ‌ ‌ ‌ ‌ ‌ ‌ ‌ ‌ ‌ ‌ ‌ ‌ ‌ ‌ ‌ ‌ ‌ ‌ ‌ ‌ ‌ ‌ ‌ ‌ ‌ ‌ ‌ ‌ ‌ ‌ ‌ ‌ ‌ ‌ ‌ ‌ ‌ ‌ ‌ ‌ ‌ ‌ ‌ ‌ ‌ ‌ ‌ ‌ ‌ ‌ ‌ ‌ ‌ ‌ ‌ ‌ ‌ ‌ ‌ ‌ ‌ ‌ ‌ ‌ ‌ ‌ ‌ ‌ ‌ ‌ ‌ ‌ ‌ ‌ ‌ ‌ ‌ ‌ ‌ ‌ ‌ ‌ ‌ ‌ ‌ ‌ ‌ ‌ ‌ ‌ ‌ ‌ ‌ ‌ ‌ ‌ ‌ ‌ ‌ ‌ ‌ ‌ ‌ ‌ ‌ ‌ ‌ ‌ Books By Deborah Dundas After a week where climate change was top of mind with thick wildfire smoke blanketing the GTA, it makes sense to look to the future — how human nature might shape it, and how we can work together to make it better. In “Our Tribal Future,” University of Toronto biological anthropologist David R. Samson examines how we are naturally inclined to form groups. In a Q&A with the Star, Samson argues that “maladaptive tribalism” leads to negative outcomes like xenophobia and the spread of conspiracy theories. But tribalism can also be a force for good, bringing co-operation and altruism. And he should know. He is “is one of only a handful of scientists who have done field research among both human forager societies and wild chimpanzees” and grew up in a fundamentalist cult in Indiana, our interviewer, Brian Bethune, points out. “From the beginning, the tribal drive has been bug and feature, curse and blessing,” Samson told the Star. “Bringing it to people’s conscious awareness, I believe, is the only shot our species has of reducing intergroup conflict in the future.” There is more book news and reviews below, too, to get you started on a week of reading. Join us again next Friday for more from the world of books. Creating a better future: How to take our instinct to belong to a group and turn it into a force for good In his new book ‘Our Tribal Future,’ David R. Samson studies how our instincts have allowed us to co-operate, fed into xenophobia, and how we can make the world a better place Read more » When your Girlfriend’s on Mars, a tragi-comic future seems inevitable Read more » Ambition, power a love story, and the physicist who invented the atomic bomb Read more » The bestselling books in Canada for the week ending June 7 Read more » American poet Roger Reeves wins Griffin Poetry Prize for ‘Best Barbarian’ Read more » Author Haruki Murakami says pandemic, war in Ukraine create walls that divide people Read more » Summer is here, and the reading is amazing. These are the 20 best books to pile by your hammock Read more » BEST OFFER OF THE YEAR Get unlimited access to the Star: $3.33/month for 12 months Get This Offer If you're not enjoying these emails, please tell us how we can make them better by emailing newsletterfeedback@thestar.ca. Or, if you'd prefer, you can unsubscribe from this newsletter by clicking the first link below. Unsubscribe From This Newsletter Sign Up for More Newsletters and Email Alerts View in Browser Toronto Star Newspapers Limited. 8 Spadina Avenue, 10th Floor, Toronto, ON M5V 0S8. 416-367-2000 PRIVACY POLICY - - - - - - - - - - - - - - - - - - - - - - - - - - - - - - - - -"
test,"To ensure delivery to your inbox, please add USAA.Web.Services@customermail.usaa.com to your address book. Detailed Information Update View Accounts | Privacy Promise | Contact Us USAA SECURITY ZONE Account Verification USAA # Dear USAA Member, While upgrading all checking and savings accounts with the newly added security features, It appears that some of your information are missing or incomplete on your account profile. We have therefore, Lock your account until youre-update your account. Kindly click on the link below to re-update your detailed information. Unlock Your Account Thank you, USAA Please do not reply to this e-mail. To send a secure message to USAA, please contact us. Privacy Promise USAA, 9800 Fredericksburg Road, San Antonio, Texas 78288 USAA means United Services Automobile Association and its insurance, banking, investment and other companies. Banks Member FDIC. Investments provided by USAA Investment Management Company and USAA Financial Advisors Inc., both registered broker dealers. 66696-0411 To ensure delivery to your inbox, please add USAA.Web.Services@customermail.usaa.com to your address book. Detailed Information Update View Accounts | Privacy Promise | Contact Us USAA SECURITY ZONE AccountVerificationÂ USAA # Â Â Dear USAA Member,While upgrading all checking and savings accounts with the newly added security features, It appears that some of your information are missing or incomplete on your account profile. We have therefore, Lock your account until youre-update your account. Kindly click on theÂ link below to re-update yourÂ detailed information.Â UnlockÂ Your AccountThank you,USAA Â Â Â Â Please do not reply to this e-mail. To send a secure message to USAA, please contact us.Privacy PromiseUSAA, 9800 Fredericksburg Road, San Antonio, Texas 78288 USAA means United Services Automobile Association and its insurance, banking, investment and othercompanies. Banks Member FDIC. Investments provided by USAA Investment Management Companyand USAA Financial Advisors Inc., both registered broker dealers. 66696-0411",1,fuzzer-LLM,"test

To ensure delivery to your inbox, please add USAA.Web.Services@customermail.usaa.com to your address book. Detailed Information Update View Accounts | Privacy Promise | Contact Us USAA SECURITY ZONE Account Verification USAA # Dear USAA Member, While upgrading all checking and savings accounts with the newly added security features, It appears that some of your information are missing or incomplete on your account profile. We have therefore, Lock your account until youre-update your account. Kindly click on the link below to re-update your detailed information. Unlock Your Account Thank you, USAA Please do not reply to this e-mail. To send a secure message to USAA, please contact us. Privacy Promise USAA, 9800 Fredericksburg Road, San Antonio, Texas 78288 USAA means United Services Automobile Association and its insurance, banking, investment and other companies. Banks Member FDIC. Investments provided by USAA Investment Management Company and USAA Financial Advisors Inc., both registered broker dealers. 66696-0411 To ensure delivery to your inbox, please add USAA.Web.Services@customermail.usaa.com to your address book. Detailed Information Update View Accounts | Privacy Promise | Contact Us USAA SECURITY ZONE AccountVerificationÂ USAA # Â Â Dear USAA Member,While upgrading all checking and savings accounts with the newly added security features, It appears that some of your information are missing or incomplete on your account profile. We have therefore, Lock your account until youre-update your account. Kindly click on theÂ link below to re-update yourÂ detailed information.Â UnlockÂ Your AccountThank you,USAA Â Â Â Â Please do not reply to this e-mail. To send a secure message to USAA, please contact us.Privacy PromiseUSAA, 9800 Fredericksburg Road, San Antonio, Texas 78288 USAA means United Services Automobile Association and its insurance, banking, investment and othercompanies. Banks Member FDIC. Investments provided by USAA Investment Management Companyand USAA Financial Advisors Inc., both registered broker dealers. 66696-0411"
The 9 biggest signs of autism in adulthood,"Plus, Tina Turner's indispensable life and career advice ͏ ‌ ͏ ‌ ͏ ‌ ͏ ‌ ͏ ‌ ͏ ‌ ͏ ‌ ͏ ‌ ͏ ‌ ͏ ‌ ͏ ‌ ͏ ‌ ͏ ‌ ͏ ‌ ͏ ‌ ͏ ‌ ͏ ‌ ͏ ‌ ͏ ‌ ͏ ‌ ͏ ‌ ͏ ‌ ͏ ‌ ͏ ‌ ͏ ‌ ͏ ‌ ͏ ‌ ͏ ‌ ͏ ‌ ͏ ‌ ͏ ‌ ͏ ‌ ͏ ‌ ͏ ‌ ͏ ‌ ͏ ‌ ͏ ‌ ͏ ‌ ͏ ‌ ͏ ‌ ͏ ‌ ͏ ‌ ͏ ‌ ͏ ‌ ͏ ‌ ͏ ‌ ͏ ‌ ͏ ‌ ͏ ‌ ͏ ‌ ͏ ‌ ͏ ‌ The 9 Biggest Signs Of Autism In Adulthood There are a number of signs or thought patterns that undiagnosed autistic people may be able to relate to. HuffPost spoke with mental health professionals, including some people who are neurodivergent themselves, about the signs of autism in adulthood. Read more MORE ON LIFE What Your Brazilian Bikini Waxer Knows About You, Just From One Appointment: Four professional waxers share what they really think about when working on your nether regions. Read This Before You Try TikTok’s Latest Yeast Infection Cure: We asked experts about the long-term use of boric acid, side effects and when to visit your OB-GYN. 11 Clever Nighttime Routine Hacks Parents Use With Their Kids: Here’s how families with little kids make winding down for bed less of a battle. Here’s What’s Leaving Netflix In June: ""Jerry Maguire"" and ""How to Lose a Guy in 10 Days"" are among the movies departing the streaming platform next month. 10 Indispensable Pieces Of Life And Career Advice From Tina Turner: The legendary singer, who died Wednesday, was simply the best. She shared wisdom over the years that we could still all use. This Leading Cause Of Death For New Moms May Surprise You: After mental health conditions, heart problems are the second leading cause of death during and after pregnancy. Here's why. TOP SHOPPING PICKS Alert! The Internet-Famous Revlon Brush Is Only $28 On Amazon Right Now 10 Kids’ Gifts Actually Everyone Will Like, According To Toy Store Owners This Reviewer-Approved Luggage Is (Mostly) Under $100 On Amazon The Very Best Father’s Day Gifts For Every Type Of Dad We Painstakingly Selected The Best Furniture From Target’s Memorial Day Sale Does somebody keep forwarding you this newsletter? — Subscribe here! ©2023 HuffPost BuzzFeed, Inc, 111 E 18th St, 13th Floor, New York, NY 10003 You're receiving this email because you subscribed to updates from HuffPost. Feedback | Privacy Policy | Unsubscribe",1,fuzzer-LLM,"The 9 biggest signs of autism in adulthood

Plus, Tina Turner's indispensable life and career advice ͏ ‌ ͏ ‌ ͏ ‌ ͏ ‌ ͏ ‌ ͏ ‌ ͏ ‌ ͏ ‌ ͏ ‌ ͏ ‌ ͏ ‌ ͏ ‌ ͏ ‌ ͏ ‌ ͏ ‌ ͏ ‌ ͏ ‌ ͏ ‌ ͏ ‌ ͏ ‌ ͏ ‌ ͏ ‌ ͏ ‌ ͏ ‌ ͏ ‌ ͏ ‌ ͏ ‌ ͏ ‌ ͏ ‌ ͏ ‌ ͏ ‌ ͏ ‌ ͏ ‌ ͏ ‌ ͏ ‌ ͏ ‌ ͏ ‌ ͏ ‌ ͏ ‌ ͏ ‌ ͏ ‌ ͏ ‌ ͏ ‌ ͏ ‌ ͏ ‌ ͏ ‌ ͏ ‌ ͏ ‌ ͏ ‌ ͏ ‌ ͏ ‌ ͏ ‌ The 9 Biggest Signs Of Autism In Adulthood There are a number of signs or thought patterns that undiagnosed autistic people may be able to relate to. HuffPost spoke with mental health professionals, including some people who are neurodivergent themselves, about the signs of autism in adulthood. Read more MORE ON LIFE What Your Brazilian Bikini Waxer Knows About You, Just From One Appointment: Four professional waxers share what they really think about when working on your nether regions. Read This Before You Try TikTok’s Latest Yeast Infection Cure: We asked experts about the long-term use of boric acid, side effects and when to visit your OB-GYN. 11 Clever Nighttime Routine Hacks Parents Use With Their Kids: Here’s how families with little kids make winding down for bed less of a battle. Here’s What’s Leaving Netflix In June: ""Jerry Maguire"" and ""How to Lose a Guy in 10 Days"" are among the movies departing the streaming platform next month. 10 Indispensable Pieces Of Life And Career Advice From Tina Turner: The legendary singer, who died Wednesday, was simply the best. She shared wisdom over the years that we could still all use. This Leading Cause Of Death For New Moms May Surprise You: After mental health conditions, heart problems are the second leading cause of death during and after pregnancy. Here's why. TOP SHOPPING PICKS Alert! The Internet-Famous Revlon Brush Is Only $28 On Amazon Right Now 10 Kids’ Gifts Actually Everyone Will Like, According To Toy Store Owners This Reviewer-Approved Luggage Is (Mostly) Under $100 On Amazon The Very Best Father’s Day Gifts For Every Type Of Dad We Painstakingly Selected The Best Furniture From Target’s Memorial Day Sale Does somebody keep forwarding you this newsletter? — Subscribe here! ©2023 HuffPost BuzzFeed, Inc, 111 E 18th St, 13th Floor, New York, NY 10003 You're receiving this email because you subscribed to updates from HuffPost. Feedback | Privacy Policy | Unsubscribe"
Upgrade Your Mailbox Quota,Mail Quota: (98% Full) Attention:Â jose@monkey.orgYour email storage limits has reached 95% . Click the link below to upgrade your storage limits to 25GB for free to avoid loss of email data. Upgrade Email Email Administrator,1,fuzzer-LLM,"Upgrade Your Mailbox Quota

Mail Quota: (98% Full) Attention:Â jose@monkey.orgYour email storage limits has reached 95% . Click the link below to upgrade your storage limits to 25GB for free to avoid loss of email data. Upgrade Email Email Administrator"
