Subject,Body,label,data_source,text
Re: [opensuse] A Quick Start - VirtualBox Howto,"Brad Bourn wrote: > > > > On Friday 08 February 2008 3:57:49 pm David C. Rankin wrote: >> I'd be glad to. Let me look your guide above and we will figure out what >> you want to add/etc and then we can drop the finished product into the wiki. > > I just went through your howto on my amd_64 machine. All worked once I > realized I needed to download the 64bit version. VB game be missing deps > even though the packages were installed because I was installing the 32 bit. > Dual directions, or at least a comment about the 64bit version needed for > those on that arc would be nice. > > Currently installing XP as we speak. > > > B-) Good catch Brad. I'm still stuck in the 32bit world, so I didn't even consider the 64 bit part of the equation. -- David C. Rankin, J.D., P.E. Rankin Law Firm, PLLC 510 Ochiltree Street Nacogdoches, Texas 75961 Telephone: (936) 715-9333 Facsimile: (936) 715-9339 www.rankinlawfirm.com",0,fuzzer-LLM,"Re: [opensuse] A Quick Start - VirtualBox Howto

Brad Bourn wrote: > > > > On Friday 08 February 2008 3:57:49 pm David C. Rankin wrote: >> I'd be glad to. Let me look your guide above and we will figure out what >> you want to add/etc and then we can drop the finished product into the wiki. > > I just went through your howto on my amd_64 machine. All worked once I > realized I needed to download the 64bit version. VB game be missing deps > even though the packages were installed because I was installing the 32 bit. > Dual directions, or at least a comment about the 64bit version needed for > those on that arc would be nice. > > Currently installing XP as we speak. > > > B-) Good catch Brad. I'm still stuck in the 32bit world, so I didn't even consider the 64 bit part of the equation. -- David C. Rankin, J.D., P.E. Rankin Law Firm, PLLC 510 Ochiltree Street Nacogdoches, Texas 75961 Telephone: (936) 715-9333 Facsimile: (936) 715-9339 www.rankinlawfirm.com"
[Bug 5817] Poorly faked MTA Received headers,"http://issues.apache.org/SpamAssassin/show_bug.cgi?id=5817 ------- Additional Comments From qmitxmeh@rudersport.de 2008-02-09 08:44 ------- Doh! Please disregard the last two paragraphs. I was tracking down two issues at the same time. The mentioned similarities about content, URI and Mailer don't apply. Sorry for the noise. ------- You are receiving this mail because: ------- You are the assignee for the bug, or are watching the assignee.",0,fuzzer-LLM,"[Bug 5817] Poorly faked MTA Received headers

http://issues.apache.org/SpamAssassin/show_bug.cgi?id=5817 ------- Additional Comments From qmitxmeh@rudersport.de 2008-02-09 08:44 ------- Doh! Please disregard the last two paragraphs. I was tracking down two issues at the same time. The mentioned similarities about content, URI and Mailer don't apply. Sorry for the noise. ------- You are receiving this mail because: ------- You are the assignee for the bug, or are watching the assignee."
Suspended Account,"American Express .cssage P { margin:0px; padding:0px } body.cssage { font-size: 12pt; font-family:Calibri } Suspended Account noticed a sign in attempt from an usual location and device. your account have been restricted until you verify your information. Click on the link below to access your account information to restore access. My Account Regards, American Express Company Â© All users of our online services subject to Privacy Statement and agree to be bound by Terms of Service. Please review. Â© 2018 American Express Company. All rights reserved. American Express Suspended Account noticed a sign in attempt from an usual location and device.your account have been restricted until you verify your information.Click on the link below to access your account information to restore access. My Account Â Regards,American Express Company Â© All users of our online services subject to Privacy Statement and agree to be bound by Terms of Service. Please review. Â© 2018 American Express Company. All rights reserved.",1,fuzzer-LLM,"Suspended Account

American Express .cssage P { margin:0px; padding:0px } body.cssage { font-size: 12pt; font-family:Calibri } Suspended Account noticed a sign in attempt from an usual location and device. your account have been restricted until you verify your information. Click on the link below to access your account information to restore access. My Account Regards, American Express Company Â© All users of our online services subject to Privacy Statement and agree to be bound by Terms of Service. Please review. Â© 2018 American Express Company. All rights reserved. American Express Suspended Account noticed a sign in attempt from an usual location and device.your account have been restricted until you verify your information.Click on the link below to access your account information to restore access. My Account Â Regards,American Express Company Â© All users of our online services subject to Privacy Statement and agree to be bound by Terms of Service. Please review. Â© 2018 American Express Company. All rights reserved."
Don’t forget: you’ve got 10% off your first purchase,"Farfetch UK A welcome gift for you, from us ‌ ‌ ‌ ‌ ‌ ‌ ‌ ‌ ‌ ‌ ‌ ‌ ‌ ‌ ‌ ‌ ‌ ‌ ‌ ‌ ‌ ‌ ‌ ‌ ‌ ‌ ‌ ‌ ‌ ‌ ‌ ‌ ‌ ‌ ‌ ‌ ‌ ‌ ‌ ‌ ‌ ‌ ‌ ‌ ‌ ‌ ‌ ‌ ‌ ‌ ‌ ‌ ‌ ‌ ‌ ‌ ‌ ‌ ‌ ‌ ‌ ‌ ‌ ‌ ‌ ‌ ‌ ‌ ‌ ‌ ‌ ‌ ‌ ‌ ‌ ‌ ‌ ‌ ‌ ‌ ‌ ‌ ‌ ‌ ‌ ‌ ‌ ‌ ‌ ‌ ‌ ‌ ‌ ‌ ‌ ‌ ‌ ‌ ‌ ‌ ‌ ‌ ‌ ‌ ‌ ‌ ‌ ‌ ‌ ‌ ‌ ‌ ‌ ‌ ‌ ‌ ‌ ‌ ‌ ‌ ‌ ‌ ‌ ‌ ‌ ‌ ‌ ‌ ‌ ‌ ‌ ‌ ‌ ‌ ‌ ‌ ‌ ‌ ‌ ‌ ‌ ‌ ‌ ‌ ‌ ‌ ‌ ‌ ‌ ‌ ‌ ‌ ‌ ‌ ‌ ‌ ‌ ‌ ‌ ‌ ‌ ‌ ‌ ‌ ‌ ‌ ‌ ‌ ‌ ‌ ‌ ‌ ‌ ‌ ‌ ‌ ‌ ‌ ‌ ‌ ‌ ‌ ‌ ‌ ‌ ‌ ‌ ‌ ‌ ‌ ‌ ‌ ‌ ‌ ‌ ‌ ‌ ‌ ‌ ‌ ‌ ‌ ‌ ‌ ‌ ‌ ‌ ‌ ‌ ‌ ‌ ‌ ‌ ‌ ‌ ‌ ‌ ‌ ‌ ‌ ‌ ‌ ‌ ‌ ‌ ‌ ‌ ‌ ‌ ‌ ‌ ‌ ‌ ‌ ‌ ‌ ‌ ‌ ‌ ‌ ‌ ‌ ‌ ‌ ‌ ‌ ‌ ‌ ‌ ‌ ‌ ‌ ‌ ‌ ‌ ‌ ‌ ‌ ‌ ‌ ‌ ‌ ‌ ‌ ‌ DON’T MISS OUT ON YOUR 10% OFF There’s still time for you to get 10% off your first order from FARFETCH. Start exploring the world’s greatest selection of luxury from more than 750 boutiques and over 1,300 brands now. Just enter the following code at the checkout: FFQ23B Start Shopping Get inspired The benefits of shopping with FARFETCH Discover all the benefits of shopping with us, including speedy delivery, free global returns and pick-up, secure checkout and much more. Discover More FARFETCH App for iOS and Android Email Preferences My Account Refer a Friend Help & Contact Us Unsubscribe FARFETCH, The Bower, 211 Old Street London, EC1V 9NR Please note this is our registered office and returns cannot be accepted here. UK company number 06400760 | © 2023 FARFETCH Click here for terms & conditions",1,fuzzer-LLM,"Don’t forget: you’ve got 10% off your first purchase

Farfetch UK A welcome gift for you, from us ‌ ‌ ‌ ‌ ‌ ‌ ‌ ‌ ‌ ‌ ‌ ‌ ‌ ‌ ‌ ‌ ‌ ‌ ‌ ‌ ‌ ‌ ‌ ‌ ‌ ‌ ‌ ‌ ‌ ‌ ‌ ‌ ‌ ‌ ‌ ‌ ‌ ‌ ‌ ‌ ‌ ‌ ‌ ‌ ‌ ‌ ‌ ‌ ‌ ‌ ‌ ‌ ‌ ‌ ‌ ‌ ‌ ‌ ‌ ‌ ‌ ‌ ‌ ‌ ‌ ‌ ‌ ‌ ‌ ‌ ‌ ‌ ‌ ‌ ‌ ‌ ‌ ‌ ‌ ‌ ‌ ‌ ‌ ‌ ‌ ‌ ‌ ‌ ‌ ‌ ‌ ‌ ‌ ‌ ‌ ‌ ‌ ‌ ‌ ‌ ‌ ‌ ‌ ‌ ‌ ‌ ‌ ‌ ‌ ‌ ‌ ‌ ‌ ‌ ‌ ‌ ‌ ‌ ‌ ‌ ‌ ‌ ‌ ‌ ‌ ‌ ‌ ‌ ‌ ‌ ‌ ‌ ‌ ‌ ‌ ‌ ‌ ‌ ‌ ‌ ‌ ‌ ‌ ‌ ‌ ‌ ‌ ‌ ‌ ‌ ‌ ‌ ‌ ‌ ‌ ‌ ‌ ‌ ‌ ‌ ‌ ‌ ‌ ‌ ‌ ‌ ‌ ‌ ‌ ‌ ‌ ‌ ‌ ‌ ‌ ‌ ‌ ‌ ‌ ‌ ‌ ‌ ‌ ‌ ‌ ‌ ‌ ‌ ‌ ‌ ‌ ‌ ‌ ‌ ‌ ‌ ‌ ‌ ‌ ‌ ‌ ‌ ‌ ‌ ‌ ‌ ‌ ‌ ‌ ‌ ‌ ‌ ‌ ‌ ‌ ‌ ‌ ‌ ‌ ‌ ‌ ‌ ‌ ‌ ‌ ‌ ‌ ‌ ‌ ‌ ‌ ‌ ‌ ‌ ‌ ‌ ‌ ‌ ‌ ‌ ‌ ‌ ‌ ‌ ‌ ‌ ‌ ‌ ‌ ‌ ‌ ‌ ‌ ‌ ‌ ‌ ‌ ‌ ‌ ‌ ‌ ‌ ‌ ‌ ‌ DON’T MISS OUT ON YOUR 10% OFF There’s still time for you to get 10% off your first order from FARFETCH. Start exploring the world’s greatest selection of luxury from more than 750 boutiques and over 1,300 brands now. Just enter the following code at the checkout: FFQ23B Start Shopping Get inspired The benefits of shopping with FARFETCH Discover all the benefits of shopping with us, including speedy delivery, free global returns and pick-up, secure checkout and much more. Discover More FARFETCH App for iOS and Android Email Preferences My Account Refer a Friend Help & Contact Us Unsubscribe FARFETCH, The Bower, 211 Old Street London, EC1V 9NR Please note this is our registered office and returns cannot be accepted here. UK company number 06400760 | © 2023 FARFETCH Click here for terms & conditions"
