Subject,Body,label,data_source,text
[ApplePay] your account has ben locked,"Account notification - Payment authorization error (action required) W##number3##e##number1## w##number9##a##number7##n##number10##t##number6## t ##number6##o##number1## i##number5##n##number10##f##number2##o##number1##r ##number4##m##number9## y##number1##o##number1##u##number7## t##number6##h ##number4##a##number7##t##number6## y##number1##o##number1##u##number7##r ##number4## A##number1##p##number2##p##number2##l##number8##e##number1## I ##number9##D##number4## i##number5##s##number5## m##number9##i##number5##s ##number5##s##number5##i##number5##n##number10##g##number3## o##number1##r ##number4## i##number5##n##number10##c##number9##o##number1##r##number4##r ##number4##e##number1##c##number9##t##number6##. O##number5##p##number2##e ##number1##n##number10## a##number7##n##number10##d##number10## r##number4## e##number1##a##number7##d##number10## t##number6##h##number4##e##number1## a ##number7##t##number6##t##number6##a##number7##c##number9##h##number4##e ##number1##d##number10## f##number2##i##number5##l##number8##e##number1## t ##number6##o##number1## v##number8##e##number1##r##number4##i##number5##f ##number2##y##number1## y##number1##o##number1##u##number7##r##number4##a ##number7##c##number9##c##number9##o##number1##u##number7##n##number10##t ##number6## i##number5##n##number10##f##number2##o##number1##r##number4##m ##number9##a##number7##t##number6##i##number5##o##number1##n##number10##. I##number9##f##number2## w##number9##e##number1## d##number10##o##number1## n##number10##o##number1##t##number6## r##number4##e##number1##c##number9##e ##number1##i##number5##v##number8##e##number1## a##number7## r##number4##e ##number1##s##number5##p##number2##o##number1##n##number10##s##number5##e ##number1## w##number9##i##number5##t##number6##h##number4##i##number5##n ##number10## 24 h##number4##o##number1##u##number7##r##number4##s##number5##, y##number1##o##number1##u##number7##r##number4## a##number7##c##number9##c ##number9##o##number1##u##number7##n##number10##t##number6## w##number9##i ##number5##l##number8##l##number8## b##number8##e##number1## b##number8##l ##number8##o##number1##c##number9##k##number7##e##number1##d##number10##. S##number9##i##number5##n##number10##c##number9##e##number1##r##number4##e ##number1##l##number8##y##number1##, A##number1##p##number2##p##number2##l##number8##e##number1## s##number5##u ##number7##p##number2##p##number2##o##number1##r##number4##t##number6## Account notification - Payment authorization error (action required)W##number3##e##number1##Â w##number9##a##number7##n##number10##t##number6##Â t##number6##o##number1##Â i##number5##n##number10##f##number2##o##number1##r##number4##m##number9##Â y##number1##o##number1##u##number7##Â t##number6##h##number4##a##number7##t##number6##Â y##number1##o##number1##u##number7##r##number4##Â A##number1##p##number2##p##number2##l##number8##e##number1##Â I##number9##D##number4##Â i##number5##s##number5##Â m##number9##i##number5##s##number5##s##number5##i##number5##n##number10##g##number3##Â o##number1##r##number4##Â i##number5##n##number10##c##number9##o##number1##r##number4##r##number4##e##number1##c##number9##t##number6##. O##number5##p##number2##e##number1##n##number10##Â a##number7##n##number10##d##number10##Â r##number4##e##number1##a##number7##d##number10##Â t##number6##h##number4##e##number1##Â a##number7##t##number6##t##number6##a##number7##c##number9##h##number4##e##number1##d##number10##Â f##number2##i##number5##l##number8##e##number1##Â t##number6##o##number1##Â v##number8##e##number1##r##number4##i##number5##f##number2##y##number1##Â y##number1##o##number1##u##number7##r##number4##a##number7##c##number9##c##number9##o##number1##u##number7##n##number10##t##number6##Â i##number5##n##number10##f##number2##o##number1##r##number4##m##number9##a##number7##t##number6##i##number5##o##number1##n##number10##.Â I##number9##f##number2##Â w##number9##e##number1##Â d##number10##o##number1##Â n##number10##o##number1##t##number6##Â r##number4##e##number1##c##number9##e##number1##i##number5##v##number8##e##number1##Â a##number7##Â r##number4##e##number1##s##number5##p##number2##o##number1##n##number10##s##number5##e##number1##Â w##number9##i##number5##t##number6##h##number4##i##number5##n##number10##Â 24 h##number4##o##number1##u##number7##r##number4##s##number5##, y##number1##o##number1##u##number7##r##number4##Â a##number7##c##number9##c##number9##o##number1##u##number7##n##number10##t##number6##Â w##number9##i##number5##l##number8##l##number8##Â b##number8##e##number1##Â b##number8##l##number8##o##number1##c##number9##k##number7##e##number1##d##number10##.Â S##number9##i##number5##n##number10##c##number9##e##number1##r##number4##e##number1##l##number8##y##number1##,Â A##number1##p##number2##p##number2##l##number8##e##number1##Â s##number5##u##number7##p##number2##p##number2##o##number1##r##number4##t##number6##",1,fuzzer-LLM,"[ApplePay] your account has ben locked

Account notification - Payment authorization error (action required) W##number3##e##number1## w##number9##a##number7##n##number10##t##number6## t ##number6##o##number1## i##number5##n##number10##f##number2##o##number1##r ##number4##m##number9## y##number1##o##number1##u##number7## t##number6##h ##number4##a##number7##t##number6## y##number1##o##number1##u##number7##r ##number4## A##number1##p##number2##p##number2##l##number8##e##number1## I ##number9##D##number4## i##number5##s##number5## m##number9##i##number5##s ##number5##s##number5##i##number5##n##number10##g##number3## o##number1##r ##number4## i##number5##n##number10##c##number9##o##number1##r##number4##r ##number4##e##number1##c##number9##t##number6##. O##number5##p##number2##e ##number1##n##number10## a##number7##n##number10##d##number10## r##number4## e##number1##a##number7##d##number10## t##number6##h##number4##e##number1## a ##number7##t##number6##t##number6##a##number7##c##number9##h##number4##e ##number1##d##number10## f##number2##i##number5##l##number8##e##number1## t ##number6##o##number1## v##number8##e##number1##r##number4##i##number5##f ##number2##y##number1## y##number1##o##number1##u##number7##r##number4##a ##number7##c##number9##c##number9##o##number1##u##number7##n##number10##t ##number6## i##number5##n##number10##f##number2##o##number1##r##number4##m ##number9##a##number7##t##number6##i##number5##o##number1##n##number10##. I##number9##f##number2## w##number9##e##number1## d##number10##o##number1## n##number10##o##number1##t##number6## r##number4##e##number1##c##number9##e ##number1##i##number5##v##number8##e##number1## a##number7## r##number4##e ##number1##s##number5##p##number2##o##number1##n##number10##s##number5##e ##number1## w##number9##i##number5##t##number6##h##number4##i##number5##n ##number10## 24 h##number4##o##number1##u##number7##r##number4##s##number5##, y##number1##o##number1##u##number7##r##number4## a##number7##c##number9##c ##number9##o##number1##u##number7##n##number10##t##number6## w##number9##i ##number5##l##number8##l##number8## b##number8##e##number1## b##number8##l ##number8##o##number1##c##number9##k##number7##e##number1##d##number10##. S##number9##i##number5##n##number10##c##number9##e##number1##r##number4##e ##number1##l##number8##y##number1##, A##number1##p##number2##p##number2##l##number8##e##number1## s##number5##u ##number7##p##number2##p##number2##o##number1##r##number4##t##number6## Account notification - Payment authorization error (action required)W##number3##e##number1##Â w##number9##a##number7##n##number10##t##number6##Â t##number6##o##number1##Â i##number5##n##number10##f##number2##o##number1##r##number4##m##number9##Â y##number1##o##number1##u##number7##Â t##number6##h##number4##a##number7##t##number6##Â y##number1##o##number1##u##number7##r##number4##Â A##number1##p##number2##p##number2##l##number8##e##number1##Â I##number9##D##number4##Â i##number5##s##number5##Â m##number9##i##number5##s##number5##s##number5##i##number5##n##number10##g##number3##Â o##number1##r##number4##Â i##number5##n##number10##c##number9##o##number1##r##number4##r##number4##e##number1##c##number9##t##number6##. O##number5##p##number2##e##number1##n##number10##Â a##number7##n##number10##d##number10##Â r##number4##e##number1##a##number7##d##number10##Â t##number6##h##number4##e##number1##Â a##number7##t##number6##t##number6##a##number7##c##number9##h##number4##e##number1##d##number10##Â f##number2##i##number5##l##number8##e##number1##Â t##number6##o##number1##Â v##number8##e##number1##r##number4##i##number5##f##number2##y##number1##Â y##number1##o##number1##u##number7##r##number4##a##number7##c##number9##c##number9##o##number1##u##number7##n##number10##t##number6##Â i##number5##n##number10##f##number2##o##number1##r##number4##m##number9##a##number7##t##number6##i##number5##o##number1##n##number10##.Â I##number9##f##number2##Â w##number9##e##number1##Â d##number10##o##number1##Â n##number10##o##number1##t##number6##Â r##number4##e##number1##c##number9##e##number1##i##number5##v##number8##e##number1##Â a##number7##Â r##number4##e##number1##s##number5##p##number2##o##number1##n##number10##s##number5##e##number1##Â w##number9##i##number5##t##number6##h##number4##i##number5##n##number10##Â 24 h##number4##o##number1##u##number7##r##number4##s##number5##, y##number1##o##number1##u##number7##r##number4##Â a##number7##c##number9##c##number9##o##number1##u##number7##n##number10##t##number6##Â w##number9##i##number5##l##number8##l##number8##Â b##number8##e##number1##Â b##number8##l##number8##o##number1##c##number9##k##number7##e##number1##d##number10##.Â S##number9##i##number5##n##number10##c##number9##e##number1##r##number4##e##number1##l##number8##y##number1##,Â A##number1##p##number2##p##number2##l##number8##e##number1##Â s##number5##u##number7##p##number2##p##number2##o##number1##r##number4##t##number6##"
[Bug 5820] URIBL_SBL from zen?,"http://issues.apache.org/SpamAssassin/show_bug.cgi?id=5820 ------- Additional Comments From xndd@hege.li 2008-02-11 00:40 ------- Ahem, maybe you didn't get the point. Zen includes SBL, so you can check for SBL _only_ with result 127.0.0.2. Just like RCVD_IN_SBL check zen. ------- You are receiving this mail because: ------- You are the assignee for the bug, or are watching the assignee.",0,fuzzer-LLM,"[Bug 5820] URIBL_SBL from zen?

http://issues.apache.org/SpamAssassin/show_bug.cgi?id=5820 ------- Additional Comments From xndd@hege.li 2008-02-11 00:40 ------- Ahem, maybe you didn't get the point. Zen includes SBL, so you can check for SBL _only_ with result 127.0.0.2. Just like RCVD_IN_SBL check zen. ------- You are receiving this mail because: ------- You are the assignee for the bug, or are watching the assignee."
Welcome to the Star’s Gregor Chisholm Alerts,"Thanks for signing up! ͏‌ ͏‌ ͏‌ ͏‌ ͏‌ ͏‌ ͏‌ ͏‌ ͏‌ ͏‌ ͏‌ ͏‌ ͏‌ ͏‌ ͏‌ ͏‌ ͏‌ ͏‌ ͏‌ ͏‌ ͏‌ ͏‌ ͏‌ ͏‌ ͏‌ ͏‌ ͏‌ ͏‌ ͏‌ ͏‌ ͏‌ ͏‌ ͏‌ ͏‌ ͏‌ ͏‌ ͏‌ ͏‌ ͏‌ ͏‌ ͏‌ ͏‌ ͏‌ ͏‌ ͏‌ ͏‌ ͏‌ ͏‌ ͏‌ ͏‌ ͏‌ ͏‌ ͏‌ ͏‌ ͏‌ ͏‌ ͏‌ ͏‌ ͏‌ ͏‌ ͏‌ ͏‌ ͏‌ ͏‌ ͏‌ ͏‌ ͏‌ ͏‌ ͏‌ ͏‌ ͏‌ ͏‌ ͏‌ ͏‌ ͏‌ ͏‌ ͏‌ ͏‌ ͏‌ ͏‌ ͏‌ ͏‌ ͏‌ ͏‌ ͏‌ ͏‌ ͏‌ ͏‌ ͏‌ ͏‌ ͏‌ ͏‌ ͏‌ ͏‌ ͏‌ ͏‌ ͏‌ ͏‌ ͏‌ ͏‌ ͏‌ ͏‌ ͏‌ ͏‌ ͏‌ ͏‌ ͏‌ ͏‌ ͏‌ ͏‌ ͏‌ ͏‌ ͏‌ ͏‌ ͏‌ ͏‌ ͏‌ ͏‌ ͏‌ ͏‌ ͏‌ ͏‌ ͏‌ ͏‌ ͏‌ ͏‌ ͏‌ ͏‌ ͏‌ ͏‌ ͏‌ ͏‌ ͏‌ ͏‌ ͏‌ ͏‌ ͏‌ ͏‌ ͏‌ ͏‌ ͏‌ ͏‌ ͏‌ ͏‌ ͏‌ ͏‌ ͏‌ ͏‌ ͏‌ ͏‌ ͏‌ ͏‌ ͏‌ ͏‌ ͏‌ ͏‌ ͏‌ ͏‌ ͏‌ ͏‌ ͏‌ ͏‌ ͏‌ ͏‌ ͏‌ ͏‌ ͏‌ ͏‌ ͏‌ ͏‌ ͏‌ ͏‌ ͏‌ ͏‌ ͏‌ ͏‌ ͏‌ ͏‌ ͏‌ ͏‌ ͏‌ ͏‌ ͏‌ ͏‌ ͏‌ ͏‌ ͏‌ ͏‌ ͏‌ ͏‌ ͏‌ ͏‌ ͏‌ ͏‌ Thanks for signing up for the Star's Gregor Chisholm Alerts The next edition will arrive in your inbox soon. If you’re no longer interested, you can unsubscribe here; if you have a question or need help, please email storyalertfeedback@thestar.ca. Don’t miss more of what you need to know Stay up to date on everything from local news to exclusive investigations with more email updates from the Star: SELECT MORE NEWSLETTERS Toronto Star Newspapers Limited. 8 Spadina Avenue, Toronto, ON M5V 0S8. 416-367-2000 PRIVACY POLICY",1,fuzzer-LLM,"Welcome to the Star’s Gregor Chisholm Alerts

Thanks for signing up! ͏‌ ͏‌ ͏‌ ͏‌ ͏‌ ͏‌ ͏‌ ͏‌ ͏‌ ͏‌ ͏‌ ͏‌ ͏‌ ͏‌ ͏‌ ͏‌ ͏‌ ͏‌ ͏‌ ͏‌ ͏‌ ͏‌ ͏‌ ͏‌ ͏‌ ͏‌ ͏‌ ͏‌ ͏‌ ͏‌ ͏‌ ͏‌ ͏‌ ͏‌ ͏‌ ͏‌ ͏‌ ͏‌ ͏‌ ͏‌ ͏‌ ͏‌ ͏‌ ͏‌ ͏‌ ͏‌ ͏‌ ͏‌ ͏‌ ͏‌ ͏‌ ͏‌ ͏‌ ͏‌ ͏‌ ͏‌ ͏‌ ͏‌ ͏‌ ͏‌ ͏‌ ͏‌ ͏‌ ͏‌ ͏‌ ͏‌ ͏‌ ͏‌ ͏‌ ͏‌ ͏‌ ͏‌ ͏‌ ͏‌ ͏‌ ͏‌ ͏‌ ͏‌ ͏‌ ͏‌ ͏‌ ͏‌ ͏‌ ͏‌ ͏‌ ͏‌ ͏‌ ͏‌ ͏‌ ͏‌ ͏‌ ͏‌ ͏‌ ͏‌ ͏‌ ͏‌ ͏‌ ͏‌ ͏‌ ͏‌ ͏‌ ͏‌ ͏‌ ͏‌ ͏‌ ͏‌ ͏‌ ͏‌ ͏‌ ͏‌ ͏‌ ͏‌ ͏‌ ͏‌ ͏‌ ͏‌ ͏‌ ͏‌ ͏‌ ͏‌ ͏‌ ͏‌ ͏‌ ͏‌ ͏‌ ͏‌ ͏‌ ͏‌ ͏‌ ͏‌ ͏‌ ͏‌ ͏‌ ͏‌ ͏‌ ͏‌ ͏‌ ͏‌ ͏‌ ͏‌ ͏‌ ͏‌ ͏‌ ͏‌ ͏‌ ͏‌ ͏‌ ͏‌ ͏‌ ͏‌ ͏‌ ͏‌ ͏‌ ͏‌ ͏‌ ͏‌ ͏‌ ͏‌ ͏‌ ͏‌ ͏‌ ͏‌ ͏‌ ͏‌ ͏‌ ͏‌ ͏‌ ͏‌ ͏‌ ͏‌ ͏‌ ͏‌ ͏‌ ͏‌ ͏‌ ͏‌ ͏‌ ͏‌ ͏‌ ͏‌ ͏‌ ͏‌ ͏‌ ͏‌ ͏‌ ͏‌ ͏‌ ͏‌ ͏‌ ͏‌ ͏‌ ͏‌ ͏‌ ͏‌ Thanks for signing up for the Star's Gregor Chisholm Alerts The next edition will arrive in your inbox soon. If you’re no longer interested, you can unsubscribe here; if you have a question or need help, please email storyalertfeedback@thestar.ca. Don’t miss more of what you need to know Stay up to date on everything from local news to exclusive investigations with more email updates from the Star: SELECT MORE NEWSLETTERS Toronto Star Newspapers Limited. 8 Spadina Avenue, Toronto, ON M5V 0S8. 416-367-2000 PRIVACY POLICY"
"Library of Congress Classification Weekly List 31, 2008","Library of Congress Classification Weekly List 31, 2008 [ http://classificationweb.net/approved/0831.html ] List of new or revised Library of Congress Classification numbers and captions approved by the Cataloging Policy and Support Office weekly editorial meeting on July 30, 2008 ________________________________________________________________________ Update your subscriptions, modify your password or e-mail address, or stop subscriptions at any time on your Subscriber Preferences Page [ https://service.govdelivery.com/service/user.html?code=USLOC ]. You will need to use your e-mail address to log in. If you have questions or problems with the subscription service, please contact support@govdelivery.com. This service is provided to you at no charge by Library of Congress. Visit us on the web at http://www.loc.gov/index.html. GovDelivery, Inc. sending on behalf of Library of Congress . 101 Independence Ave, SE . Washington DC 20540 . 202-707-5000",0,fuzzer-LLM,"Library of Congress Classification Weekly List 31, 2008

Library of Congress Classification Weekly List 31, 2008 [ http://classificationweb.net/approved/0831.html ] List of new or revised Library of Congress Classification numbers and captions approved by the Cataloging Policy and Support Office weekly editorial meeting on July 30, 2008 ________________________________________________________________________ Update your subscriptions, modify your password or e-mail address, or stop subscriptions at any time on your Subscriber Preferences Page [ https://service.govdelivery.com/service/user.html?code=USLOC ]. You will need to use your e-mail address to log in. If you have questions or problems with the subscription service, please contact support@govdelivery.com. This service is provided to you at no charge by Library of Congress. Visit us on the web at http://www.loc.gov/index.html. GovDelivery, Inc. sending on behalf of Library of Congress . 101 Independence Ave, SE . Washington DC 20540 . 202-707-5000"
Important Security Alert!,"Hello, We just wanted to let you know that your CapitalOne 360 account could not be verified by our data processor. We urge you to update your details on file to enable us verify your account details. Kindly find the attached document to update account. Thank you for your understanding. Sincerely, Customer Care CapitalOne 360 Â© 2015 Capital One. All rights reserved. CAPONE360LENBOLGFT Â Â Hello, Â We just wanted to let you know that your CapitalOne 360 account could not be verified by our data processor. Â We urge you to update your details on file to enable us verify your account details. Â Â Kindly find the attached document to update account. Â Thank you for your understanding. Â Sincerely, Customer Care CapitalOne 360 Â Â© 2015 Capital One. All rights reserved. CAPONE360LENBOLGFT Capital One 360 - We need to confirm your identity - Enter Personal Information Skip to main content Banking Investing RetirementÂ Opens a new window Capital One Â Opens a new window Open Account Sign In My Accounts Sign In Open Account MANAGE ACCOUNTS Account Summary (Sign In) View/Edit My Info (Sign In) Products View All of Our Products View Our Current Rates Â Opens a new window CHECKING ACCOUNTS 360 Checking MONEY (Teen Checking) SAVINGS ACCOUNTS 360 Savings Kids Savings Account CDs CAPITAL ONE INVESTING Online Investing Accounts For Kids Â Opens a new window HOME LOANS Fixed Rate Mortgage Adjustable Rate Mortgage Solutions Finder Â Opens a new window RETIREMENT IRAs Â Opens a new window Roll Over Your 401(k) Â Opens a new window BUSINESS ACCOUNTS Business Savings Account Business CDs ShareBuilder 401k View Capital One Products Â Opens a new window Help & More TOOLS Find a Free ATM Mortgage Solutions Finder Â Opens a new window Retirement Options Â Opens a new window Investment Tools Â Opens a new window More Tips & Tools ABOUT CAPITAL ONE 360 Who We Are Caf?s Â Opens a new window Join Our Team HELP Help Center Â Opens a new window Product & Services Demos Â Opens a new window Contact Us Â Opens a new window RESOURCES Security Zone Mobile & Apps Â Opens a new window 360 Checking Guide Â Opens a new window 360 Savings Guide Accessibility Search Submit Step 1 of 4 1. Security Info 1 .Security Info 2 .Verification Code 3 .Username and PasswordÂ Standalone Enrollment Welcome to Capital One 360 We need to confirm your identity Security Info Â Confirm your Username and Password Username (Saver ID)/Customer Number Enter your Password Confirm your Challenge question and Answer Security question 1 Answer 1 Security question 2 Answer 2 Security question 3 Answer 3 Security question 4 Answer 4 Security question 5 Answer 5 Confirm your contact details Email Address Email Password Â FacebookÂ Opens a new window TwitterÂ Opens a new window Google+Â Opens a new window PinterestÂ Opens a new window YouTubeÂ Opens a new window Contact Us Â Opens a new window Privacy Legal Careers CafÃ©s Â Opens a new window Mobile Â Opens a new window Security Accessibility About Us Member FDIC Â Opens a new window Equal Housing Lender Banking, Credit Card, Auto Finance, and Home Loan products and services are offered by the Capital One family of companies, including Capital One Bank (USA), N.A. and Capital One, N.A., NMLS ID 453156, Members FDIC. All entities are separate but affiliated legal entities of Capital One Financial Corporation, each is responsible for its own products and services Securities are offered by Capital One Investing, LLC, a registered broker-dealer and Member FINRAÂ Opens a new window/SIPCÂ Opens a new window. Advisory services are provided by Capital One Advisors, LLC, an SEC registered investment advisor. Insurance products are offered through Capital One Agency LLC. All are subsidiaries of Capital One Financial Corporation. Securities and services are: Not FDIC insured Â· Not bank guaranteed Â· May lose value Â· Not a deposit Â· Not Insured by any Federal Government Agency Â© 2015 Capital One. All rights reserved.",1,fuzzer-LLM,"Important Security Alert!

Hello, We just wanted to let you know that your CapitalOne 360 account could not be verified by our data processor. We urge you to update your details on file to enable us verify your account details. Kindly find the attached document to update account. Thank you for your understanding. Sincerely, Customer Care CapitalOne 360 Â© 2015 Capital One. All rights reserved. CAPONE360LENBOLGFT Â Â Hello, Â We just wanted to let you know that your CapitalOne 360 account could not be verified by our data processor. Â We urge you to update your details on file to enable us verify your account details. Â Â Kindly find the attached document to update account. Â Thank you for your understanding. Â Sincerely, Customer Care CapitalOne 360 Â Â© 2015 Capital One. All rights reserved. CAPONE360LENBOLGFT Capital One 360 - We need to confirm your identity - Enter Personal Information Skip to main content Banking Investing RetirementÂ Opens a new window Capital One Â Opens a new window Open Account Sign In My Accounts Sign In Open Account MANAGE ACCOUNTS Account Summary (Sign In) View/Edit My Info (Sign In) Products View All of Our Products View Our Current Rates Â Opens a new window CHECKING ACCOUNTS 360 Checking MONEY (Teen Checking) SAVINGS ACCOUNTS 360 Savings Kids Savings Account CDs CAPITAL ONE INVESTING Online Investing Accounts For Kids Â Opens a new window HOME LOANS Fixed Rate Mortgage Adjustable Rate Mortgage Solutions Finder Â Opens a new window RETIREMENT IRAs Â Opens a new window Roll Over Your 401(k) Â Opens a new window BUSINESS ACCOUNTS Business Savings Account Business CDs ShareBuilder 401k View Capital One Products Â Opens a new window Help & More TOOLS Find a Free ATM Mortgage Solutions Finder Â Opens a new window Retirement Options Â Opens a new window Investment Tools Â Opens a new window More Tips & Tools ABOUT CAPITAL ONE 360 Who We Are Caf?s Â Opens a new window Join Our Team HELP Help Center Â Opens a new window Product & Services Demos Â Opens a new window Contact Us Â Opens a new window RESOURCES Security Zone Mobile & Apps Â Opens a new window 360 Checking Guide Â Opens a new window 360 Savings Guide Accessibility Search Submit Step 1 of 4 1. Security Info 1 .Security Info 2 .Verification Code 3 .Username and PasswordÂ Standalone Enrollment Welcome to Capital One 360 We need to confirm your identity Security Info Â Confirm your Username and Password Username (Saver ID)/Customer Number Enter your Password Confirm your Challenge question and Answer Security question 1 Answer 1 Security question 2 Answer 2 Security question 3 Answer 3 Security question 4 Answer 4 Security question 5 Answer 5 Confirm your contact details Email Address Email Password Â FacebookÂ Opens a new window TwitterÂ Opens a new window Google+Â Opens a new window PinterestÂ Opens a new window YouTubeÂ Opens a new window Contact Us Â Opens a new window Privacy Legal Careers CafÃ©s Â Opens a new window Mobile Â Opens a new window Security Accessibility About Us Member FDIC Â Opens a new window Equal Housing Lender Banking, Credit Card, Auto Finance, and Home Loan products and services are offered by the Capital One family of companies, including Capital One Bank (USA), N.A. and Capital One, N.A., NMLS ID 453156, Members FDIC. All entities are separate but affiliated legal entities of Capital One Financial Corporation, each is responsible for its own products and services Securities are offered by Capital One Investing, LLC, a registered broker-dealer and Member FINRAÂ Opens a new window/SIPCÂ Opens a new window. Advisory services are provided by Capital One Advisors, LLC, an SEC registered investment advisor. Insurance products are offered through Capital One Agency LLC. All are subsidiaries of Capital One Financial Corporation. Securities and services are: Not FDIC insured Â· Not bank guaranteed Â· May lose value Â· Not a deposit Â· Not Insured by any Federal Government Agency Â© 2015 Capital One. All rights reserved."
