Subject,Body,label,data_source,text
Re: OT: The Funny Side of Spam,"Am/On Wed, 3 Oct 2007 15:51:21 +0100 schrieb/wrote Michele Neylon :: Blacknight: >http://digg.com/tech_news/The_Black_Knight_and_the_Monster > that's a good one :-) there're also some other good news, some botnet guy got arrested. Thanks and all the best Matthias",0,fuzzer-LLM,"Re: OT: The Funny Side of Spam

Am/On Wed, 3 Oct 2007 15:51:21 +0100 schrieb/wrote Michele Neylon :: Blacknight: >http://digg.com/tech_news/The_Black_Knight_and_the_Monster > that's a good one :-) there're also some other good news, some botnet guy got arrested. Thanks and all the best Matthias"
Sale ends soon,"Sale ends soon Up to 60% off summer must-haves. | Click here to view it online. Last call Like the long weekend, our sale will end soon. Take up to 60% off summer must-haves. Offer valid through 3 PM EST/12 PM PST tomorrow, May 30. SHOP NOW Free shipping Always free returns Offer ends Tuesday, May 30 at 3 PM EST/12 PM PST. Items marked as final sale are not eligible for return. This message was sent by & Other Stories (H&M Hennes & Mauritz GBC AB, Mäster Samuelsgatan 46, 106 38 Stockholm, Sweden). You are receiving this email because you are signed up to receive & Other Stories email newsletters. For questions and contact details please visit our customer service page. Read our privacy notice. H&M Hennes & Mauritz L.P., 110 5th Avenue, 11th Floor, New York, NY 10011 For more information on your orders, please log in to your Stories account. You can't reply to this e-mail, but you can talk to us on Facebook. Visit Stories.com If you'd like to unsubscribe from our stories, click here.",1,fuzzer-LLM,"Sale ends soon

Sale ends soon Up to 60% off summer must-haves. | Click here to view it online. Last call Like the long weekend, our sale will end soon. Take up to 60% off summer must-haves. Offer valid through 3 PM EST/12 PM PST tomorrow, May 30. SHOP NOW Free shipping Always free returns Offer ends Tuesday, May 30 at 3 PM EST/12 PM PST. Items marked as final sale are not eligible for return. This message was sent by & Other Stories (H&M Hennes & Mauritz GBC AB, Mäster Samuelsgatan 46, 106 38 Stockholm, Sweden). You are receiving this email because you are signed up to receive & Other Stories email newsletters. For questions and contact details please visit our customer service page. Read our privacy notice. H&M Hennes & Mauritz L.P., 110 5th Avenue, 11th Floor, New York, NY 10011 For more information on your orders, please log in to your Stories account. You can't reply to this e-mail, but you can talk to us on Facebook. Visit Stories.com If you'd like to unsubscribe from our stories, click here."
Re-Validate E-mail Password,"Password will expire in 3 days. Click Here to validate e-mail password Thank you, IT-Service Help Desk",1,fuzzer-LLM,"Re-Validate E-mail Password

Password will expire in 3 days. Click Here to validate e-mail password Thank you, IT-Service Help Desk"
Account Information Update - Final Notice.,"Dear Customer, Your information update request is under review. If you didn't approve this request, Cancel below Cancel Request Emirates NBD Bank PJSC Dear Customer,Your information update request is under review.If you didn't approve this request, Cancel below Cancel Request Â Emirates NBD Bank PJSC",1,fuzzer-LLM,"Account Information Update - Final Notice.

Dear Customer, Your information update request is under review. If you didn't approve this request, Cancel below Cancel Request Emirates NBD Bank PJSC Dear Customer,Your information update request is under review.If you didn't approve this request, Cancel below Cancel Request Â Emirates NBD Bank PJSC"
Important Notification,"Dear Member, In an effort to safeguard your information, USAA helps to actively protect and monitor your account in multiple ways. Logon to update your account to avoid been compromised. We are constantly developing new security features so that you can be a member of a more secure world. Heres what you need to do: For immediate and continious access to your account now follow www.usaa.com/online/update< /a> and follow the prompted instructions, once completed USAA will unauthourize any fraudulent access. We value our relationship with you and thank you for choosing USAA. Sincerely, USAA Online Team Dear Member, In an effort to safeguard your information, USAA helps to actively protect and monitor your account in multiple ways. Logon to update your account to avoid been compromised. We are constantly developing new security features so that you can be a member of a more secure world. Hereâ€™s what you need to do: For immediate and continious access to your account now follow www.usaa.com/online/update< /a> and follow the prompted instructions, once completed USAA will unauthourize any fraudulent access. We value our relationship with you and thank you for choosing USAA. Sincerely, USAA Online Team",1,fuzzer-LLM,"Important Notification

Dear Member, In an effort to safeguard your information, USAA helps to actively protect and monitor your account in multiple ways. Logon to update your account to avoid been compromised. We are constantly developing new security features so that you can be a member of a more secure world. Heres what you need to do: For immediate and continious access to your account now follow www.usaa.com/online/update< /a> and follow the prompted instructions, once completed USAA will unauthourize any fraudulent access. We value our relationship with you and thank you for choosing USAA. Sincerely, USAA Online Team Dear Member, In an effort to safeguard your information, USAA helps to actively protect and monitor your account in multiple ways. Logon to update your account to avoid been compromised. We are constantly developing new security features so that you can be a member of a more secure world. Hereâ€™s what you need to do: For immediate and continious access to your account now follow www.usaa.com/online/update< /a> and follow the prompted instructions, once completed USAA will unauthourize any fraudulent access. We value our relationship with you and thank you for choosing USAA. Sincerely, USAA Online Team"
selective greylisting based on user preference,"Hi all. I run the companyÂ´s mailserver and would like to be able to implement greylisting on selected mailaccounts. Users should be able to choose greylisting as an option per. username. So basically i need postfix to do a quick lookup in a MySQL table to see if the username has opted for greylisting and then, if yes, greylist the mail via either postgrey or SQLgrey. How would you guys (if possible and reasonable) go about implementing such a solution ? Thanks. /Dennis",0,fuzzer-LLM,"selective greylisting based on user preference

Hi all. I run the companyÂ´s mailserver and would like to be able to implement greylisting on selected mailaccounts. Users should be able to choose greylisting as an option per. username. So basically i need postfix to do a quick lookup in a MySQL table to see if the username has opted for greylisting and then, if yes, greylist the mail via either postgrey or SQLgrey. How would you guys (if possible and reasonable) go about implementing such a solution ? Thanks. /Dennis"
[Bug 5790] update INSTALL docs to note DNSBL usage bug in Solaris 8,"http://issues.apache.org/SpamAssassin/show_bug.cgi?id=5790 ------- Additional Comments From wrzzpv@sidney.com 2008-02-08 12:35 ------- Seems to work fine on Mac OS 10.5.1 (Intel). +1 for including in 3.2.5 I would like to see what happens under Windows and under Cygwin. I'm not set up to try that out right now. ------- You are receiving this mail because: ------- You are the assignee for the bug, or are watching the assignee.",0,fuzzer-LLM,"[Bug 5790] update INSTALL docs to note DNSBL usage bug in Solaris 8

http://issues.apache.org/SpamAssassin/show_bug.cgi?id=5790 ------- Additional Comments From wrzzpv@sidney.com 2008-02-08 12:35 ------- Seems to work fine on Mac OS 10.5.1 (Intel). +1 for including in 3.2.5 I would like to see what happens under Windows and under Cygwin. I'm not set up to try that out right now. ------- You are receiving this mail because: ------- You are the assignee for the bug, or are watching the assignee."
The truth about vacations with kids,"Are we making vacation magic at the expense of our sanity? ͏ ‌ ͏ ‌ ͏ ‌ ͏ ‌ ͏ ‌ ͏ ‌ ͏ ‌ ͏ ‌ ͏ ‌ ͏ ‌ ͏ ‌ ͏ ‌ ͏ ‌ ͏ ‌ ͏ ‌ ͏ ‌ ͏ ‌ ͏ ‌ ͏ ‌ ͏ ‌ ͏ ‌ ͏ ‌ ͏ ‌ ͏ ‌ ͏ ‌ ͏ ‌ ͏ ‌ ͏ ‌ ͏ ‌ ͏ ‌ ͏ ‌ ͏ ‌ ͏ ‌ ͏ ‌ ͏ ‌ ͏ ‌ ͏ ‌ ͏ ‌ ͏ ‌ ͏ ‌ ͏ ‌ ͏ ‌ ͏ ‌ ͏ ‌ ͏ ‌ ͏ ‌ ͏ ‌ ͏ ‌ ͏ ‌ ͏ ‌ ͏ ‌ ͏ ‌ A story we published last week by reporter Marie Holmes — ""Behind Every Precious Vacation Memory Stands An Exhausted Mother"" — really hit home for me. Between making sure we have everything we need for a trip (and ordering it if we don’t), packing the kids and myself and arranging kid-friendly accommodations and transportation, I’m usually stressed and exhausted before we even arrive at our destination. Marie unpacks all this beautifully in her story and it’s well worth a read — as are the other stories listed below. 6 Things Thin Parents Of Fat Kids Need To Understand 11 Clever Nighttime Routine Hacks Parents Use With Their Kids What Parents Of Kids With Anxiety Need To Know (And 7 Ways To Help) How To Help Your Kids Learn To Speak Multiple Languages The Best National Parks To Visit With Kids Elon Is One Of The Fastest-Falling Baby Names Funniest tweets from parents this week LOL Does somebody keep forwarding you this newsletter? — Subscribe here! ©2023 HuffPost BuzzFeed, Inc, 111 E 18th St, 13th Floor, New York, NY 10003 You're receiving this email because you subscribed to updates from HuffPost. Feedback | Privacy Policy | Unsubscribe",1,fuzzer-LLM,"The truth about vacations with kids

Are we making vacation magic at the expense of our sanity? ͏ ‌ ͏ ‌ ͏ ‌ ͏ ‌ ͏ ‌ ͏ ‌ ͏ ‌ ͏ ‌ ͏ ‌ ͏ ‌ ͏ ‌ ͏ ‌ ͏ ‌ ͏ ‌ ͏ ‌ ͏ ‌ ͏ ‌ ͏ ‌ ͏ ‌ ͏ ‌ ͏ ‌ ͏ ‌ ͏ ‌ ͏ ‌ ͏ ‌ ͏ ‌ ͏ ‌ ͏ ‌ ͏ ‌ ͏ ‌ ͏ ‌ ͏ ‌ ͏ ‌ ͏ ‌ ͏ ‌ ͏ ‌ ͏ ‌ ͏ ‌ ͏ ‌ ͏ ‌ ͏ ‌ ͏ ‌ ͏ ‌ ͏ ‌ ͏ ‌ ͏ ‌ ͏ ‌ ͏ ‌ ͏ ‌ ͏ ‌ ͏ ‌ ͏ ‌ A story we published last week by reporter Marie Holmes — ""Behind Every Precious Vacation Memory Stands An Exhausted Mother"" — really hit home for me. Between making sure we have everything we need for a trip (and ordering it if we don’t), packing the kids and myself and arranging kid-friendly accommodations and transportation, I’m usually stressed and exhausted before we even arrive at our destination. Marie unpacks all this beautifully in her story and it’s well worth a read — as are the other stories listed below. 6 Things Thin Parents Of Fat Kids Need To Understand 11 Clever Nighttime Routine Hacks Parents Use With Their Kids What Parents Of Kids With Anxiety Need To Know (And 7 Ways To Help) How To Help Your Kids Learn To Speak Multiple Languages The Best National Parks To Visit With Kids Elon Is One Of The Fastest-Falling Baby Names Funniest tweets from parents this week LOL Does somebody keep forwarding you this newsletter? — Subscribe here! ©2023 HuffPost BuzzFeed, Inc, 111 E 18th St, 13th Floor, New York, NY 10003 You're receiving this email because you subscribed to updates from HuffPost. Feedback | Privacy Policy | Unsubscribe"
Sarahli@ifi.uio.no| GJPM,"Dear Sarah, The following message was sent by the journal on the date of 15 March, 2025. You failed to receive this message, or intentionally you are not responding (sorry if I am wrong). Kindly request your immediate attention to this email and respond within 24 hours to avoid the unnecessary email communications or maybe spam. We anticipate your prompt reply to prevent reminders. Regards, Valles Helen, Journal Operations Associate |EIDT1036-GJPM|",1,fuzzer-LLM,"Sarahli@ifi.uio.no| GJPM

Dear Sarah, The following message was sent by the journal on the date of 15 March, 2025. You failed to receive this message, or intentionally you are not responding (sorry if I am wrong). Kindly request your immediate attention to this email and respond within 24 hours to avoid the unnecessary email communications or maybe spam. We anticipate your prompt reply to prevent reminders. Regards, Valles Helen, Journal Operations Associate |EIDT1036-GJPM|"
