Subject,Body,label,data_source,text
Companies are preparing workers to be laid off — by their own AI,"First Up Plus, one man’s long journey to carbon redemption ‌ ‌ ‌ ‌ ‌ ‌ ‌ ‌ ‌ ‌ ‌ ‌ ‌ ‌ ‌ ‌ ‌ ‌ ‌ ‌ ‌ ‌ ‌ ‌ ‌ ‌ ‌ ‌ ‌ ‌ ‌ ‌ ‌ ‌ ‌ ‌ ‌ ‌ ‌ ‌ ‌ ‌ ‌ ‌ ‌ ‌ ‌ ‌ ‌ ‌ ‌ ‌ ‌ ‌ ‌ ‌ ‌ ‌ ‌ ‌ ‌ ‌ ‌ ‌ ‌ ‌ ‌ ‌ ‌ ‌ ‌ ‌ ‌ ‌ ‌ ‌ ‌ ‌ ‌ ‌ ‌ ‌ ‌ ‌ ‌ ‌ ‌ ‌ ‌ ‌ ‌ ‌ ‌ ‌ ‌ ‌ ‌ ‌ ‌ ‌ ‌ ‌ ‌ ‌ ‌ ‌ ‌ ‌ ‌ ‌ ‌ ‌ ‌ ‌ ‌ ‌ ‌ ‌ ‌ ‌ ‌ ‌ ‌ ‌ ‌ ‌ ‌ ‌ ‌ ‌ ‌ ‌ ‌ ‌ ‌ ‌ ‌ ‌ ‌ ‌ ‌ ‌ ‌ First Up By Ashley Okwuosa Good morning. A man was rushed to hospital on Friday evening after being stabbed at TTC’s Kennedy station. Here’s the latest. MUST READS Steve Russell/Toronto Star Health The death of an Ontario ER: what a cottage-country closure means for the future of emergency care 27,000 signatures, 1,200 lawn signs, and two massive highway signs later, Minden residents gathered to mourn the emergency department they frantically tried to save. For almost 30 years, the ED served as an anchor for the community; now, residents fear the worst. As local health boards and the provincial government struggle to fill shifts in smaller hospitals hit hard by post-COVID attrition, Kenyon Wallace reports on why some public-health activists believe Minden is a portent of things to come across the province. Ramon Ferriera illustration THE FUTURE OF WORK IBM says it will replace 8,000 jobs with AI — but it has a solution for displaced workers IBM’s announcement of Watsonx, a new artificial intelligence platform designed to make businesses more efficient, comes after CEO Arvind Krishna estimated AI technologies would lead to roughly 8,000 IBM job cuts over the next five years. However, IBM says its worldwide re-skilling program, SkillsBuild, will help prepare 30 million people across five continents — who work at IBM and elsewhere — for the rapidly evolving job economy before the era of AI fully ushers in. Alex Cyr reports on IBM’s plan to re-skill workers and why experts aren’t sure how well it will work. Richard Lautens/Toronto Star The race to city hall Inside the Toronto election campaign: Buzzkill at the Disco!, debate bingo and other things you might have missed this week Whether on signs, posters or even in person at community events, the smiling faces and bold-type names of mayoral candidates will be hard to escape leading up to the June 26 election. While there was a brief pause in campaigning on Thursday afternoon due to a security threat, this week on the campaign trail has been busy. From Josh Matlow’s surprise appearance at a concert in the Beaches to endorsements from politicians past and present, Alyshah Hasham breaks down everything you might have missed this week. Walk it Back Climate The Guilt Trip: A Canadian man’s long road to carbon redemption Starting in January, Craig Cohon, a former executive for Coca-Cola and Cirque du Soleil, travelled on foot from Trafalgar Square to Istanbul to draw attention to clean carbon removal, trekking 4,200 kilometres across Europe. As he approaches his 60th birthday, World Environment Day and the end of his journey, Cohon calls his impending arrival in Istanbul on Monday the “end of the beginning.” Here’s what he told Jeremy Nuttall about his “gruelling” journey and his plan to bring lesser known solutions into the public discourse to combat climate change. Andrew Francis Wallace/Toronto Star GTA Here’s everything you need to know about Toronto’s best beaches Sidewalks are getting more crowded, ice cream is melting faster and people are smiling bigger — it’s officially summer. The heat’s return also marks the beginning of lifeguard supervision on Saturday at most Toronto beaches, continuing daily from 10:30 a.m. to 7:30 p.m. Whether you’re looking to swim, kitesurf, or enjoy the fantastic views, the city’s myriad beaches offer something for everyone. First Up’s Manuela Vega breaks down the best beaches near downtown Toronto, from washrooms and water sports to eats and atmosphere. POV David Olive: Think your flight is too expensive? Get used to it — here’s why today’s high prices could eventually seem like a bargain. Emma Teitel: I once feared COVID. Now the potentially deadly contagion to avoid is the moral panic about queer people. Here’s how it forced us to cancel a Florida family vacation. Donovan Vincent: Without context, this photo published in the Star depicting anti-semitic imagery is dangerous. Heather Mallick: Olivia Chow has the courage to admit Toronto needs to hike taxes. Amir Barnea: Canada is cracking down on taxes — so why does our national pension plan pay less than two per cent? Ricardo Tranjan: We need to take sides in the tenants’ rent strike. Support THIS Karon Liu/Toronto Star During a summer camping trip in 2016, Star food reporter Karon Liu learned to embrace outdoor dining. More importantly, Karon learned that disconnecting digitally is one important way to savor Ontario’s notoriously short summers. Here’s how the Star’s Fresh Air Fund supports students in developing lasting friendships and building memories that will outlive an internet trend. Thanks for reading. You can reach the First Up team at firstup@thestar.ca, and I will see you back here tomorrow. If you're not enjoying these emails, please tell us how we can make them better by emailing newsletterfeedback@thestar.ca. Or, if you'd prefer, you can unsubscribe from this newsletter by clicking the first link below. Unsubscribe From This Newsletter Sign Up for More Newsletters and Email Alerts View in Browser Toronto Star Newspapers Limited. 8 Spadina Avenue, 10th Floor, Toronto, ON M5V 0S8. 416-367-2000 PRIVACY POLICY",1,fuzzer-LLM,"Companies are preparing workers to be laid off — by their own AI

First Up Plus, one man’s long journey to carbon redemption ‌ ‌ ‌ ‌ ‌ ‌ ‌ ‌ ‌ ‌ ‌ ‌ ‌ ‌ ‌ ‌ ‌ ‌ ‌ ‌ ‌ ‌ ‌ ‌ ‌ ‌ ‌ ‌ ‌ ‌ ‌ ‌ ‌ ‌ ‌ ‌ ‌ ‌ ‌ ‌ ‌ ‌ ‌ ‌ ‌ ‌ ‌ ‌ ‌ ‌ ‌ ‌ ‌ ‌ ‌ ‌ ‌ ‌ ‌ ‌ ‌ ‌ ‌ ‌ ‌ ‌ ‌ ‌ ‌ ‌ ‌ ‌ ‌ ‌ ‌ ‌ ‌ ‌ ‌ ‌ ‌ ‌ ‌ ‌ ‌ ‌ ‌ ‌ ‌ ‌ ‌ ‌ ‌ ‌ ‌ ‌ ‌ ‌ ‌ ‌ ‌ ‌ ‌ ‌ ‌ ‌ ‌ ‌ ‌ ‌ ‌ ‌ ‌ ‌ ‌ ‌ ‌ ‌ ‌ ‌ ‌ ‌ ‌ ‌ ‌ ‌ ‌ ‌ ‌ ‌ ‌ ‌ ‌ ‌ ‌ ‌ ‌ ‌ ‌ ‌ ‌ ‌ ‌ First Up By Ashley Okwuosa Good morning. A man was rushed to hospital on Friday evening after being stabbed at TTC’s Kennedy station. Here’s the latest. MUST READS Steve Russell/Toronto Star Health The death of an Ontario ER: what a cottage-country closure means for the future of emergency care 27,000 signatures, 1,200 lawn signs, and two massive highway signs later, Minden residents gathered to mourn the emergency department they frantically tried to save. For almost 30 years, the ED served as an anchor for the community; now, residents fear the worst. As local health boards and the provincial government struggle to fill shifts in smaller hospitals hit hard by post-COVID attrition, Kenyon Wallace reports on why some public-health activists believe Minden is a portent of things to come across the province. Ramon Ferriera illustration THE FUTURE OF WORK IBM says it will replace 8,000 jobs with AI — but it has a solution for displaced workers IBM’s announcement of Watsonx, a new artificial intelligence platform designed to make businesses more efficient, comes after CEO Arvind Krishna estimated AI technologies would lead to roughly 8,000 IBM job cuts over the next five years. However, IBM says its worldwide re-skilling program, SkillsBuild, will help prepare 30 million people across five continents — who work at IBM and elsewhere — for the rapidly evolving job economy before the era of AI fully ushers in. Alex Cyr reports on IBM’s plan to re-skill workers and why experts aren’t sure how well it will work. Richard Lautens/Toronto Star The race to city hall Inside the Toronto election campaign: Buzzkill at the Disco!, debate bingo and other things you might have missed this week Whether on signs, posters or even in person at community events, the smiling faces and bold-type names of mayoral candidates will be hard to escape leading up to the June 26 election. While there was a brief pause in campaigning on Thursday afternoon due to a security threat, this week on the campaign trail has been busy. From Josh Matlow’s surprise appearance at a concert in the Beaches to endorsements from politicians past and present, Alyshah Hasham breaks down everything you might have missed this week. Walk it Back Climate The Guilt Trip: A Canadian man’s long road to carbon redemption Starting in January, Craig Cohon, a former executive for Coca-Cola and Cirque du Soleil, travelled on foot from Trafalgar Square to Istanbul to draw attention to clean carbon removal, trekking 4,200 kilometres across Europe. As he approaches his 60th birthday, World Environment Day and the end of his journey, Cohon calls his impending arrival in Istanbul on Monday the “end of the beginning.” Here’s what he told Jeremy Nuttall about his “gruelling” journey and his plan to bring lesser known solutions into the public discourse to combat climate change. Andrew Francis Wallace/Toronto Star GTA Here’s everything you need to know about Toronto’s best beaches Sidewalks are getting more crowded, ice cream is melting faster and people are smiling bigger — it’s officially summer. The heat’s return also marks the beginning of lifeguard supervision on Saturday at most Toronto beaches, continuing daily from 10:30 a.m. to 7:30 p.m. Whether you’re looking to swim, kitesurf, or enjoy the fantastic views, the city’s myriad beaches offer something for everyone. First Up’s Manuela Vega breaks down the best beaches near downtown Toronto, from washrooms and water sports to eats and atmosphere. POV David Olive: Think your flight is too expensive? Get used to it — here’s why today’s high prices could eventually seem like a bargain. Emma Teitel: I once feared COVID. Now the potentially deadly contagion to avoid is the moral panic about queer people. Here’s how it forced us to cancel a Florida family vacation. Donovan Vincent: Without context, this photo published in the Star depicting anti-semitic imagery is dangerous. Heather Mallick: Olivia Chow has the courage to admit Toronto needs to hike taxes. Amir Barnea: Canada is cracking down on taxes — so why does our national pension plan pay less than two per cent? Ricardo Tranjan: We need to take sides in the tenants’ rent strike. Support THIS Karon Liu/Toronto Star During a summer camping trip in 2016, Star food reporter Karon Liu learned to embrace outdoor dining. More importantly, Karon learned that disconnecting digitally is one important way to savor Ontario’s notoriously short summers. Here’s how the Star’s Fresh Air Fund supports students in developing lasting friendships and building memories that will outlive an internet trend. Thanks for reading. You can reach the First Up team at firstup@thestar.ca, and I will see you back here tomorrow. If you're not enjoying these emails, please tell us how we can make them better by emailing newsletterfeedback@thestar.ca. Or, if you'd prefer, you can unsubscribe from this newsletter by clicking the first link below. Unsubscribe From This Newsletter Sign Up for More Newsletters and Email Alerts View in Browser Toronto Star Newspapers Limited. 8 Spadina Avenue, 10th Floor, Toronto, ON M5V 0S8. 416-367-2000 PRIVACY POLICY"
Up to 60% Off!,"If you have trouble viewing this message click here or copy and paste this link into your web browser. http://www.serengeticatalog.com/email/SSALE020408.asp?srccode=SE5752 Serengeti Save up to 60% - Early Spring Savings! You'll find these and many more items just reduced in our special sale section for our internet customers only! SHOP NOW! Floral silhouette sweatshirt - Was: $39.95, Now: $19.99 Victorian Scroll Pashmina - Was: $24.95, Now: $9.99 Butterfly Fleece Pink Top - Was: $39.95, Now: $17.99 Woven clog - Was: $69.95, Now: $39.99 Crystal Flowers Anklet - Was: $19.95, Now: $7.99 African Palm Print Skirt - Was: $44.95, Now: $19.99 http://www.serengeticatalog.com/search.asp?skw=SSALE020408&srccode=SE5752&gen1=Early+Spring+Savings :: Limited Quantities. Shop while supply lasts. :: _______________________________________________________ * If you do not wish to receive these promotional messages from us, please click this link: http://serengeticatalog.net/Serengeti/default.asp?action=u&ljqoa=jne@gvc.ceas-challenge.cc&mi=555291 Allow 7 to 10 business days to process your removal requests * For Customer Service issues please e-mail xxjl@serengeticatalog.com or call Toll Free: 800-426-2852. _______________________________________________________ Serengeti | 222 Mill Rd | Chelmsford, MA 01824-0949 Powered by Informz http://www.informz.com",0,fuzzer-LLM,"Up to 60% Off!

If you have trouble viewing this message click here or copy and paste this link into your web browser. http://www.serengeticatalog.com/email/SSALE020408.asp?srccode=SE5752 Serengeti Save up to 60% - Early Spring Savings! You'll find these and many more items just reduced in our special sale section for our internet customers only! SHOP NOW! Floral silhouette sweatshirt - Was: $39.95, Now: $19.99 Victorian Scroll Pashmina - Was: $24.95, Now: $9.99 Butterfly Fleece Pink Top - Was: $39.95, Now: $17.99 Woven clog - Was: $69.95, Now: $39.99 Crystal Flowers Anklet - Was: $19.95, Now: $7.99 African Palm Print Skirt - Was: $44.95, Now: $19.99 http://www.serengeticatalog.com/search.asp?skw=SSALE020408&srccode=SE5752&gen1=Early+Spring+Savings :: Limited Quantities. Shop while supply lasts. :: _______________________________________________________ * If you do not wish to receive these promotional messages from us, please click this link: http://serengeticatalog.net/Serengeti/default.asp?action=u&ljqoa=jne@gvc.ceas-challenge.cc&mi=555291 Allow 7 to 10 business days to process your removal requests * For Customer Service issues please e-mail xxjl@serengeticatalog.com or call Toll Free: 800-426-2852. _______________________________________________________ Serengeti | 222 Mill Rd | Chelmsford, MA 01824-0949 Powered by Informz http://www.informz.com"
[opensuse] After SLES10 SP1 Update,"I know this might be the wrong place to ask this but i am hoping that someone else is using SLES10 and did an update today..... I have been updating php code all day today using gedit. This morning i did an update from ZMD and among other thing that were updated was readline. When i was finished updating code, i closed gedit....Then remembered i had to change something else before i called it quits. Much to my surprise, the file was all but black. Along with other files, blank. The reason i think it had something to do with the update or gedit, is b/c i tar'ed the folder up and copied it to my windoze box and said files have all the code in them???? I also opened the files in vim and they exhibited the same as gedit, some blank and some all but blank. I also restarted the server, same thing. Anybody else seen this?",0,fuzzer-LLM,"[opensuse] After SLES10 SP1 Update

I know this might be the wrong place to ask this but i am hoping that someone else is using SLES10 and did an update today..... I have been updating php code all day today using gedit. This morning i did an update from ZMD and among other thing that were updated was readline. When i was finished updating code, i closed gedit....Then remembered i had to change something else before i called it quits. Much to my surprise, the file was all but black. Along with other files, blank. The reason i think it had something to do with the update or gedit, is b/c i tar'ed the folder up and copied it to my windoze box and said files have all the code in them???? I also opened the files in vim and they exhibited the same as gedit, some blank and some all but blank. I also restarted the server, same thing. Anybody else seen this?"
Thank you for signing up with Uniqlo!,"Welcome to UNIQLO Enjoy your coupon for your next online purchase ‌ ‌ ‌ ‌ ‌ ‌ ‌ ‌ ‌ ‌ ‌ ‌ ‌ ‌ ‌ ‌ ‌ ‌ ‌ ‌ ‌ ‌ ‌ ‌ ‌ ‌ ‌ ‌ ‌ ‌ ‌ ‌ ‌ ‌ ‌ ‌ ‌ ‌ ‌ ‌ ‌ ‌ ‌ ‌ ‌ ‌ ‌ ‌ ‌ ‌ ‌ ‌ ‌ ‌ ‌ ‌ ‌ ‌ ‌ ‌ ‌ ‌ ‌ ‌ ‌ ‌ ‌ ‌ ‌ ‌ ‌ ‌ ‌ ‌ ‌ ‌ ‌ ‌ ‌ ‌ ‌ ‌ ‌ ‌ ‌ ‌ ‌ ‌ ‌ ‌ ‌ ‌ ‌ ‌ ‌ ‌ ‌ ‌ ‌ ‌ ‌ ‌ ‌ ‌ ‌ ‌ ‌ ‌ ‌ ‌ ‌ ‌ ‌ ‌ ‌ ‌ ‌ ‌ ‌ ‌ ‌ ‌ ‌ ‌ ‌ ‌ ‌ ‌ ‌ ‌ ‌ ‌ ‌ ‌ ‌ ‌ ‌ ‌ ‌ ‌ ‌ ‌ ‌ ‌ ‌ ‌ ‌ ‌ ‌ ‌ ‌ ‌ ‌ ‌ ‌ ‌ ‌ ‌ ‌ ‌ ‌ ‌ ‌ ‌ ‌ ‌ ‌ ‌ ‌ ‌ ‌ ‌ ‌ ‌ ‌ ‌ ‌ ‌ ‌ ‌ ‌ ‌ ‌ ‌ ‌ ‌: WOMEN | MEN View in a browser Follow us for news on the new LifeWear you need! UNSUBSCRIBE | CUSTOMER SUPPORT | PRIVACY POLICY | STORE LOCATOR Don't miss out, add email@us.uniqlo.com to your address book to make sure you get our emails. UNIQLO USA LLC 546-548 Broadway, 3rd floor New York NY 10012 | UNIQLO.COM *Colors, styles, prices and promotions may vary by location (online and in stores). Your email address : REDACTED+uniqlo@gmail.com",1,fuzzer-LLM,"Thank you for signing up with Uniqlo!

Welcome to UNIQLO Enjoy your coupon for your next online purchase ‌ ‌ ‌ ‌ ‌ ‌ ‌ ‌ ‌ ‌ ‌ ‌ ‌ ‌ ‌ ‌ ‌ ‌ ‌ ‌ ‌ ‌ ‌ ‌ ‌ ‌ ‌ ‌ ‌ ‌ ‌ ‌ ‌ ‌ ‌ ‌ ‌ ‌ ‌ ‌ ‌ ‌ ‌ ‌ ‌ ‌ ‌ ‌ ‌ ‌ ‌ ‌ ‌ ‌ ‌ ‌ ‌ ‌ ‌ ‌ ‌ ‌ ‌ ‌ ‌ ‌ ‌ ‌ ‌ ‌ ‌ ‌ ‌ ‌ ‌ ‌ ‌ ‌ ‌ ‌ ‌ ‌ ‌ ‌ ‌ ‌ ‌ ‌ ‌ ‌ ‌ ‌ ‌ ‌ ‌ ‌ ‌ ‌ ‌ ‌ ‌ ‌ ‌ ‌ ‌ ‌ ‌ ‌ ‌ ‌ ‌ ‌ ‌ ‌ ‌ ‌ ‌ ‌ ‌ ‌ ‌ ‌ ‌ ‌ ‌ ‌ ‌ ‌ ‌ ‌ ‌ ‌ ‌ ‌ ‌ ‌ ‌ ‌ ‌ ‌ ‌ ‌ ‌ ‌ ‌ ‌ ‌ ‌ ‌ ‌ ‌ ‌ ‌ ‌ ‌ ‌ ‌ ‌ ‌ ‌ ‌ ‌ ‌ ‌ ‌ ‌ ‌ ‌ ‌ ‌ ‌ ‌ ‌ ‌ ‌ ‌ ‌ ‌ ‌ ‌ ‌ ‌ ‌ ‌ ‌ ‌: WOMEN | MEN View in a browser Follow us for news on the new LifeWear you need! UNSUBSCRIBE | CUSTOMER SUPPORT | PRIVACY POLICY | STORE LOCATOR Don't miss out, add email@us.uniqlo.com to your address book to make sure you get our emails. UNIQLO USA LLC 546-548 Broadway, 3rd floor New York NY 10012 | UNIQLO.COM *Colors, styles, prices and promotions may vary by location (online and in stores). Your email address : REDACTED+uniqlo@gmail.com"
EU Trade Register 2025/2026 - your company information,"Hello, please add your company details to the EU Trade Register, the global platform for realiable business connections. Simply fill out the attached .pdf file with your information and return it to us. Alternatively, please reply with a photo of the completed document attached. Update your company information for free. unsubscribe: EU TRADE REGISTER GLOBAL TRADE REGISTER LTD. Phone: +359782138722 contact@traderegister.info unsubscribe@traderegister.info unsubscribe",1,fuzzer-LLM,"EU Trade Register 2025/2026 - your company information

Hello, please add your company details to the EU Trade Register, the global platform for realiable business connections. Simply fill out the attached .pdf file with your information and return it to us. Alternatively, please reply with a photo of the completed document attached. Update your company information for free. unsubscribe: EU TRADE REGISTER GLOBAL TRADE REGISTER LTD. Phone: +359782138722 contact@traderegister.info unsubscribe@traderegister.info unsubscribe"
[Action Required] Confirm Email Address,Please click the link here to confirm your email,1,fuzzer-LLM,"[Action Required] Confirm Email Address

Please click the link here to confirm your email"
