Subject,Body,label,data_source,text
Secrets of Invalidating Tax Assessments June 18,"UNCOVER THE STRATEGIES, TACTICS AND REMEDIES IN INVALIDATING TAX ASSESSMENT Hereunder is the list of our Upcoming Training Program: How to Prepare Performance Evaluation Forms and Performance Improvement Plans (PIP) - June 17 Reg. Link: https://forms.gle/wynM5hZ7zsYFGgJo7 Invalidating Tax Assessments вҖ“ June 18 Reg. Link: https://forms.gle/n3JRJHB4jGqjybWP8 Supervisory Leadership Development вҖ“ June 20 Reg. Link: https://forms.gle/YfuXNAhKHumQAVut5 Modern Procurement and Supply Management вҖ“ June 25 AM Reg. Link: https://forms.gle/X3umJ9houjAsh18n9 Warehouse Management Best Practices вҖ“ June 25 PM Reg. Link: https://forms.gle/nKyTrPLLUmeNqaDq8 Work Attitude and Values Enhancement вҖ“ June 27 AM Reg. Link: https://forms.gle/tEuhroo2PV11TPaG9 Accounting For Non-Accountants вҖ“ June 27 PM Reg. Link: https://forms.gle/mndSfjB3kXSWmVJU8 Invalidating Tax Assessments UNCOVER THE STRATEGIES, TACTICS AND REMEDIES IN INVALIDATING TAX ASSESSMENT June 18, 2025 2:00pm - 5:00pm *LIVE VIA ZOOM* Introduction: Are you or is your business being assessed (or likely to be assessed) by the B.I.R.? Have you received any notice (Letter of Authority, Tax Verification Notice, Subpoena Duces Tecum, and the like)? Are you prepared? You need to be aware of what exactly you need to do or you will stand to spend an arm and a leg. Uncover the strategies, tactics, and remedies in handling tax assessments, disputes, and claims for refunds. Course Objectives: This course is designed specifically for individuals and businesses currently facing tax assessments by the Bureau of Internal Revenue (B.I.R.) or those who anticipate an impending assessment. Participants will gain practical insights into strategies for addressing tax assessments, contesting erroneous claims, and pursuing tax refunds. By the end of the course, participants will be empowered to effectively manage and navigate their tax challenges, minimizing financial and legal risks. Major Takeaways: Develop strategies to respond to B.I.R. assessments and potential disputes. Recognize critical assessment stages and appropriate reactions to notices received. Identify common audit findings and learn how to effectively challenge them. Understand the tax refund process and the necessary steps for successful claims. Course Content Assessing Your Tax Assessment Situation a. Legal basis of authority to assess Taxpayer b. Prescriptive period of Tax Assessments * 3 years vs 10 years prescriptive period * Extension of period to assess through the issuance of waiver c. Types of BIR audit/investigation notices * Letter of authority, Letter Notice, Tax Verification Notice and Mission Order * Service of assessment notices d. Immediate Steps to Take Upon Receiving a Notice * Key actions to undertake to protect your interests. e. Submission of documents pursuant to BIR notice * Issuance of subpoena duces tecum * Application of the best evidence rule Understanding the Stages of Tax Assessment a. Notice of discrepancy (NOD) b. Preliminary Assessment Notice (PAN) Best practices for responding to a PAN to avoid a final assessment. c. Final Assessment Notice (FAN) What to do when you receive a FAN and how to build your case. d. Final Decision Disputed Assessment (FDA) Strategies for navigating the final resolution process and implications for your business. Challenging Common Audit Findings a. Questioning the validity of tax assessment at different stages of tax assessment Overview of frequent discrepancies found during audits and how they affect your assessment. b. Addressing factual and legal issues in tax assessment Crafting compelling arguments and gathering supporting documentation to challenge the assessment. Claiming Tax Refunds a. Understanding Refund Claims and Their Requirements Types of claims: Erroneously paid taxes versus overpaid input VAT. Identifying the prescriptive periods for claims and key documentation requirements. b. Rule on exhaustion of administrative remedies Knowing the procedural steps necessary to pursue your rights effectively. Featured Speaker: MR. SENEN QUIZON Tax Partner - Deloitte Philippines Senen has over 17 years of professional experience in tax services. His experience covers tax ruling assistance, tax investigation assistance, tax training, and tax consultancy for companies engaged in the Manufacturing, Life Sciences & Health Care, and Technology, Media & Telecommunications industries. Prior to joining Deloitte, he was the Chief of the Direct Taxes Branch of a government agency, where he conducted numerous studies in the area of direct tax and tax administration. During his stint in the government, he participated in the legislative process by drafting proposed tax legislations and serving as a resource person in public hearings on various tax measures. Senen is an Accredited Tax Practitioner of the Bureau of Internal Revenue and is a regular speaker at the Philippine Institute of Certified Public Accountants (PICPA). He worked for 10 years in another local accounting firm as part of its Tax Knowledge Center, which handles training and publications. He earned his degree in Bachelor of Science in Applied Economics from the Polytechnic University of the Philippines and received his MasterвҖҷs degree in Business Administration from Colegio de San Juan de Letran. He has also attended a variety of foreign tax training programs sponsored by JICA, IMF, and other multilateral agencie LEARNING INVESTMENT Invalidating Tax Assessments UNCOVER THE STRATEGIES, TACTICS AND REMEDIES IN INVALIDATING TAX ASSESSMENT June 18, 2025 2:00pm - 5:00pm *LIVE VIA ZOOM* REGISTRATION LINK: https://forms.gle/Qytikc5ycoMRE6ra8 ONLINE PER PAX Regular Rate Php 1,899.00 + VAT starting JUNE 12, 2025 Early Bird Rate Php 1,499.00 + VAT until JUNE 11, 2025 Group Rate Php 1,399.00 + VAT per pax for 5 вҖ“ 14 pax Super Group Rate Php 999.00 + VAT per pax for 15 or more pax BIRTHDAY MONTH PROMO - ONE (1) FREE SEAT Register within Your Birthday Month with at least 2 paid pax @Php1,899.00+ VAT per pax Must Present proof of date birth JOIN NOW PAY LATER PROMO - After 30 Days from the date of the Masterclass @Php2,099.00 + VAT per pax Inclusive of the Webinar Session, Presentation Materials and the Digital Certificate ATTENTION TO MS. JHIE For More Details, Inquiry or Reservation Please Call Us On: Ms. Jhie Marketing Officer EmailAddress: jhie.pmxtraining@gmail.com Tele Fax: 8470-1057 or Call/Text: 0906-4798186 Visit my FB PAGE @jhie.training You are receiving this email because you have opted into one of our sites or attended one of our events. In-House Training We can conduct the following in-house training for your company to make them more customized to your requirements: * Human Resource or HR * Labor Law * Taxation * Accounting * Supply Chain Management * Leadership, Management, Supervision * Soft Skills * Sales * Customer Service * Collection Want to change how you receive this email?manage preference В· unsubscribe",1,fuzzer-LLM,"Secrets of Invalidating Tax Assessments June 18

UNCOVER THE STRATEGIES, TACTICS AND REMEDIES IN INVALIDATING TAX ASSESSMENT Hereunder is the list of our Upcoming Training Program: How to Prepare Performance Evaluation Forms and Performance Improvement Plans (PIP) - June 17 Reg. Link: https://forms.gle/wynM5hZ7zsYFGgJo7 Invalidating Tax Assessments вҖ“ June 18 Reg. Link: https://forms.gle/n3JRJHB4jGqjybWP8 Supervisory Leadership Development вҖ“ June 20 Reg. Link: https://forms.gle/YfuXNAhKHumQAVut5 Modern Procurement and Supply Management вҖ“ June 25 AM Reg. Link: https://forms.gle/X3umJ9houjAsh18n9 Warehouse Management Best Practices вҖ“ June 25 PM Reg. Link: https://forms.gle/nKyTrPLLUmeNqaDq8 Work Attitude and Values Enhancement вҖ“ June 27 AM Reg. Link: https://forms.gle/tEuhroo2PV11TPaG9 Accounting For Non-Accountants вҖ“ June 27 PM Reg. Link: https://forms.gle/mndSfjB3kXSWmVJU8 Invalidating Tax Assessments UNCOVER THE STRATEGIES, TACTICS AND REMEDIES IN INVALIDATING TAX ASSESSMENT June 18, 2025 2:00pm - 5:00pm *LIVE VIA ZOOM* Introduction: Are you or is your business being assessed (or likely to be assessed) by the B.I.R.? Have you received any notice (Letter of Authority, Tax Verification Notice, Subpoena Duces Tecum, and the like)? Are you prepared? You need to be aware of what exactly you need to do or you will stand to spend an arm and a leg. Uncover the strategies, tactics, and remedies in handling tax assessments, disputes, and claims for refunds. Course Objectives: This course is designed specifically for individuals and businesses currently facing tax assessments by the Bureau of Internal Revenue (B.I.R.) or those who anticipate an impending assessment. Participants will gain practical insights into strategies for addressing tax assessments, contesting erroneous claims, and pursuing tax refunds. By the end of the course, participants will be empowered to effectively manage and navigate their tax challenges, minimizing financial and legal risks. Major Takeaways: Develop strategies to respond to B.I.R. assessments and potential disputes. Recognize critical assessment stages and appropriate reactions to notices received. Identify common audit findings and learn how to effectively challenge them. Understand the tax refund process and the necessary steps for successful claims. Course Content Assessing Your Tax Assessment Situation a. Legal basis of authority to assess Taxpayer b. Prescriptive period of Tax Assessments * 3 years vs 10 years prescriptive period * Extension of period to assess through the issuance of waiver c. Types of BIR audit/investigation notices * Letter of authority, Letter Notice, Tax Verification Notice and Mission Order * Service of assessment notices d. Immediate Steps to Take Upon Receiving a Notice * Key actions to undertake to protect your interests. e. Submission of documents pursuant to BIR notice * Issuance of subpoena duces tecum * Application of the best evidence rule Understanding the Stages of Tax Assessment a. Notice of discrepancy (NOD) b. Preliminary Assessment Notice (PAN) Best practices for responding to a PAN to avoid a final assessment. c. Final Assessment Notice (FAN) What to do when you receive a FAN and how to build your case. d. Final Decision Disputed Assessment (FDA) Strategies for navigating the final resolution process and implications for your business. Challenging Common Audit Findings a. Questioning the validity of tax assessment at different stages of tax assessment Overview of frequent discrepancies found during audits and how they affect your assessment. b. Addressing factual and legal issues in tax assessment Crafting compelling arguments and gathering supporting documentation to challenge the assessment. Claiming Tax Refunds a. Understanding Refund Claims and Their Requirements Types of claims: Erroneously paid taxes versus overpaid input VAT. Identifying the prescriptive periods for claims and key documentation requirements. b. Rule on exhaustion of administrative remedies Knowing the procedural steps necessary to pursue your rights effectively. Featured Speaker: MR. SENEN QUIZON Tax Partner - Deloitte Philippines Senen has over 17 years of professional experience in tax services. His experience covers tax ruling assistance, tax investigation assistance, tax training, and tax consultancy for companies engaged in the Manufacturing, Life Sciences & Health Care, and Technology, Media & Telecommunications industries. Prior to joining Deloitte, he was the Chief of the Direct Taxes Branch of a government agency, where he conducted numerous studies in the area of direct tax and tax administration. During his stint in the government, he participated in the legislative process by drafting proposed tax legislations and serving as a resource person in public hearings on various tax measures. Senen is an Accredited Tax Practitioner of the Bureau of Internal Revenue and is a regular speaker at the Philippine Institute of Certified Public Accountants (PICPA). He worked for 10 years in another local accounting firm as part of its Tax Knowledge Center, which handles training and publications. He earned his degree in Bachelor of Science in Applied Economics from the Polytechnic University of the Philippines and received his MasterвҖҷs degree in Business Administration from Colegio de San Juan de Letran. He has also attended a variety of foreign tax training programs sponsored by JICA, IMF, and other multilateral agencie LEARNING INVESTMENT Invalidating Tax Assessments UNCOVER THE STRATEGIES, TACTICS AND REMEDIES IN INVALIDATING TAX ASSESSMENT June 18, 2025 2:00pm - 5:00pm *LIVE VIA ZOOM* REGISTRATION LINK: https://forms.gle/Qytikc5ycoMRE6ra8 ONLINE PER PAX Regular Rate Php 1,899.00 + VAT starting JUNE 12, 2025 Early Bird Rate Php 1,499.00 + VAT until JUNE 11, 2025 Group Rate Php 1,399.00 + VAT per pax for 5 вҖ“ 14 pax Super Group Rate Php 999.00 + VAT per pax for 15 or more pax BIRTHDAY MONTH PROMO - ONE (1) FREE SEAT Register within Your Birthday Month with at least 2 paid pax @Php1,899.00+ VAT per pax Must Present proof of date birth JOIN NOW PAY LATER PROMO - After 30 Days from the date of the Masterclass @Php2,099.00 + VAT per pax Inclusive of the Webinar Session, Presentation Materials and the Digital Certificate ATTENTION TO MS. JHIE For More Details, Inquiry or Reservation Please Call Us On: Ms. Jhie Marketing Officer EmailAddress: jhie.pmxtraining@gmail.com Tele Fax: 8470-1057 or Call/Text: 0906-4798186 Visit my FB PAGE @jhie.training You are receiving this email because you have opted into one of our sites or attended one of our events. In-House Training We can conduct the following in-house training for your company to make them more customized to your requirements: * Human Resource or HR * Labor Law * Taxation * Accounting * Supply Chain Management * Leadership, Management, Supervision * Soft Skills * Sales * Customer Service * Collection Want to change how you receive this email?manage preference В· unsubscribe"
"Final Reminder: , renew your TotalAV subscription today!","Your Total AV Subscription Has Expired Urgent: Your subscription has expired! You have 24 hours to renew it and maintain your protection. Your Total AV Total Protection for Windows subscription expired on 11/03/2025. Without renewal, your devices could be vulnerable to viruses, malware, and identity theft. Immediate action required! Your devices are unprotected and at risk... Account ID: 4646778UK User: @hotmail.co.uk Serial Number: 9LS0 UOBT 3U2O LQHM Discount: 92.99% DISCOUNT Offer valid until: 11/03/2025 RENEW NOW Dear , Despite multiple notifications and warnings, we have not received a response. Your protection against cyber threats is seriously at risk. Renew your subscription immediately to ensure uninterrupted protection against cyberattacks and hackers. Your safety is our top priority.",1,fuzzer-LLM,"Final Reminder: , renew your TotalAV subscription today!

Your Total AV Subscription Has Expired Urgent: Your subscription has expired! You have 24 hours to renew it and maintain your protection. Your Total AV Total Protection for Windows subscription expired on 11/03/2025. Without renewal, your devices could be vulnerable to viruses, malware, and identity theft. Immediate action required! Your devices are unprotected and at risk... Account ID: 4646778UK User: @hotmail.co.uk Serial Number: 9LS0 UOBT 3U2O LQHM Discount: 92.99% DISCOUNT Offer valid until: 11/03/2025 RENEW NOW Dear , Despite multiple notifications and warnings, we have not received a response. Your protection against cyber threats is seriously at risk. Renew your subscription immediately to ensure uninterrupted protection against cyberattacks and hackers. Your safety is our top priority."
Meet Us in June вҖ“ Get Up to $8M Credit for Sourcing,"Hi there,We are an award-winning supply chain solutions provider based in China, with 18 years of experience delivering end-to-end sourcing, procurement, and logistics support.Your Dedicated Buying Office in ChinaWe provide O/A 60, 90, or even 120-day payment terms to qualified and reputable customers.Let's discuss further if you need. WhatsApp/Wechat:+8618859944933Please reply ""no"" if you need to unsubcribe.Thanks.",1,fuzzer-LLM,"Meet Us in June вҖ“ Get Up to $8M Credit for Sourcing

Hi there,We are an award-winning supply chain solutions provider based in China, with 18 years of experience delivering end-to-end sourcing, procurement, and logistics support.Your Dedicated Buying Office in ChinaWe provide O/A 60, 90, or even 120-day payment terms to qualified and reputable customers.Let's discuss further if you need. WhatsApp/Wechat:+8618859944933Please reply ""no"" if you need to unsubcribe.Thanks."
Account Suspention Notice!,"Hello, Your mailbox space is almost full and 3 incomming emails are on hold. Please upgrade your account to recieve extra 5 gb added to your mailbox space for free. ГӮ Upgrade Your Mailbox Space Security Alert: Help protect your account access by confirming security alerts to notify you of important sign-on related activity. Thank you for usingГӮ monkey.org for your communication needs.",1,fuzzer-LLM,"Account Suspention Notice!

Hello, Your mailbox space is almost full and 3 incomming emails are on hold. Please upgrade your account to recieve extra 5 gb added to your mailbox space for free. ГӮ Upgrade Your Mailbox Space Security Alert: Help protect your account access by confirming security alerts to notify you of important sign-on related activity. Thank you for usingГӮ monkey.org for your communication needs."
File is pending approval,"File is pending approval Take Action 3 ways to get more space You received this email to let you know about important changes to your Google Account and services. В© 2019 Google Inc.,1600 Amphitheatre Parkway, Mountain View, CA 94043, USA",1,fuzzer-LLM,"File is pending approval

File is pending approval Take Action 3 ways to get more space You received this email to let you know about important changes to your Google Account and services. В© 2019 Google Inc.,1600 Amphitheatre Parkway, Mountain View, CA 94043, USA"
