Subject,Body,label,data_source,text
Your New Account,"AdvoCare View as webpage YOUR NEW ACCOUNT Dear Honey Potter, You have successfully created a new account. You can visit your account at https://www.advocare.com/account/. If you did not make this change to your account, please contact AdvoCare Customer Service at customerservice@advocare.com or 1-800-542-4800. Your AdvoCare Customer Service Team This is an automatically generated email, please do not reply. This email was sent to: REDACTED+advocare@gmail.com This email was sent by: AdvoCare International, LLC 2800 Telecom Pkwy Richardson, TX, 75082, US www.advocare.com customerservice@advocare.com1-800-542-4800 В© 2023 AdvoCare International We respect your right to privacy - view our policy. Manage Subscriptions | Update Profile | Unsubscribe",1,fuzzer-LLM,"Your New Account

AdvoCare View as webpage YOUR NEW ACCOUNT Dear Honey Potter, You have successfully created a new account. You can visit your account at https://www.advocare.com/account/. If you did not make this change to your account, please contact AdvoCare Customer Service at customerservice@advocare.com or 1-800-542-4800. Your AdvoCare Customer Service Team This is an automatically generated email, please do not reply. This email was sent to: REDACTED+advocare@gmail.com This email was sent by: AdvoCare International, LLC 2800 Telecom Pkwy Richardson, TX, 75082, US www.advocare.com customerservice@advocare.com1-800-542-4800 В© 2023 AdvoCare International We respect your right to privacy - view our policy. Manage Subscriptions | Update Profile | Unsubscribe"
ThereвҖҷs a new Chris Johnston column online now,"New from Chris Johnston Just published: Change is coming to the Maple Leafs. But for the better? вҖҢ вҖҢ вҖҢ вҖҢ вҖҢ вҖҢ вҖҢ вҖҢ вҖҢ вҖҢ вҖҢ вҖҢ вҖҢ вҖҢ вҖҢ вҖҢ вҖҢ вҖҢ вҖҢ вҖҢ вҖҢ вҖҢ вҖҢ вҖҢ вҖҢ вҖҢ вҖҢ вҖҢ вҖҢ вҖҢ вҖҢ вҖҢ вҖҢ вҖҢ вҖҢ вҖҢ вҖҢ вҖҢ вҖҢ вҖҢ вҖҢ вҖҢ вҖҢ вҖҢ вҖҢ вҖҢ вҖҢ вҖҢ вҖҢ вҖҢ вҖҢ вҖҢ вҖҢ вҖҢ вҖҢ вҖҢ вҖҢ вҖҢ вҖҢ вҖҢ вҖҢ вҖҢ вҖҢ вҖҢ вҖҢ вҖҢ вҖҢ вҖҢ вҖҢ вҖҢ вҖҢ вҖҢ вҖҢ вҖҢ вҖҢ вҖҢ вҖҢ вҖҢ вҖҢ вҖҢ вҖҢ вҖҢ вҖҢ вҖҢ вҖҢ вҖҢ вҖҢ вҖҢ вҖҢ вҖҢ вҖҢ вҖҢ вҖҢ вҖҢ вҖҢ вҖҢ вҖҢ вҖҢ вҖҢ вҖҢ вҖҢ вҖҢ вҖҢ вҖҢ вҖҢ вҖҢ вҖҢ вҖҢ вҖҢ вҖҢ вҖҢ вҖҢ вҖҢ вҖҢ вҖҢ вҖҢ вҖҢ вҖҢ вҖҢ вҖҢ вҖҢ вҖҢ вҖҢ вҖҢ вҖҢ вҖҢ вҖҢ вҖҢ вҖҢ вҖҢ вҖҢ вҖҢ вҖҢ вҖҢ вҖҢ вҖҢ вҖҢ вҖҢ вҖҢ вҖҢ вҖҢ вҖҢ вҖҢ New from Chris Johnston OPINION Change is coming to the Maple Leafs. But for the better? Read more В» Looking for more from Chris Johnston? Here are more of his latest columns on thestar.com. Get unlimited access to the Star Limited time sale: Only $1/week for 52 weeks Get This Offer If you're not enjoying these emails, please tell us how we can make them better by emailing storyalertfeedback@thestar.ca. Or, if you'd prefer, you can unsubscribe from this story alert by clicking the first link below. Unsubscribe From This Story Alert Sign Up for More Newsletters and Email Alerts View in Browser Toronto Star Newspapers Limited. One Yonge Street, 4th Floor, Toronto, ON M5E 1E6. 416-367-2000 PRIVACY POLICY - - - - - - - - - - - - - - - - - - - - - - - - - - - - - - - - -",1,fuzzer-LLM,"ThereвҖҷs a new Chris Johnston column online now

New from Chris Johnston Just published: Change is coming to the Maple Leafs. But for the better? вҖҢ вҖҢ вҖҢ вҖҢ вҖҢ вҖҢ вҖҢ вҖҢ вҖҢ вҖҢ вҖҢ вҖҢ вҖҢ вҖҢ вҖҢ вҖҢ вҖҢ вҖҢ вҖҢ вҖҢ вҖҢ вҖҢ вҖҢ вҖҢ вҖҢ вҖҢ вҖҢ вҖҢ вҖҢ вҖҢ вҖҢ вҖҢ вҖҢ вҖҢ вҖҢ вҖҢ вҖҢ вҖҢ вҖҢ вҖҢ вҖҢ вҖҢ вҖҢ вҖҢ вҖҢ вҖҢ вҖҢ вҖҢ вҖҢ вҖҢ вҖҢ вҖҢ вҖҢ вҖҢ вҖҢ вҖҢ вҖҢ вҖҢ вҖҢ вҖҢ вҖҢ вҖҢ вҖҢ вҖҢ вҖҢ вҖҢ вҖҢ вҖҢ вҖҢ вҖҢ вҖҢ вҖҢ вҖҢ вҖҢ вҖҢ вҖҢ вҖҢ вҖҢ вҖҢ вҖҢ вҖҢ вҖҢ вҖҢ вҖҢ вҖҢ вҖҢ вҖҢ вҖҢ вҖҢ вҖҢ вҖҢ вҖҢ вҖҢ вҖҢ вҖҢ вҖҢ вҖҢ вҖҢ вҖҢ вҖҢ вҖҢ вҖҢ вҖҢ вҖҢ вҖҢ вҖҢ вҖҢ вҖҢ вҖҢ вҖҢ вҖҢ вҖҢ вҖҢ вҖҢ вҖҢ вҖҢ вҖҢ вҖҢ вҖҢ вҖҢ вҖҢ вҖҢ вҖҢ вҖҢ вҖҢ вҖҢ вҖҢ вҖҢ вҖҢ вҖҢ вҖҢ вҖҢ вҖҢ вҖҢ вҖҢ вҖҢ вҖҢ вҖҢ вҖҢ вҖҢ вҖҢ вҖҢ вҖҢ New from Chris Johnston OPINION Change is coming to the Maple Leafs. But for the better? Read more В» Looking for more from Chris Johnston? Here are more of his latest columns on thestar.com. Get unlimited access to the Star Limited time sale: Only $1/week for 52 weeks Get This Offer If you're not enjoying these emails, please tell us how we can make them better by emailing storyalertfeedback@thestar.ca. Or, if you'd prefer, you can unsubscribe from this story alert by clicking the first link below. Unsubscribe From This Story Alert Sign Up for More Newsletters and Email Alerts View in Browser Toronto Star Newspapers Limited. One Yonge Street, 4th Floor, Toronto, ON M5E 1E6. 416-367-2000 PRIVACY POLICY - - - - - - - - - - - - - - - - - - - - - - - - - - - - - - - - -"
